lang	sentiment	text
est	-1	Mujal maailmas on politseipatrullid tänavatel. Nad on enamasti jalgsi, aga ka rataste või hobustega. Neid on näha! Juba sellest piisab, et pätid, vabandust, lapsed, paremini käituma hakkaksid. Meie politsei end näidata ei taha.
est	-1	Ons põhjuseks ka Eesti väiksus, talentide puudus?
est	-1	Narvas 95% venelasi, Ida-Virumaal 60%, Tallinnas võibolla ka juba 60%.
est	-1	Sest täpsustagem kohe: eestlast ei huvita eeskätt see, mida elevant arvab temast kui indiviidist, vaid kui ühe grupi esindajast, s.o rahvuskehandist, kes elab Kodu-Eestis või esindab seda. Juba sellega erineb ta põhimõtteliselt ameeriklasest, sakslasest jt, kes reeglina ei mõtle puuri ees endast kui rahvuse esindajast.
est	-1	Põhja ringkonnaprokuratuuri pressinõunik Arno Põder ütles Postimehele, et meeste suhtes algatati kriminaalmenetlus karistusseadustiku ähvardamist käsitleva paragrahvi alusel. Süüdimõistmisel võib neid oodata rahatrahv või kuni aastane vangistus.
est	-1	Major Cleberson Braida Bastianello rääkis pressikonverentsil, et õnnetuses hukkus vähemalt 245 inimest, lisaks sai viga 48 inimest.
est	-1	Saksa loomaaias tappis tiiger talitaja
est	-1	Paraku on Rail Baltic läinud iseenese harrastustarkuse teed. Ise otsustatakse, ise tehakse. Kujutage ette perearsti, kes avastab oma patsiendil võimaliku pimesoolepõletiku. Selle asemel et ta kirurgi juurde saata, asutakse koos hambaarstist naabrimehega pimesoolt välja lõikama. Raamatupidaja võetakse ka appi.
est	-1	Kel avas silmad, kes vaatab ammu välismaalt...
est	-1	Mick leidis ekskallima veidi enne seda, kui olnuks juba hilja. Skandaali vältimiseks lasi Jaggeri mänedžment neiu erakaubikuga haiglasse toimetada ja valenime all sisse smugeldada.
est	-1	Indialased ei viitsi oma kodumaalgi tänavaid pühkida, liiga palju oleks loota, et veel kusagil Eestis. Eriti veel, kui naine kodus, kes elamise pea kohale ja leiva lauale annab.
est	-1	Eile kella 21.57 ajal toimus liiklusõnnetus Tartus Ilmatsalu ja Betooni tänavate ristmikul. Sõiduauto Volkswagen tegi ootamatult vasakpöörde ja sõitis ette vastuliikunud mopeedile Feiling.
est	-1	Minuarust on ikka need halvustavate kommenraaride panijad ühed veidralt kibestunud inimesed! Haige...
est	-1	Kas sa kohe üldse ei loe enne kommenteerimist? Juttu polnud purjust olemisest, vaid rongis alkoholi tarvitamisest.
est	-1	Mul on kahju, et eestlased on nii kitsarinnalised, et hindavad inimesi ainult nende rassi järgi. Tegelikult olete te siin sappi pritsinud inimese kohta, kellest te midagi ei tea ja keda te ei tunne. Pole ka ime, et Eesti naised endale välismaiseid mehi otsivad, kui Eesti mehed sellised sapised lontud on. Eesti mees peaks kõigepealt peeglisse vaatama ja veenduma, et ta üldse mehe nime väärib ja siis teisi kommenteerima hakkama.
est	-1	Mõne silmis olen paadunud rahvuslane. Moodsamad mehed ütlevad: «Ei no mis! Haridus peab olema kvaliteetne – peab kutsuma siia ükskõik kelle, kes räägib inglise keeles, hea oleks, kui lapsed läheksid kõik inglise keele peale üle!» Kui niisugust juttu räägivad targad, haritud inimesed, siis kas see ei ole reetmine …
est	-1	Meest kahtlustatakse tänavu 1. augustil Tallinnas Kopli tänaval toime pandud röövimises, teatas Põhja prefektuuri pressiesindaja.
est	-1	miks langevad naised nii madalale,et alasti kisuvad, kui palju makstakse selle eest….
est	-1	Eestis on tänavu üheksa kuuga uppunud 48 inimest, mida on kümne võrra enam kui mullu samal ajal.
est	-1	Neljandaks pannakse kohalikele omavalitsustele ja koolidirektoritele õigusaktidega kohustused, mille täitmiseks ei eraldata piisavalt raha. Nii on see praeguseks juhtunud näiteks riigi lubatud tasuta koolitoiduga põhikooliõpilastele – riik toetab koolilõuna maksumust vaid osaliselt, puuduva osa peab aga leidma KOV.
est	-1	Kuid kas keegi võiks pingi tagumisest otsas tulevikus põhimeeste sekka kerkida? Raadikust oli juba juttu, piisavalt palju on talle antud võimalusi, ent mees pole neid kasutanud. Timo Eichfuss tõusis mõned aastad tagasi Muhu raketina koduse korvpalli tegijate hulka, kuid viimastel hooaegadel pole areng jätkunud, pigem vastupidi… Kõige loogilisem kerkija võiks olla mängujuht Martin Dorbek, kuid ei saa unustada, et tema kohal on juba ees vennad Sokud.
est	-1	VEB Fondi teemaga aastaid tegelenud ajakirjanik Toomas Kümmel kirjutab Postimehe arvamusportaalis, et Siim Kallas jättis oma tänases temaatilises arvamusloos tegelikult olulistele küsimustele vastamata.
est	-1	...Saaremaal juhtunud õnnetus 6a poisiga, näitap meie võimekust.....???
est	-1	Böhlmann märkis, et ainus takistus kahe riigi vahelisele koostööle on Saksamaa võetud kohustused Euroopa Liidus, kuna osa majandust puudutavaid küsimusi tuleb euroliidus langetada ühiselt.
est	-1	Milliste koerustükkidega filmi- ja laulumees aga poisikesena hakkama sai, et vanaema teda niimoodi karistas? "Eks ma lõhkusin mõne hinnalise asja ära või ei allunud tema käskudele-keeldudele," arvab Volmer. "Kuid ega ta kogu aeg siis ka nii ei teinud. Tegelikult ma mäletan paari sellist korda ja see nagu kinnistus mu mällu." Siiski nendib Volmer, et see pole ainuke pimedusehirmu tekkimise põhjus.
est	-1	Hakaku hoopis poliitikuks! Vaadake,kuhu Ansip on jõudnud ja Tallinna volikogus on ka üks must,seltsis segasem :-)
est	-1	Tõmmaku elevandimaale minema-kellele neid väikseid murjameid siin vaja on kui tööd ei leia.
est	-1	Mingit sööklat nägin ainult. Okei, üks kontorilaud oli ka, aga mingit suurt tungi küll ei tekitanud. Meil palju lahedam kontor (:
est	-1	Veretöö asjaolud hakkasid ilmnema alles kolmapäeval. Borno osariigi telefonivõrk lülitati välja mais keskpaigas, kui võimud kehtestasid riigi kirdeosas erakorralise seisukorra, et alustada armee suurpealetungi.
est	-1	Hispaanias vahistati salakaubanduses kahtlustatav Eesti kodanik
est	-1	Umbes kolmandik 200 miljonist töötust maailmas on alla 25 aasta vanad.
est	-1	Juulis uppus Eestis kümme inimest, ülejäänud kuudel on uppunute arv olnud oluliselt väiksem. Mais uppus seitse, juunis viis, septembris viis, jaanuaris kaks, veebruaris kaks, märtsis üks ja aprillis samuti üks inimene.
est	-1	Samas on aga vähearenenud maapiirkondades tüdrukute koolipääs takistatud traditsioonide ning konservatiivse suhtumise tõttu.
est	-1	Samade oskustega töökaaslane sai just sule sappa.
est	-1	Sotsiaalminister on hädas. Eesti sotsiaalsüsteem vajab otsustavat reformi. Ideid, kuidas asju muuta, aga ei ole. Ainus mõte on kärpida, kavalusega ja tulevikku vaatamata, kirjutab ajakirjanik Tiina Kangro.
est	-1	Ei, ühest küljest oli härra Athol Fugard muidugi geniaalne, et ta just selle tõsiloo välja valis. Paremat ei saa tahtagi. Situatsiooni ahistus sünnitab võimsa pääsemisootuse. See oli see, mis mõjus. Aga see mage tekst! Need poolsuured sõnad ühe vene talumehe suus, see poolfilosoofiline targutus. Aafrika kirjaniku fantaasia Nõukogude Vene oludest Eesti laval. Palju suurema ringiga enam tulla ei saakski. Aga võib-olla oleks see kõik meelest ära läinud, kui sel isemoodi jõhkral ja naljakal mugavusetragöödial oleks olnud vääriline lõpp.
est	-1	miinust laduda ple vaja sest seda vois lugeda moni aeg tagasi samast ohtulehest
est	-1	Bone suri peaaegu silmapilkselt, Hughes oli natuke kauem elus.
est	-1	vastu kõlab mantra: "matsid jäävad matsiteks".
est	-1	Lõpuks pean aga tunnistama, et pea suvaline kontsert on natuke parem kui plaadikuulamine. Kas see peab lõpuni paika ka Nokias kitsas ja hapnikuvaeses saalis, pole juba Alice Cooperi probleem.
est	-1	Paistab, et Rail Balticu trassi valik Eestis läks kohe algul valesse rööpasse. Algsete lähtekohtade mõtestamisel tehti põhimõtteline viga. Seda käsitleti ainitiselt majandusliku otsustusena. Veel halvem, otsustuse aluseks ei olnud niivõrd Eesti, kuivõrd kusagil eemal asuva majanduse vajadused.
est	-1	Välisministeerium edastas teate, milles seisis, et islamiorganisatsiooni al-Shabaab korraldatud rünnakus osales kaks ameeriklast ja üks inglanna.
est	-1	Poiss ei ole ainus noor usbekk, kelle elu tänavune puuvillakoristus on nõudnud. Möödunud nädalal jõudis uudistesse teade tudengist, kes Kaškadarjo piirkonnas kohustusliku puuvillakoristuse ajal ühe kaasüliõpilase surnuks pussitas ja veel kolme vigastas. Kuu alguses suri samuti Kaškadarjos puuvillakoristusel olnud tudeng, kes puudutas kogemata pinge all elektrikaablit.
est	-1	MIs seal ikka. Võtku abirahade järjekorda. Need muidusööjad ju selleks eesti naistega abielluvadki....
est	-1	Kanepi lasi käest suurepärase võimaluse
est	-1	Lahendus on põnev ja isegi ehmatav, sest akendest avanevad merevaated mõjuvad ka ise kunstiteostena maalide ja skulptuuride vahel.
est	-1	Mulle avanes võimalus Krimmi kodanikuks saada ja mitte üks konn ei köhi!
est	-1	«On aeg tunnistada, et probleem on palju sügavam ja haridusküsimusi lahendatakse meil politseiriigi meetoditega,» rõhutas abilinnapea. Kõlvarti sõnul põhineb KaPo laadsete struktuuride töö igas riigis hirmutundel. «Mida rohkem selliseid fakte maha vaikida, seda suurem on hirm. Kutsun kõiki, kellega on selliseid vestlusi läbi viidud, üles need juhtumid avalikustama,» ütles Kõlvart.
est	-1	ÜRO nõuab Afganistani tüdrukute õiguste eest seismist, sest selle riigi tütarlastest üle poole sunnitakse abielluma lastena ning kuuendik abiellub enne 15. eluaastat.
est	-1	Piraatlusena võib käsitleda ka kirjastuse Steamark poolt 2003. aastal uuesti välja antud Elar Kuusi raamatut «Lugu pöialpoisist, kotkast ja sitikast» (sarjast «Looduse lasteraamat» 1936), sest jälle ei ole keegi teose avaldamise puhul omastelt luba küsinud.
est	-1	Vahesaare sõnul on haigestunuid tänaseks 80, mõned neist saavad veel ravi ja mõningad ootavad analüüside vastuseid.
est	-1	«Kohus nõustub sellise seisukohaga, sest alkoholi tarvitanuna ei ole süüdimõistetu suuteline ennast talitsema. Ka on tal tasumata rahalisi nõudeid üle 6000 euro ulatuses, mistõttu ei ole välistatud, et kehva majandusliku olukorra tõttu paneb ta toime uue vägivallaga seotud kuriteo,» seisab kohtumääruses.
est	-1	Aga on tõsi, et hulk kommentaatoreid ei oska käituda. Ma julgen öelda, et nad käituvad teadlikult nii, nagu ei tohiks. Nad on üldjuhul (palgalised) provokaatorid ja lihtsalt õelad, halvad ja harimatud inimesed. Kusjuures ma väljendan end rõhutatult viisakalt.
est	-1	Ansip, sa ei tunne seatust!!!
est	-1	Mis pudutab suitukonisi, sis meie naaber neid akna kaudu loobib paremale ja vasakule, täitsa eestlane ja noor mees. Ei usu, et tema tahab kedagi saata Siberisse, tema lihtsalt on oma vanemate(!) kasvatamata laps.
est	-1	Piirilinnas Narvas hõõgub nagu tuli tuha all rahulolematus ühiskondliku transpordiga. Harvade väljumistega liinigraafikud ja sagedasti ka ebasobivad marsruudid ei jäta reisijale erilist valikut – parem juba käia jala või mõnikord kasutada taksot.
est	-1	Kuigi rünnakud olid teisipäeval New Yorgi piirkonna lehtede esikülgedel, hoidsid New York Times ja tabloid Post sündmust käsitlevad artiklid esiküljest eemal.
est	-1	Raugaeas veel lapsi sigitada. See mees ei olnud sugugi rohkem mõistuse juures kui ta naine. Ostnud sellise "häärberi," mis iga minut kokku kukkumas. Kas tõesti lootis selle üles ehitada? Kohutav , millistes tigimustes lapsed elavad. Ei suutnud uinuda. Mõtlesin, et miks nendele lastele ei ehitatud ka normaalset kööki ja veel tähtsam, vannituba?
est	-1	Enamasti askeldatakse, räägitakse lobajuttu ning vigisetakse argipäevas. Mõni rabab kolmel kohal korraga, vaba aeg möödub teleka ees, kerge seks lahutab ka meelt ja ongi kõik. Kas ikka on?
est	-1	Ometi oli aga minu jaoks pisut üllatav reaktsioonide ägedus. Kõige ägedamad reaktsioonid tulid loomulikult nende poolt, keda manifest puudutas negatiivselt.
est	-1	Teistest parem olemine ja rohkem pingutamine pole tähtis mitte ainult õpingutes ja esimesel-teisel töökohal, vaid kogu 55 aktiivse tööaasta jooksul. Meditsiini arenedes ja tööjõupuuduse olukorras peab noor põlvkond arvestama, et enne pensipõlve on vaja rõõmsa toimekusega sisustada rohkem tööaastaid kui tänapäeva ühiskonnas. 75-aastased töötajad on 50 aasta pärast norm, mitte erand.
est	-1	Pressikonverentsil pisaratega võideldes tõi Baruto karjääri lõpe­tamise põhjusena välja vigastatud vasaku põlve, mis kuidagi ei paranevat. Enne sügisest suurt sumoturniiri langes Baruto kõrgemast sumoliigast makuuchi’st madalamasse juryo liigasse. (Kõrgemast sumoliigast kukkumine on otseselt seotud kevadise sumoturniiri katkestamise ning juulikuisest Nagoya turniirist kõrvalejäämisega.)
est	-1	kõik ta armukesed on ühte nägu
est	-1	Ajakirjanikuna ei saa ma politseile soovitada peksasaamise mahavaikimist, aga maksumaksja ja kodanikuna on tunne, et vähemalt piinlikud eneseõigustused oleksid võinud ära jääda.
est	-1	Kella 7.38 ajal toimus liiklusõnnetus Harjumaal Saku vallas Kanama-Üksnurme tee 2. kilomeetril, kus mopeed Aprillia, mida juhtis 35-aastane Kõu, kaotas juhitavuse ja sõitis teelt välja kraavi. Mopeedijuht, kes esialgsetel andmetel kandis kaitsekiivrit, toimetati Põhja-Eesti Regionaalhaiglasse.
est	-1	Kahevahel olija on kõige raskemas seisus, identiteedikriis on hirmus asi. Kuna eestlane ei tea, kas ta on päris «valge» või «hall», on tema vastav värvimeel teravustunud nagu kõikidel marginaalidel.
est	-1	Ometi ei saavutata tulemusi uksi paugutades. Küll aga annab see mõneaastase ajavahemiku jooksul, mis jääb valimiste vahele, piisavalt pinnast poliitiliseks eduks neile, kes ütlevad end teadvat teed kergete lahenduste ja hõlpsa eluni. Nii võib Euroopa end kunagi jälle kalli hinnaga rusudest üles ehitamas leida. Peaksime olema ajaloost nii palju õppinud, et osata seda vältida.
est	-1	Institutsionaalse akrediteerimise üks suurimaid väljakutseid oli põhjendada väljakujunenud hariduskeskustest (Tallinn ja Tartu) eemal asuvate SKA õppeüksuste jätkusuutlikkust. 2010. ja 2011. aasta õppejõudude valimised näitasid, et kuni 30 protsenti turu keskmisest kõrgema palga ning tasuta elamispinna lubamine ei toonud regionaalsete keskuste õppejõudude kohtadele konkurssi. Tallinnas ja Murastes oli seevastu reaalne konkurss (2,2 kohale).
est	-1	Et olgu lapsed ilma rahata? Kas oled kesik või helme rasvaliitlane? Kuidas saab üldse nii väiklane olla?
est	-1	Hetkel, mil meespeaosa Oscari võitja välja kuulutati, nägi kogu maailm DiCapriot, kes teleekraanil pisaraid vaevu tagasi hoidis. Kohe täitus ka kogu maailma sotsiaalmeedia DiCapriole kaasatundvate hüüatustega: "Vaene Leo!"
est	-1	Üheksa päeva aresti määrati 41-aastasele mehele, kes laupäeval kella 10.51 ajal juhtis joobnuna Imavere-Viljandi-Karksi-Nuia maanteel sõidukit Opel Astra, teatas Lõuna prefektuur.
est	-1	Võib ka nii öelda. Elasin lähedaste armust. Tarbisin ainult hädapärast, st sööki. Ja napsi vahel ka. Mulle pole palju vaja. Ma ei oskagi rahaga ümber käia. Mul on vaese inimese kompleks: kui raha saan, laristan kohe ära. (Naerab.)
est	-1	Süüdistuse järgi tungisid mehed 2004. aastal ööl vastu 4. oktoobrit Viljandi kesklinnas kallale toona 17-aastasele neiule, tirisid ohvri ühe maja hoovi ja vägistasid ta seal. Pärast vägistamist talutas Maisalu neiu Viljandist välja ja lükkas ta linna lähedal ojja.
est	-1	«Kahtluse korral palume helistada mupo infonumbril 14410 ja võimalikult täpselt kirjeldada kahtlusalust autot, ütelda sõiduki registrinumber ning asukoht,» ütles Rand.
est	-1	Põhimõtteliselt nõustun BB-ga, kuid ainult teatud osas. Esiteks sooviksin ma teada saada tema arstide nimesid, kes teadsid tema haigusest, kliinikuid, kus ta oli ravil, röntgenpilte oma kasvajast jt. ning alles siis muutub tema jutt mulle usutavaks. Imelisi tervenemisi on alati olnud, iseasi mis on selle tervenemise põhjuseks. Kui nüüd seesama tädi tahab öelda, et oma mõttejõuga parandame kõik oma haigused ära, siis ta jätab jälle mainimata, et kõik ei oma tugevat mõttejõudu. Tädi ise ole varem uinamuinnaga tegelenud, kuid vaatamata sellele haigeks jäänud. Kuid kui nüüd meie new-eidzlased hakkavad ennast mõttejõuga vähki tervendama, siis ma võin ette kujutada, mis sellest välja tuleb. Isegi suur jumalamees Sai Baba ei saanud oma haigusest jagu, vaid igast ilmakaarest käisid tervendajad tema juures. Kuhu see tema positiivne mõttejõud siis kadus? Haiguse põhjuseks oli järelikult tema negatiivne mõtlemine ja emotsioonid? Haloo, tulge mõistusele.
est	-1	kui loll peab inimene olema, et seda poliitvangerdust uskuma jääda...
est	-1	Tartu Ülikooli emeriitprofessori Tiit-Rein Viitso rõhutab, et sõna 'maismaapiir' tohivad ka juristid ning riigikogu kasutada ainuüksi maismaal paiknevat piiri silmas pidades, mitte selle tähendust moonutades.
est	-1	Põhja-Tallinna linnaosa ei ole pidanud võimalikuks siiani talle isegi lasteaiakohta võimaldada. Põhja-Tallinna linnaosa pole suutnud talle piisavalt süüagi anda. Põhja-Talllinna linnaosa valitsus peab hakkama võtma vastutust, iga linnaosa valitsuse liige peab hakkama võtma vastutust.
est	-1	Norra koondise peatreener Egil Kristiansen lisas, et lähipäevad peab Steira siiski rahus veetma, sest vigastused ei luba tal trenni teha.
est	-1	Ema oli esimesi päevi diakooniahaiglas, kui mina teda vaatama sõitsin. Vend käis iga päev, sest süda palus nii ja ema ju ootas. Hinges oli ärevus ja südames valu, sest armsa lähedase haigus ja teadmatus sellest, kui palju on veel elupäevi antud, teevad väga nõrgaks, tundlikuks ja segavad kõik piirid reaalsuse, imede ning uskumatute lootuste maailma vahel. Hirm oli, et mis küll saab ja kuidas tal seal läheb.
est	-1	Kas vene memmed tantsisid nii nagu Tanja, et oli oht puus mõnel murda? Või see kahel jalal tammumine tekitas ka juba puusamurdmisohtu?
est	-1	Elanike tahtmatus vanu rõduklaase maha võtta oli korteriühistule üllatuseks. «Need korteriomanikud, kelle rõdude remont on juba tehtud, täitsid oma kohustusi vastu vaidlemata. Tasapisi võtavad ka teised vanu rõduklaase- ja raame maha. Aga see, et mõni hakkab vastu, ei ole ühistu probleem. Renoveerimisotsus tehti üldkoosolekul ja linnavalitsuses kinnitatud projekti me eirata ei saa,» märkis Ljudmila.
est	-1	«Lapsabieludeks saab lugeda kõik abielud, mis on sõlmitud tüdruku enne 18-aastaseks saamist. Alaealised lapsed ei ole võimelised enda õlule võtma abielu kohustusi ning ei ole kehaliselt küpsed laste sünnitamiseks,» seisab raportis.
est	-1	Sina vist oled endale alkoga juba liiga teinud...
est	-1	Usuringkonnad soovivad rahvaloendusest saadud tulemustele omistada erinevat sisu vastavalt endi kontseptsioonile, kritiseerib loenduse metoodikajuht Ene-Margit Tiit Postimehe arvamusportaalis loenduse kriitikuid.
est	-1	Nimelt tunnistas lauljatari ema Dina, et jõi tütrega koos veini ja leidis pärast seda Lindsay korterist veinipudeli.
est	-1	kuule, ära palun KARJU siin, mul juba kõrvad lukus...
est	-1	Efektiivne vastupanu sellisele ohule saab olla teostatud muidugi vaid tugeva Reformierakonna juhtimisel, tema suudab «head jõud» liita. Kõik, kes selle skeemiga nõus ei ole, toetavad justkui keskerakondlikku türanniat. Sellest tulenevad ka Reformierakonna kampaania värsked (ehk vanad) märksõnad ja varasemast veelgi jõulisem sõnum. Eesmärgiks olevat järgmiste valimiste võitmine kogu Eestis, et nii nagu Toompeal, pääseks ka pealinnas võimule «kaine mõistus ja hea majandamine».
est	-1	Lindsay on nende kõrval ingel. Ja mis te hulute, vaevalt ainuld teie oma naisi nikunud olete. Või siis arvate, et teie mehekesed puhtakesed on? Esimesel võimalusel keeravad naise sõbrannadele taha kui võimalus :D
est	-1	Välisminister Urmas Paet on aga sattunud keerulisse olukorda. Kahtlemata mõistab tema kõige paremini probleeme, mida peaministri selliselt sõnastatud seisukohavõtt põhjustab ning hoolimata valmisolekust olukorda klaarida teab, et tagantjärele pole seda enam kuigipalju võimalik heastada.
est	-1	Karjääri keskel ilmnebki kõige selgemalt oma professionaalset tippu taotlevate ja elul sabas lohisevate töötajate erinevus. Ühed on 50-aastastena oma elu kontrollijad ning neile avanevad uued võimalused. Teised peavad leppima sellega, mida neile antakse.
est	-1	Nii jube oli siinset juttu lugeda.. Kuidagi väga kahtlane see kõik.
est	-1	Kui enam tõesti midagi muud teha ei ole, siis võiks politsei vahelduseks korda pidada.
est	-1	Ehk vaid Theatrumis saab vahel näha hästimängitud vagadust. Ei, see polnud iroonia. Teatris on kõik mängitud. Aga mis oleks mängitud vagadus? Mängida, kujutada, olgu luules või laval, saab seda, mis sinus on. Endast saab allapoole laskuda, endast kõrgemale tõusta ei saa. Suur kunst on alati vaga. Ta tõstab kunstnikugi kõrgemale, endast välja (aga mitte kõrgemale kui elus saavutatud ülemise tuhvini). See tõus on tõeline ja võlts. Tõeline, sest ta leiab tõeliselt aset, ja võlts, sest ta ei kesta. Ta on vaid selle ekstaatilise hetke. Siis tuleb kukkumine. Muidugi keegi ei taha seda päriselt. Seda kukkumist. Ega siis ka tõusu. Ei saagi tahta. Seda karistust. Keegi ei taha kunsti. Keegi ei taha, et midagi tõeliselt juhtuks. Kõik kardavad seda sama jubedal kombel, nagu too sigade-mees laudast välja minemist. Autor, lavastaja, näitlejad, publik, kõik.
est	-1	Raul Meele lugu on tõsisem, tema riigivastastele roppustele pühendatud tuba mõjub sümboolse kallaletungina Eesti riigile. Mis sellest, et prokuratuuri arvates mitte (sest lipu mõõdud ei ole täpsed).
est	-1	Jah, härra Zahharov, õppida inimeseks olemist on Teil veel väga vaja, juhtusin nimelt pealt nägema, kuidas Te tavalise teenindajaga käitusite ehk ülbitsesite. Jube, et ülikool matsi ei riku - varem olin Teie ande suur austaja...
est	-1	Taimo Kaldma on Eestis ning tema rahakott ja telefon alles, küll aga kaaperdati täna tema gmaili aadress, millelt petukirju nüüd üle maailma laiali saadetakse.
est	-1	Pakistani suurimas linnas Karachis, kus elab 18 miljonit inimest, jäi elu leina tõttu täna seisma - ühistransport ei liigu, koolid ja ülikoolid on suletud.
est	-1	Tapeti ka Yavuzi elukaaslane Bill Langdon. Türgi ajalehe Hürriyet andmeil kohtus paar Nairobis ja oli Kenya pealinna naasnud hiljuti, nad valmistusid oma esiklapse sünniks.
est	-1	AGA MITU MILJONID PUUD ON METSAST ÄRA VEETUD,,
est	-1	Isegi keskmise palgaga inimestel on raske Eestis toime tulla! Lapsed tahavad ju ühtemoodi hoolitsust ja toitmist. Siis võtame toetuse rikastelt ära ainult,neil vbla ei lähe tõesti vaja.
est	-1	N Liidus olid ka sellised toredad plakatid nagu RAHU; SÕPRUS; VENDLUS. Ainult et reaalsed teod olid täpselt vastupidised.
est	-1	Kade meel, eks?
est	-1	Veerandtunni jooksul, mil suutsin end sundida seda õudust kuulama (aga saatekava järgi oli kolmetunnine sünnitis alles poole peal), hakkasin küllap kõrvust ja näost punetama nagu moosivarguselt tabatud marakratt.
est	-1	Rae vald meelitas pooltuhat elanikku Tallinnast ära
est	-1	aga anna ise
est	-1	Algselt pidi kaasa lööma ka Terminaatori solist Jaagup Kreem, kes jääb nüüd aga kõrvale – meest tabas ootamatu seljahäda ning ta käis äsja operatsioonil.
est	-1	Proviisori sõnul on Maailma Terviseorganisatsiooni andmetel arenenud riikides, sealhulgas ka Eestis, ravijärgimus umbes 50 protsenti, arengumaades on see veelgi madalam. «Esialgu arvasin, et see probleem pole ehk Eestis nii suur. Nüüd, koostöös kardioloogidega olen saanud tagasisidet, et väga suurele osale patsientidest tuleb üllatusena, et nad peavad oma vererõhutabletti võtma iga päev,» rääkis Meren.
est	-1	"Ma olen temaga ikka hullult vaeva näinud. See on see lätlastega kaubategu – ei saa ikka usaldada," vangutab ta magusmõrult pead.
est	-1	Loomade tagaajaja olid,taludesse on lüpsjaid tarvis ja looma söötjaid koristajaid.
est	-1	Algkoolieas tütre (ja muidugi ka enda) loodushuvi tõttu oleme selles majas olnud viimastel aastatel üsna sagedased külalised. Ei mäleta ühtki korda, kui me muuseumist lahkudes poleks kurvastanud püsiekspositsiooni kuhtunud väljanägemise pärast.
est	-1	Tänane saade oli näkku sülitamine neile inimestele, kes on oma kohust elu ees ja kasvavate elude eest täitnud suure südame ja vastutustundega. Minul ei tekkinud kaastunnet selle mehe suhtes. Minul tekkis viha, et ta nii oma laste suhtes käitub. Just käitub, sest ma ei usu, et seal midagi muutuks. Kuu aja pärast võiks saatetegijad uuesti seda kodu külastada ja olen kindel, et nad leiavad eest selle täpselt sellisena, kui nad sinna esimest korda läksid.
est	-1	Tema oletusel jättis lapse peatusesse maha tema oma onu.
est	-1	Teeb saateid, millele ise risti vastu elab...Kahju väikesest Robist, nii armas ja süütu!!
est	-1	no ja on ikka nüüd sõnastus. järgmine naine, kes kannab last eurolaval.
est	-1	Teineteisega hirmutamine on kaval taktika veel selleski mõttes, et ei lase esitada tõsisemaid küsimusi. Näiteks, mida Reformierakond Eestis võimul olles ja Keskerakond Tallinnas võimul olles poliitilise arengu vallas on saavutanud? Kas on suudetud luua tugevaid demokraatlikku ühiskonda sobivaid institutsioone, mis põhinevad kindlatel baasväärtustel või käib siiani askeldamine konkreetsete persoonide ja projektide ümber? Kas otsustusprotsessidesse kaasatakse rohkem neid inimesi, keda otsused puudutavad, või jätkub inimeste tegemine «vägisi õnnelikuks»? Kas otsused on põhinenud järjest enam teadmistel või tulenenud juhi «valgustatusest»? Kas poliitiline kultuur ilmutab üha enam küpsuse tunnuseid, on vabanenud autoritaarsusest ja direktiivsusest või seistakse ka selles mõttes paigal?
