lang	sentiment	text
fin	-1	Kirkollinen joulu on inflaation kärsinyt juhla, joten se on täysin muokattavissa oleva kauppiaiden tilinteon juhla.
fin	-1	. - VAAN , KUN REHVASTELET EROLLALLASI.
fin	-1	Jotkut ne eivät vain osaa rakastaa lastaan tarpeeksi.
fin	-1	lain hengen ja tämän päivän suositusten vastaista, etten sanoisi ilkeää toimintaa.
fin	-1	Professorien mukaan tuloerot ovat nyt yhtä suuret kuin 70-luvulla, vaikka Katainen kehuskelee että koskaan ei ole voitu näin hyvin.
fin	-1	Anteeksi kun olen olemassa?
fin	-1	Voi ei!
fin	-1	Jumala vihaa uskottomuutta ja hylkäämistä.
fin	-1	Menee sekin reissu pilalle...
fin	-1	Ei hyvää päivää täällä jaksetaan olla negatiivisia ja haukkua muita.
fin	-1	Näin helppoa olisi ollut estää koko virhetilanteen syntyminen.
fin	-1	Ootko todellisuudessa joku säälittävä sekopää, joka pöllii ihmisten autoja ja mikroaaltouuneja ja mitä lie, kun sellaisista puhut - ja v*tttuako sinä imbesilli kirveistä puhut keskustelupalstalla?
fin	-1	Muutenkin on kaupungin talous jo retuperällä ja velkaa kasvatetaan.
fin	-1	että aika naurettava ketju.
fin	-1	tää palsta tuntuu olevan täynnä wannabegootiksi leimaajia, ja muita heikkohermoisia.
fin	-1	mistä näitä rukafanjea oikein tulee, no sieltä hinttaribunkkerista tietysti.
fin	-1	Maanantaina (mikäli en saa ongelmaa ratkaistuksi) palautan koko paskan ja enkä muuten ihan vittuillessanikaan osta mitään elgato silmä tv:tä.
fin	-1	Nuku hyvin, Viivuska :'( ♥
fin	-1	Pienetkin asiat ärsyttävät minua.
fin	-1	Aivan älytön ajatus.
fin	-1	Sairasta, että lähettelee kuviakin vielä.
fin	-1	Ärsyttää suunnattomasti sun esittäminen.
fin	-1	Muuta et ansaitse.
fin	-1	Saa hyppiä lattiasta kattoon ku jänes konsannaan ku hermot mennee...
fin	-1	Minusta teillä ei ole oikeutta lähteä väittämään ILMAN PERUSTEITA, että TÄMÄ ja TÄMÄ on Jumalan tahto, ja Hän haluaa SITÄ ja TÄTÄ ja TUOTA, ja jos et tee niin, se on syntiä ---&gt; helvettiin.
fin	-1	kauhea ikä reilu
fin	-1	Ihme elämäntapanatsi.
fin	-1	Vai mistä ihmeestä sait moisia mietteitä pikkuiseen päärasiaasi?
fin	-1	Mihinkään ei riitä rahaa.
fin	-1	En uskalla mennä töihin, koska se on liian rankkaa.
fin	-1	Me vaan älytään, ettei sinusta ole mihinkään.
fin	-1	”Mennään vetää turpaa se on rasisti!”
fin	-1	Olen väsynyt tähän tunteeseen.
fin	-1	Voi kun olisi keino laittaa "punainen lippu" varoittamaan toisia tästä miehestä :(
fin	-1	no älä ainakaan osta tormekkia.
fin	-1	Kauan olen etsinyt ja jo väsynyt etsimiseen.
fin	-1	Pakkoruotsi vain rajoittaa suomenkielisten mahdollisuuksia petrata kieliosaamistaan ja kilpailukykyään (on jopa väitetty että tämä olisi jopa suomenruotsalaisten alkuperäinen tarkoituskin pakkoruotsin lanseeramisessa 70 luvulla)...
fin	-1	Voi lapsiparkoja!
fin	-1	Tekeekö mieli herjata USKOVIA, PILKATA JUMALAA JA MITÄTÖIDÄ USKOVIEN OHJEKIRJAA RAAMATTUA.
fin	-1	Tulipa vasemmisto-älymystölle hätä.
fin	-1	PÄÄMINISTERILLE JÄÄ PIENI MAHDOLLISUUS NOSTAA OMAA KANNATUSTA.AINOA OIKEA RATKAISU ON.että M.VANHANEN JÄTTÄÄ HALLITUKSEN EROILMOITUS PRESIDENTILLE TARJA HALOSELLE.... väliaikainenhallitus on virkamieshallitus....
fin	-1	pahasti hukassa demokratia venäjällä ja kiinassa.
fin	-1	Vai väität sinä meitä venäjämielisiä iiroja usanisteiksi!
fin	-1	Olet sairas.
fin	-1	No minä en ymmärrä uskiksia joten en pysy vaiti.
fin	-1	Iskelmä on niin syvältä.
fin	-1	No olen, olenhan minä kuule.
fin	-1	Tosa yllä lainaus keskustelusäännöistä!!
fin	-1	Ompa irstas muija
fin	-1	Ei ole liioiteltu yhtään.
fin	-1	Taitaa olla niin, että höynäyttäjät itsekin tietävät, että sokerilla eivät sairaudet parane.
fin	-1	Maailman loppu tulee koti kansalle, hui hui hui.
fin	-1	Joko vihdoin terroristit lopettavat älyttömät päättömyytensä panttivankien päiden leikkaamis-videoineen, joita tämän palstan pro-terroristit ovat tietenkin pitäneet "rohkeiden vastarintamiesten" sankarillisuuden osoituksina?
fin	-1	Venäjällä on omat huolet, Suomi on täysin nolla ja sitä se on aina ollut jos Suomi olisi käyttänyt järkeä, harvoin sitä on ollut... ja tänään täysi nolla..
fin	-1	Enkä muuten ymmärrä tuota F1-showta olenkaan.
fin	-1	Toisekseen olen todella neuroottinen sukupuolitautien suhteen varsinkin kun edes kondomi ei suojaa niiltä täydellisesti.
fin	-1	OLISIT KERTONUT SATAMAN NIMEN, OLISIN VOINUT ANTAA SELVÄT OSOITTEET.
fin	-1	Mut eipä näy... =(
fin	-1	Alkaa kohta mennä hermot!
fin	-1	Olen käynyt Roa kuurin läpi jo kaksi kertaa, enkä enää haluaisi käyttää sitä, sillä siitä ei näytä olevan kovinkaan paljon hyötyä.
fin	-1	Kyllä minä saan työstäni rahaa oikein mukavasti eikä minun edes tarvitse kiduttaa tai tappaa eläimiä!
fin	-1	Onneksi en asu siellä.
fin	-1	Älytöntä ajatella että koiran paskomisesta saisi sakkoa...
fin	-1	vain siitä että me tiedämme kuinka tämä bimbo ylioppilas on olevinaan NIIN hemmetin fixu ja muut eivät ole nitään HÄNEN YLHÄISYYTENSÄ MUKAAN !!!
fin	-1	se ei ole kivaa olen ollut itsekin normi farku pukeutuine hevi joskus aikoinani.
fin	-1	Kyllä tässä on taas kysymys vanhempien erikoisuuden kaipuusta ja sivistymättömyydestä.
fin	-1	Tulette näkemään vielä että Soldiers of odineja tarvitaan vielä ja uskon että hyvinkin pian jopa mutupatjasuvakitkin huutavat heitä avukseen.
fin	-1	siis tälläisiä homoja, pilvenpolttajia, ikuisia opiskelijoita ja maailmanparantajia pk-seudulta löytyy!!!
fin	-1	Siellä ei ole muita, kun naimisissa olevia keski-ikäisiä ukkomiehiä vonkaamassa naisia salasuhteisiin ja sähköposti paukkuu.
fin	-1	Kaikkein kauheinta oli hirveä meno.
fin	-1	Hirveä ahdistus (hpv)
fin	-1	Omapa on valintasi, jos haluat elää lyhyen elämän.
fin	-1	Tiedän etten kelpaa naisille.
fin	-1	Kansan ääni-lehdykkä ei saa edes otetta kakkakikkareesta siellä puuceessä ja joutuu huonona varusteena hylkyyn kompostiläjään.
fin	-1	Nasse linkitti tänne kerran tämän jumalattoman hauskan sivun, jolle on kerätty poikkeuksellisen rumien ihmisten kuvia: http://www.uglypeople.com Ja sitten me ateistit naurettiin niin!
fin	-1	Lopettakaa pa...kan jauhaminen ja maksakaa mitä olette velkaa.
fin	-1	Kuinka säälittäviä olemme?!
fin	-1	Se on rasittavaa jos aina kun toinen koskee tietää että nyt se haluaa seksiä.
fin	-1	Kymmeniä, ellei peräti satoja / vrk. Kovinpa paljon haet näitä kaikkia mahdollisia linkkejä tänne typerien uskomustesi perusteiksi.
fin	-1	Sama hullu teki avauksen ja vastasi siihen usealla nimimerkillä, tämä sekopää käyttää yleensä nimimerkkiä Koroljev.
fin	-1	...........lentää kuu spytta.....yökk...ööö...yöks...
fin	-1	t o d e l l a huonoa.
fin	-1	Kovasti täällä itseään uskovaisiksi tituleeravat ihmiset hyväksyvät väkivallan lapsiaan kohtaan vaikka se on lailla kielletty.
fin	-1	Mistä sinä idiootti tuohon persut keksit??
fin	-1	En saatana ole.
fin	-1	Varmasti ampuisit vain itseäsi nilkkaan yrittäessäsi vahingoittaa lisää minua.
fin	-1	Normaalit ihmiset ostaa uuden mutta sinulla on varmaan samat kalsaritkin jalassa 10v ja sitten käännät ympäri.
fin	-1	Joo, täys pölvästi se on!
fin	-1	Erohan siitä tuli, ei vaan kovinkaan pehmeä eikä rauhallinen.
fin	-1	Duunari pysyköön siis lestissään ja jatkakoon itse lohdutonta raatamista.
fin	-1	eerohiltuset majailee nyhjöttäen ja haaveilevat olemattomia?
fin	-1	Mieti tarkkaan rakennatko Evijärvelle, valtapuolueella tarkoituksena näivettää kaikki muu paitsi kirkonkylä.
fin	-1	Narsistiset psykopaatit (hullut) meitä hallitsevat.  1 1 0 1 4 0 -1 14 6 comments2007a.vrt 1041424 Ooh yeah  0 0 0 0 3 0 -1 8 6 comments2010f.vrt 202862 Green Magmasta on thety n. 100 tieteellistä ( yliopisto) tutkimusta, kun taas vehnänoraasta ei ole tiedossa tieteellisisä papereita.  -1 -1 0 -1 2 0 -1 6 6 comments2010a.vrt 3723454 Jos mulla vaan olis käärme, niin sut mä sille mieluummin syöttäisin!  1 1 0 1 4 0 -1 19 6 comments2010c.vrt 2741147 Ymmärrän tosi hyvin, mulla on ittelläni hyvin uskovainen suku ja ihailen rohkeauttasi.  -1 -1 0 -1 2 0 0 11 6 comments2005d.vrt 1080099 Ihmetyttää vaan, kun näillä kiilaajilla loppuu se kiire sitten kun on päästy jonossa ensimmäiseksi.  -1 -1 -1 -1 1 0 1 14 6 comments2003b.vrt 655505 Sen paskempaa autoa on vaikea edes kuvitella.  0 0 0 0 3 0 -1 20 6 comments2015b.vrt 2703018 Mihin vielä ehtiikään?  0 0 0 0 3 0 -1 3 6 comments2015c.vrt 2355087 samaa mieltä että ei kotona ja syrjässä muilta katseilta jne!  -1 0 0 0 2 1 0 11 6 threads2009a.vrt 6259579 siis satuttaa toista ihmistä kipeää.  1 1 1 1 5 0 1 5 6 threads2011b.vrt 1898024 :)  -1 -1 0 -1 2 0 0 8 6 comments2017e.vrt 2752631 Kävipä miten tahansa, ruotsin kielen räikeän ylikorostettu asema suorastaan romahtaa--.  1 0 0 0 4 0 -1 15 6 threads2005a.vrt 2584345 Antakaa karvojen ja rintojen olla juuri niin kuin luonto on ne luonut.  0 0 0 0 3 0 1 4 6 comments2010a.vrt 611677 Kaipa noita Kanaria kävijöitä riittää kesän ajaksikin kun sinne vuodesta toiseen matkoja järjestetään.  0 0 0 0 3 0 -1 16 6 comments2010b.vrt 718139 Tosin voi olla, että joudutte pyytämään lääkäriltä reseptin ensin.  0 0 0 0 3 0 -1 13 6 comments2003a.vrt 2466399 Ns järkiauto ostetaan pakosta... tarvitaan auto, mutta rahaa on rajallinen määrä, asunto- ja opintolainat painaa päälle, mutta jollakin täytyy kulkea.  0 0 0 0 3 0 0 6 6 comments2010d.vrt 2235434 Eiköhän elämän kokemus ja merkit joita annetaan annetaan ymmärtää mitä tehdä?  1 1 0 1 4 0 -1 16 6 threads2011a.vrt 2802394 Ja kaikki vinkit matkakohteeseen liittyen tervetulleita ja jos jollain on tietoa Lantiana Gardens-hotellista, niin täällä oltaisiin hyvin tyytyväisiä..  0 0 0 0 3 1 0 19 6 comments2018a.vrt 1025443 Siinä esimerkki käytetystä.  0 0 0 0 3 0 -1 18 6 comments2006c.vrt 3899118 Sänky ja kirjahylly  -1 -1 0 -1 2 0 -1 7 6 comments2012a.vrt 2848097 On huono esimerkki, rosvojen ja kusipäiden puolustaja, turha jätkä.  0 0 0 0 3 0 1 14 6 comments2011b.vrt 2188072 1:23 me taas saarnaamme ristiinnaulittua Kristusta, joka on juutalaisille pahennus ja pakanoille hullutus, 1. Kor. 1:24 mutta joka niille, jotka ovat kutsutut, olkootpa juutalaisia tai kreikkalaisia, on Kristus, Jumalan voima ja Jumalan viisaus.  0 0 0 0 3 0 0 4 6 comments2009f.vrt 966197 Olin tottunut puhumaan miesten kesken eli naisesta saatettiin sanoa juuri kuten kuvasit.  1 0 0 0 4 0 1 17 6 comments2010d.vrt 1744881 Nyt välittömästi muutat hänen luokseen ja elätte hänen kotimaassaan onnellisesti.  0 0 0 0 3 0 0 16 6 comments2006d.vrt 3527122 Ei olla vielä nähty sen pojan kanssa (olen siis tyttö) mutta sekin päivämäärä on jo sovittu.  -1 0 0 0 2 0 -1 11 6 threads2017a.vrt 5950232 Välttäkää ostamista huijareilta.  0 0 0 0 3 -1 -1 6 6 comments2013b.vrt 1675568 ...ja pitenpäänkin.  0 0 0 0 3 0 -1 2 6 comments2007f.vrt 286697 Niitä tuskin olisi tapahtunut, ellen olisi ollut näiden kulttuurien kanssa tekemisissä.  0 0 0 0 3 0 0 3 6 comments2017b.vrt 176107 Kundi on jo löytynyt  -1 0 0 0 2 1 -1 2 6 threads2007a.vrt 4517994 Liikkeellä on uusi virus, koodinimeltään työ".
fin	-1	Vai tultu ainoastaan kirkkoa lainaamaan?
fin	-1	Kyvyttömät kilometritehtaalle, kuten muuallakin työelämässä!
fin	-1	vastatkaa ettekö uskalla???!!
fin	-1	tätä on jatkunut jo liian kauan, mutta mulla ei oo munaa sanoa porukoille että tarvin apua, ja kaikki ei oo kunnossa.
fin	-1	VOI Hel...
fin	-1	kauheaa arvostelua miksi se nyt noin tekee ja miksei opiskele jne.
fin	-1	Niin päätämme siis, että ihminen vanhurskautetaan
fin	-1	Koska ihminen on saatanallinen laumaeläin jonka mielestä rangaistuksen tulee määräytyä sen mukaan KUKA on uhri, ei sen mukaan KUINKA PALJON uhri kärsi.
fin	-1	Kataisen tulevaisuustutkimuksen tilaaminen Himaselta on toimepide tähän suuntaan, mutta pelkäänpä, että sieltä tulee enemmän filosofista hölynpölyä kuin mitään konkreettista ratkaisua mihinkään.
fin	-1	Onneksi Islam ei ole Sinua vielä pilannut.
fin	-1	No miksi immeiset tahtoo pitkiä räystäitä taloonsa..no kun sataa useimmin vinoon kun kohtisuoraan..eli siinä ne kastuu ja voi voi..
fin	-1	Vittuako muille kuuluu toisten rengasvalinnat.
fin	-1	Sairas olet ja pahasti valehtelet.
fin	-1	Niin tässä on just se vika että puhut jostain karille ajosta.
fin	-1	Nuorisopuolelta leikataan rahaa ja apua on muutenkin erittäin vaikea saada.
fin	-1	Jos rouvalla on niin paljon aikaa et pystyy pesemään paskavaipat käsin,ekä ne edes lähde sellai kunnolla puhtaaks,ni tuu meillekki pesemään.. ja vies himaas ne kuivuu ku mulla ei niitä oo kovin paljon tilaa kuivatella sisällä..Ja sitte jos sä ainoona niitä kierrätät ni ei se saastumiseen paljon auta..
fin	-1	Mie kerran 90-luvun lamavuosina yritin, mutta mikhän ei ole perkehleellisempää ko porkkananviljelys....
fin	-1	Mikä video on seuraavaksi vuorossa, seksivideoko?
fin	-1	Sinulla on faktat ja pää sekaisin.
fin	-1	Oon kans aika katkera, kun mulle ei sovi oikein sellaiset pienet sirot kesäkengät.
fin	-1	Tämä on puhdas ad hominem -hyökkäys - epäilet motiivejani etkä puutu esittämiini perusteluihin kannalleni.
fin	-1	Mutta nyt ovion avattu kaiken maailman pommikaavuille.
fin	-1	Onko taas kovin vaikeata.
fin	-1	joskus joku laittaa minutkin joku päivä ruumisarkkuun.se on vain niin.juokse semme kilpaa kuoleman kanssa eikä sille voi mitään, se on niin lopullista ja surullista.se on todellista, en ennen tajunnut sitä mutta olen oppinut sen.kuolema on niin tyhjä, niin kolkko, niin loppu.hauta on viimeinen paikkamme tässä maailmassa.
fin	-1	Ja onhan sanakirjoja jos ei ymmärrä ?????
fin	-1	Meillä tilanne nyt siis se,että mietin pitäisikö minun hajottaa perhe ja jättää mieheni..
fin	-1	No en ihmettele yhtään jos Pieksämäkeä haukutaan kun päättäjät ja valtuusto tekevät hölmöjä päätöksiä.
fin	-1	Kyllä tässä puolueessa onkin MATTOPIISKALLE töitä, niin on mennyt OPPOSITIOpolitiikka populismiksi!!
fin	-1	asun isossa kaupungissa ja käyn joka viikonloppu viihteellä,mutta silti en löydä baarista sitä naista!!
fin	-1	Semmoinen on aika kiusallista.
fin	-1	en jaksa toistaa itseäni.
fin	-1	Ja vaikutat kyllä mustasukkaiselta, ei pahalla.
fin	-1	Ei tässä ole mitään hävettävää tai hävittävää, jos IDIOTIAA vastustaa.
fin	-1	Jos joku täällä on nolo, niin sinä ja sinun lapselliset katkerat kirjoittelusi ja Iltalehteen linkittelysi.
fin	-1	Mutta kirjoitin sen siihen vain siksi koska MINÄ en ole täällä _todellakaan_ sanallakaan maininnut ENTISESTÄ uskonnostani ja nämä (luterilainen) nyt väittää että olen itse kartonut olevani Saatanan palvoja, en ainakaan tässä elämässäni!
fin	-1	olin työtön 10 vuotta sain nyt vakipaikan hyvän toimeentulon luuserit menkää toihin älkääkä tääl valittako.
fin	-1	Kannattaa maistaa, ettei astu koiranpaskaan.
fin	-1	Raha ei todellakaan tee onnelliseksi.
fin	-1	kaikesta ihmisten tartteekin valittaa:P
fin	-1	Tai MAMU!
fin	-1	ostat uuden töllön kun vanha töllö hajoo??
fin	-1	Siksi, koska puheenjohtaja Soini ja työmies Putkonen on heidät pelotellut hiljaiseksi.
fin	-1	ku mikää ei auta täs on kuule juttelut juteltu mutta kukaa ei vastaa!!!!!!!!!!!!!!!!!!!!!!!!!!!!!!!!!!!!!!!!!!!!!!!!!!!!!!!!!!!!
fin	-1	Nämä ajatukseni saattavat kuulostaa jonkun mielestä varmasti enemmän tai vähemmän sairailta, mutta mielestäni mustasukkaisuus ja halu omistaa toinen on vielä sairaampaa.
fin	-1	Onneksi täällä palstalla on päteviä tutkijoita tutkimassa olematonta rikosta.
fin	-1	Eiköhän se Halonen tämänkin meidän rahoillamme lihoneen petkuttajan kenkkää vielä Niinistön kautta linnanjuhliin?
fin	-1	Epäkorrektia-sanon minä.
fin	-1	Hyvä että Kokoomuksen mainetta nakerretaan näin vaalien alla.
fin	-1	No, onneksi on nämä nettikaupat, ei tarvitse enää käydä katsomassa näiden rasvalettien surkeata palveluhalukkuutta, lopputili moisille lusmuille olisi tervetullutta.
fin	-1	Vähän epäilyttää kyllä juu..
fin	-1	muita en harkitse ihmetyttää vain onko veho myynyt noita kenellekään???
fin	-1	sinulta jäi vissiin huomaamatta, että nimimerkki viisas kuvittelee maahanmuuttajia maanpettureiksi tai muuten vain syyliisiksi ties mihin... siis kaikkia!
fin	-1	Torniosta rip
fin	-1	Nykyään kun ei pirutkaan ymmärrä kuolla ajoissa.
fin	-1	Eipä taida kykysi riittää, kun joudut kyseleen!
fin	-1	Kyllä niiin kannattaa tää rehellinen työ Suomessa.
fin	-1	Olen 100 prosenttia kyllästynyt ylen punaisiin pukeutuviin sosialisti journalistehin.
fin	-1	Kova on ollut lapsuus, olis mielenkiintoista tietää miksi se sitä paskauskoaan yrittää levittää kaikille, koittas nyt joskus kirjottaa ilman.
fin	-1	#NAME?
fin	-1	En tunnista tätä maata enää samaksi kuin muutama vuosi sitten.
fin	-1	Tyhmempikin hoksaa pointin vaan ei kiinangummipoitsu.
fin	-1	Ja sen lisäks mun kani ei ees pidä must ollenkaa vaan mun bestast ja mun mutsis niin välil tuntuuu et mun Ei olisi pitänytkään hankkia kania mitä teen
fin	-1	Luomiskertomus on siis vajavaista ilmestystä.
fin	-1	Venäläisen divisioonan koko taitaa olla tälläkin kirjoittajalla ihan hukassa.
fin	-1	Olin menettänyt elämäni tärkeän kumppanin, menettänyt rakkauden kohteen ja rakastajan, olin jäänyt yksin ja halusin vain seurata häntä... kaipasin, tuijotin tielle, odotin, olin elossa, mutta kuollut elämään tätä päivää.
fin	-1	Vaahossa huudetaan, kuorossa !
fin	-1	Onko tuota vaika ymmärtää?
fin	-1	Se on jäänyt lähtemättömästi järkytyksenä mieleeni.
fin	-1	Olisit puhunut ensin oman miehes kanssa jos suhteessa on ongelmia.
fin	-1	Kateus on kamala asia, ja nyt kalahti pahasti paperimiesten omaan nilkkaan!
fin	-1	Ikävä päätös tälle illalle...
fin	-1	Silti vaan sorrun uudestaan..
fin	-1	Voi herran jestas teitä tekopyhiä...
fin	-1	En ymmärtänyt sanaakaan, vaikka olen asunut U.S.A:ssa puolet elämästäni ja olen tuplakansalainen.
fin	-1	yhtä paskan kuulosta kuin jazz.. stana.
fin	-1	No en uskalla puhuu, ku pelkään niit laseja ku sit alkaase "Koulukiusaus enkä kestä sitä" (Äidillä on lasit ei iskäl ja se sai ne vissii 15 v)
fin	-1	Syynä ei voi kiusaamiseesi loppujen lopuksi olla "harmaus ja ujous" vaan kateus.
fin	-1	Täysin luokaton yhteys meidän taloyhtiössä Hakalassa: IP:n saaminen kestää tolkuttoman kauan, 50-60% pakettihävikkiä, jne.
fin	-1	No, turha toivo persuparka.
fin	-1	Mitäh?
fin	-1	Eli en todellakaan ymmärrä vertailun tulosta...
fin	-1	JA NAISETHAN KÄYTTÄYTYVÄT KESKENÄÄN KUIN NAISET TEKEVÄT. JUORUAVAT, JA KEKSIVÄT MIELIKUVITUKSISSAN LISÄÄ JUTTUJA, PANETTELUVIMMASSAAN.
fin	-1	Eli siis minäkin olen pervo, kun tykkään panna ja toisinaan myös ihan hikeen asti...
fin	-1	Toivon mukaan osaat ottaa yhtä innolla vastaan mahdolliset seuraavat lapsen lapsesi, etkä totea kuten meidän mummon kolmannen kohdalla, että se olsi ollut jo liikaa.... :(
fin	-1	Kuulostaa siltä, että tuo "monta kertaa viikossa" on jumittanut kehityksesi.
fin	-1	Sinun junasi on todellakin mennyt.
fin	-1	Ei miehillä saa olla kriteerejä.
fin	-1	...
fin	-1	Kansa on saanut tarpeekseen tästä yhden aatteen vaahtoajasta ja vapaan sanan kahlitsijasta.
fin	-1	Luuletko että sitä tiketin saajaa voisi "vähempää kiinnostaa".
fin	-1	Kitisemisen sijaan voisit miettiä, mitä sinä itsekin voisit tehdä sen suhteen eteen.
fin	-1	Huono maine on sekin omaa aikaansaannostamme, johon mikään muu kaupunki tai kunta ei pysty.
fin	-1	Tuo rekkarin arvuuttaminen on yhtä turhaa kuin melkein muistaa jonkun puhelinnumeron.....
fin	-1	Ai minäkö muka ruma? :o
fin	-1	Noloa...
fin	-1	Asiaa ei suinkaan paranna McLarenin F1-räpellys.
fin	-1	ulkopuoliset voi tukkii turpansa eli toimiii hyvin ei mitää suurenpaa vikaa?
fin	-1	Muutenkin tämä puhe oli hyvin latteaa ja se rakentui puhujan kokemien ihmeiden ympärille.
fin	-1	, ja se ei liikuta ketään mitä puoluetta alan kannattamaan seuraavaksi, mut sen lupaan etten palaa vihreisiin ikäpäivänä enää!
fin	-1	Haluatko, että kerron mitä eroa?????
fin	-1	Nekin viestiketjut, joissa kysytään "hyvää siivousfirmaa" ja siihen tulee vastauksia joissa nimetään nimeltä yrityksiä, on vähän kyseenalaista, koska mielipiteet ovat täysin henkilökohtaisia, ja yhtä hyvin niissä voi joku kehua itse itseään, jolloin koko kyselyltä mene pohja pois.
fin	-1	vittu runeen ei oo ilmasta membua
fin	-1	Toiset kestävät ison kasan kohtuutontakin paskaa kun taas jollakin kosahtaa käämit jo vähemmästä.
fin	-1	et tosiaan syistäni mitään tiedä.
fin	-1	Saatanallinen väsymys päälle, ja sitten nukkumaan aaaaaaaaaaaaaaaaaaaah sitä helpotusta.
fin	-1	3 päivän ajan tuntunut raivostuttavaa sykkimistä ja nyt jopa hieman kutinaa.
fin	-1	TÄSÄ OLIS KLIZKHKOLLE, POVELLILLE, TEEVENSONILLE, BRUNBERKILLE, MÄJELLE JA TALITILLE THREENI!!
fin	-1	Mitä henkilökohtaisesti olet tehnyt sen eteen että saamme kotimaastamme kristinuskon kiellettyä, muutakin kuin kirjoitellut anonyymina suoli24 ateismipalstalla?
fin	-1	Mies ei osaa!!!!
fin	-1	Minulla vaan ei auennut...=(
fin	-1	En ole koskaan saanut mitään niin alhaista ja käsittämättömän irvokkaanrumaa viestii keltään!!!!!!!!!!!!!!!!!!!!!!!!!!!!!
fin	-1	Ei todellakaan!
fin	-1	Kaikkein pahinta on, kun naapuriksi sattuu hankala tyyppi nykyaikaisella omakotialueella, joissa tontit ovat 500 neliön postimerkkiluokkaa.
fin	-1	Ilmiantokulttuuri kaikessa vastenmielisyydessään on törkeätä riippumatta aiheesta.
fin	-1	Sekavaa
fin	-1	Hyvähän sinun on hulluista kirjoitella kun itse omaat siitä paperitkin mutta minkä pelin näistä lasket SaPkOn voitoksi?
fin	-1	Aamuisin hengitys on ns.dog breath-p..a maistuu suussa jne.Ja mietin vain,minkä helvetin takia aloin taas polttaa ja millä motivoin taas lopettamaan uudestaan?
fin	-1	Mitä hyvää saat tyylistäsi, vähätellä aina ja kaikkia?
fin	-1	tule suoleen, vaikka onhan ne naisia raiskanneet joka puolella mokomat loiset.
fin	-1	opetele ite enkkuu ja suomenna ite ja ei täne muutenkaa tämmösiä viestit kuulu!
fin	-1	muut pelit toimii hyvin muttei tuo.!!..
fin	-1	Kuinka ja miksi näin lyhyessä ajassa, Suomi kansakuntana rapistui ?
fin	-1	Ei ikinä!
fin	-1	imijät mitään snaijaa, saatikka edes varustettu sisälukutaldolla.
fin	-1	Mutta pari pikkuruista ongelmaa vaivaa mieltäni:
fin	-1	Ja vastaanpa vielä siihenkin, että yhtä vääränä pidän sitä, jos äiti suihkuttaisi tytön alapäähän tarkoituksella vettä kuin jos isä sen tekee.
fin	-1	Alkoholin käyttöä lupasi vähentää, saa nähdä pystyykö.
fin	-1	Ja usein vielä jäävät lässyttämään koirilleen tuohon portille tyyliin "katsos fiffe kun on iso hauva tuolla"... jne. samaa saissea kusettavat ja paskattavat koiransa MEIDÄN portin likelle olevalle nurmikolle joka on siis MEIDÄN tonttiamme.
fin	-1	Juontajat nauro sen jutuille ihan eri tavalla (ok, kuka ei ois voinu olla nauramatta) ja siltä varalta et niitten hehkutus ei riitä, sinne raahataan marco bjurström hehkuttaan lisää...
fin	-1	EIKÄ MYÖSKÄÄN
fin	-1	Lähdin pois, vaikka minua helvetilläkin uhattiin kun en koko vuodeksi jäänyt.
fin	-1	Ujolle maailma on paska paikka, on aina ollut ja tulee aina olemaan....
fin	-1	Kyllä ihme olisi jos persut ei Suomessa olisi vaalien ykkönen sillä niin hävitöntä politiikkaa ovat muut puolueet harjoittaneet
fin	-1	Tunnen häpeää että elän samassa maassa kanssanne.
fin	-1	Voi saatana kuinka mua vituttaa kusipäiset baarimikot ja poket.
fin	-1	Kuitenkin hullu jännitys tuli just ennen inssiä ja tottakai munasin ympyrässä oikein kunnolla ja tutvo iski kärttysestii jarrut pohjaan.
fin	-1	Ihmettelen ihmisten vihamielisyyttä tässä seiska-asiassa.
fin	-1	Mutta vittumaista on täällä haukkua puolisoaan tyhmäksi kun ei tajua mitä oikeasti tapahtuu..
fin	-1	Tämä tietenkin johtaa siihen, että hänen vaimonsa teki syntiä huulillaan, ja siitä syystä oli houkka!
fin	-1	Olet sontasuinen valehtelija!
fin	-1	En ymmärrä, mutta eipä ole minun ongelmani.
fin	-1	ostinko mää paskan?
fin	-1	Tetenkin olen vihainen.
fin	-1	En onnistu ihmissuhteissa ja raivoan vähän väliä, hyviäkin aikoja on mutta palaan aina takaisin enkä usko parempaan, tuntuu että en halua uskoa parempaan, en uskalla uskoa parempaan.
fin	-1	eli joo, ON IHAN SAMA JA YHTÄ TURHA ASIA: miesten peniksen suurennokset ja naisten silikoonit!
fin	-1	Se on vaan niin että harvoin meistä havumetsien miehestä on Italiaanoiksi.Rahatkin loppuisivat tuota menoa hyvin äkkiä.
fin	-1	asiakaspalvelutyössä ei kiukkupussi pärjää.
fin	-1	Kaikki vääristellään oman edun mukaiseksi, ja selän takan puhutaan paskaa.
fin	-1	Mä en kahta kertaa miettis kumpi on mulle tärkeämpi, mun rakas vai mun omaisuus.
fin	-1	Ei luulisi kaikkivaltiaan itsetunnon olevan niin löyhässä, että tarvitsisi itsetuntoaan kohottamaan ihmisten uskoa häneen.
fin	-1	Turha hakea lohtua DMI:n käyrästä; se näyttää ihan samaa.
fin	-1	Elämän keskipiste on ulkonäkö ja muusta se ei varmaan mitään tiiäkkään.
fin	-1	Mutta näin vaan kävi että ystävyys poikki.
fin	-1	oikeesti haiset varmaan ihan helvetin pahalle...
fin	-1	ei voi kuin ihmetellä usan pressaksi aikovien älykkyyttä.
fin	-1	Ja muut tavat ovat vääriä.
fin	-1	Ei pidä kuvitella jotta tulee saamaan ilman vastinetta sitä elantoa sossun luukulta lopun ikäänsä, sehän jopa pienentää eläkettäkin ja taas aiheuttaa lisää marinaa.
fin	-1	inhoan kaikkea mikä liittyy lentämiseen ja etenkin niihin terminaaleihin.
fin	-1	Aikaisemmin en ollut lukenut paljon pa**aakaan eikä Harry Potter kuulostanut järin kiinnostavalta.
fin	-1	Minäkuitenkin itkin ja ikävöin vain sinua.
