lang	sentiment	text	num_tokens
est	-1	Avalikud ressursid on alati piiratud ning nende killustamine annab teisal (näiteks järjekorra pikkuses) valusalt tunda. Eriti tuntav on see ööpäev ringi osutatavate teenustega – rusikareegli järgi on ühe ööpäevase valveringi mehitamiseks vaja 4,5 arsti ja õe ametikohta.	41
est	-1	Arva, arva, milline on kõige selgrootum erakond Eestis?:)	13
est	-1	Taksopiraadid töötavad tavaliselt kas ilma plafoonita või kinnitavad taksotunnust matkiva tunnuse autole ebaseaduslikult, toimib ka omavaheline mobiilside ja muud leidlikkusele viitavad võimalused. Seega on piraattaksojuht leidlik ning seaduslikes piirides teda tabada on keeruline.	36
est	-1	Kindlasti venelane.	3
est	-1	Enamasti ei ole need arvamuse avaldajad oma palga vähenemisega nõus ning sooviksid madalaid palku kõigile teistele peale iseenda ja seda ei saa lugeda eetiliseks mõtlemiseks.	26
est	-1	Raul Meele lugu on tõsisem, tema riigivastastele roppustele pühendatud tuba mõjub sümboolse kallaletungina Eesti riigile. Mis sellest, et prokuratuuri arvates mitte (sest lipu mõõdud ei ole täpsed).	33
est	-1	Analüüsi ühe osana tuvastati ka riigid, kus on järgneva aasta jooksul alust karta internetivabaduste vähenemist: Aserbaidžaan, Liibüa, Malaisia, Pakistan, Venemaa, Ruanda ja Sri Lanka.	32
est	-1	Kui teil on 200 milli leidmine nii lihtne, siis langetage veel tulumaksumäära. Elu ei pea liiga kerge olema.	21
est	-1	Saaks Ansipi kuidagi nutikalt 250.-eurot kuus elama panna. Siis ta saaks kohe aru, mis on nutikas, mis mitte.	22
est	-1	Ei, ühest küljest oli härra Athol Fugard muidugi geniaalne, et ta just selle tõsiloo välja valis. Paremat ei saa tahtagi. Situatsiooni ahistus sünnitab võimsa pääsemisootuse. See oli see, mis mõjus. Aga see mage tekst! Need poolsuured sõnad ühe vene talumehe suus, see poolfilosoofiline targutus. Aafrika kirjaniku fantaasia Nõukogude Vene oludest Eesti laval. Palju suurema ringiga enam tulla ei saakski. Aga võib-olla oleks see kõik meelest ära läinud, kui sel isemoodi jõhkral ja naljakal mugavusetragöödial oleks olnud vääriline lõpp.	92
est	-1	Kindlasti venelane.	3
est	-1	Seepärast ei avaldanud Facebook mulle algul kuigi suurt muljet. «Sotsiaalvõrgustik … jah, Eestis on see ju juba aastaid, mis siis nüüd?»	27
est	-1	«Rahvas oli õues, sees oli aga pime ja vaikne. Ma sain aru, et see vaikus on kõige õudsem vaikus.»	25
est	-1	Kui teil on 200 milli leidmine nii lihtne, siis langetage veel tulumaksumäära. Elu ei pea liiga kerge olema.	21
est	-1	Nagu igal aastal, kogunesid rünnakutes hukkunud ligi 3000 inimese lähedased New Yorki Maailma Kaubanduskeskuse kaksiktornide asukohta ehk nn Ground Zero juurde ja lugesid ette kõigi hukkunute nimed.	29
est	-1	«Kahtluse korral palume helistada mupo infonumbril 14410 ja võimalikult täpselt kirjeldada kahtlusalust autot, ütelda sõiduki registrinumber ning asukoht,» ütles Rand.	25
est	-1	Nii lolli pealkirja pole kaua olnud. Õnnitlused üllitajale!	10
est	-1	Ema oli esimesi päevi diakooniahaiglas, kui mina teda vaatama sõitsin. Vend käis iga päev, sest süda palus nii ja ema ju ootas. Hinges oli ärevus ja südames valu, sest armsa lähedase haigus ja teadmatus sellest, kui palju on veel elupäevi antud, teevad väga nõrgaks, tundlikuks ja segavad kõik piirid reaalsuse, imede ning uskumatute lootuste maailma vahel. Hirm oli, et mis küll saab ja kuidas tal seal läheb.	79
est	-1	Niimoodi tuleks läbi kaaluda ja arvutada paljud teised raudteed puudutavad mõjurid, et lõpuks leida otstarbekaim lahendus. AECOMi uuring meid palju ei aita, sest seal on arvutused tehtud ideaalmaastikust lähtudes. Paraku pole viimast olemas.	38
est	-1	Arhitekt Emil Urbel märkis, et juurdeehitise näol on tegemist suurima puithoonega, mis viimastel aastatel Eestis kerkinud.	19
est	-1	Pauli hinnangul pole uute rongide istmed mugavamad kui vanades rongides. «Seljatoed võiksid olla allalastavad ja jalaruumi võiks rohkem olla,» arvas ta. Paul lisas, et rongis võiks olla isumismugavus vähemalt sama suur kui bussis, aga kahjuks ei ole.	45
est	-1	Kuule, mees, kus sa elad? Ja kas käid kinnisilmi Tallinnas ja Eestis ringi, kus iga nurga peal ja nurgataga muud ei kuulegi kui venekeelset möla..See vene oht on kogu aeg meie endi nina ees.	41
est	-1	"Paraku toetab THI juudiameerikalikku arrogantsi siinne kompartei- ja komsomolieestlastest Eesti Vabariigi koorekihiks tõusnud eliit, kes oma ENSV-aegse Soome-TV-ihaluse ja soome turistide kultuse on samuti ""peenemaks"" konverteerinud ja lähtub mitte EESTI ja eesti rahva reaalsustest, vaid ""klamuursetest"" unistustest, juudimarksistlikest ühiskonna revolutsioneerimise projektidest, kahtlase väärtusega edetabelitest, nn ""mainekujundusest"" ja muust butafooriast."	61
est	-1	"""Meie mänedžerile Annile hiiliti selja tagant ligi ning määriti nii kokku, et ta ei saanud mitu päeva ennast puhtaks,"" räägib Kaare."	26
est	-1	Kuid siin on juba esimene halvalõhnaline aspekt: ostja asi pole hinda küsida, see on müüja määrata ning on ebaloogiline, kui omanik müüb midagi alla turuväärtuse. Kuid et linn seda vähemalt varasematel müügikordadel on teinud, tõendab see, et pärast müüki on varale tekkinud kuni 50 protsenti kõrgemad hüpoteegid.	54
est	-1	Estonian Airi likvideerimisega lahti kammitsevast probleemist, kuid langeme üha enam perifeeriasse. Lahenduste puudumine maantee- ja raudteetranspordis lausa nõuavad sidemete säilitamist õhuteid pidi. Kulunud ütlus on, et turg tühja kohta ei salli, et tulevad mõned odavlennufirmad, võib-olla ka mõned kontinentaalsed lennud Aasiast, kuid meie probleeme see ei lahenda.	55
est	-1	Riigieelarve maht on meil umbes seitse ja pool miljardit eurot. Inimesi on meil umbes üks miljon ja kolmsada tuhat. Kui jagame riigieelarve elanike arvuga ja siis kaheteistkümne kuuga, saame pisut alla viiesaja euro kuus. Pisut alla viiesaja euro kuus on siis see summa, mille ulatuses on alust igaühel imikust surmaeelikuni riigi käest üht, teist või neljateistkümnendat teenust oodata. Riigikaitsest titetoetuseni, kooliharidusest tõvetohterduseni, maanteedest pensionideni. Ja nii edasi.	78
est	-1	Ei tea kas mingi esimese astme kuritöö puhul aitaks ka süüst vabaneda lihtne mittemäletamine või asjaolude valikuline meenumine?	19
est	-1	"Milliste koerustükkidega filmi- ja laulumees aga poisikesena hakkama sai, et vanaema teda niimoodi karistas? ""Eks ma lõhkusin mõne hinnalise asja ära või ei allunud tema käskudele-keeldudele,"" arvab Volmer. ""Kuid ega ta kogu aeg siis ka nii ei teinud. Tegelikult ma mäletan paari sellist korda ja see nagu kinnistus mu mällu."" Siiski nendib Volmer, et see pole ainuke pimedusehirmu tekkimise põhjus."	72
est	-1	Tokyo nõuab, et Peking maksaks kinni kahjud, mida tekitati Jaapani välisesindustele vaidlusaluste saarte tõttu puhkenud ja kohati vägivaldseks muutunud meeleavalduste käigus, teatas valitsus täna.	28
est	-1	Purjus kliendid ähvardasid Tallinnas söögikoha süüdata	6
est	-1	Kiievis kogunes Iseseisvuse väljaku lähistele kümneid tuhandeid inimesi, kes avaldasid protesti valitsuse otsuse vastu loobuda integreerumisest Euroopa Liiduga.	20
est	-1	kuidas tagame sisejulgeolekut, kui koondame politseid ja kärbime palku. Kaasajal algavad kriisid ikkagi riigisiseselt ja rahvusliku konfliktide pinnal. Kas mäletame, et aprillimäsu ajal toodi mujalt Eestist politseinikke Tallinna, et korda hoida, järelikult koosseisud on väikesed.	42
est	-1	näha on, et nii kiiresti kokku klopsitud. täiesti mõtetu video.. pole seal midagi erilist. võiks vähe rohkem vaeva näha	23
est	-1	Tartu ringkonnakohus tühistas aga 13. juunil osaliselt maakohtu otsuse ning seda mõlema süüdistatava süüditunnistamises ja karistamises tapmises piinaval ja julmal viisil. Ringkonnakohus mõistis nad selle süüdistuskvalifikatsiooni järgi esitatud süüdistuses õigeks, kuid mõlemad mehed jäid endiselt süüdi tapmises seoses röövimisega. Selle eest mõistis ringkonnakohus Kabanovile 17-aastase ja Karanetsile 15-aasatse vangistuse. Nimetatud karistused jäid liitkaristustena kaetuks mõlemale mehele varguste eest mõistetud karistusega ning jäid seega lõplikeks vangistusteks. Muus osas jättis ringkonnakohus maakohtu otsuse muutmata.	78
est	-1	Venemaal kukkus alla ründelennuk SU-25	5
est	-1	Eks see halb mälu annab ilmselt viite ka nende toonaste finantstippjuhtide muudele võimekustele...	14
est	-1	Tohutu töö tulemusena saime teada, et meil on 48 «lilla leegi hoidjat» ja käputäis nn protestiusundite esindajaid, kuid 54 protsendi (s.o üle poole elanikkonnast!) ühte patta viskamist ei saa diagnoosida muul moel kui täieliku äpardumisena.	43
est	-1	Muret teeb aga, et kavandatud haridusreform tundub viivat meid hoopis vastupidises suunas. Põhimõte, mille kohaselt ei ole olemas odavat ja head, kehtib paraku ka hariduses. Tähendab ju hariduses koonerdamine tulevaste põlvede arvel elamist selle kõige otsesemas tähenduses.	43
est	-1	Nädalapäevad tagasi kritiseeris FC Barcelona poolkaitsja Andres Iniesta Madridi Reali peatreenerit Jose Mourinhot, et klubile aastatega nii oluliseks meheks tõusnud väravavaht Iker Casillas on meeskonnas tõrjutu positsiooni sattunud.	30
est	-1	Tallinn on vastu võtnud dokumendi «Tallinna huvihariduse võrgu arengukava 2007–2017», kus kirjas, et loodus- ja tehnikahuviharidusega on Tallinnas ajaloolistel põhjustel halvasti, aga 2008–2009 oli plaanis eraldada pea 5,5 miljonit krooni uute huvihariduse valdkondade arendamiseks ning keskkonna-, loodus- ja tehnikavaldkonna eelisarendamiseks. Võimalik, et selle tegevuse tulemus ei kajastu Postimehe vahelehes avaldatus, aga tundub, et plaan ei ole väga edukas olnud.	70
est	-1	Zahkna alustas võistlust kolmandalt positsioonilt ja eksis neljas tiirus kokku kolm korda ning ületas lõpujoone teisena. Esikoha teenis ameeriklane Sean Doherty, kes eksis samuti tiirudes kolm korda. Zahkna kaotas võitjale 34,7 sekundit.	36
est	-1	Esmaspäeval on vähese ja vahelduva pilvisusega ilm. Hiiumaal ja Saaremaal võib sadada vähest vihma või lörtsi.	18
est	-1	Eesti Vabariigi vastu tegutsev keskerekond, Tallinna linnavalitsus koos vene mõjuagendist linnapea ja koos viienda kolonnigapluss see praegune võimuhulluses Putin - ähvardab meid juba rohkem kui 20 aastat see punase katku oht! 	33
est	-1	kõik ta armukesed on ühte nägu	6
est	-1	Tänapäeval on palju erinevaid rohtusid ja et õiget leida, mis olukorra kontrolli alla hoiab peaks arst natuke vaeva nägema.	21
est	-1	Valik pole just lai: lisaks tänavu vankrit vedanud Janar Taltsile ja Reinar Hallikule võib tulevikus arvestada seekord vigastuse tõttu loobunud Joosep Toomega, mõne aasta pärast ehk ka tänavu U20 koondises põhikeskmängijaks olnud Rauno Nurgeriga. Ja ongi kõik. Vallo Allingu koondisse naasmisele pole mõtet loota, lõputult ei tasu ju ka Rain Raadikut kaasa vedada, Kristjan Kitsing… nojah, esialgu võiksid kaks viimast näidata mingitki taset koduses liigas.	73
est	-1	Ta ju sünnitamatagi välja veninud!	6
est	-1	James Franco ja 17-aastase tüdruku sõnumivahetus avalikustatud – näitleja sai korvi!	12
est	-1	Tallinna halduskohtus algas täna riigikogu keskerakondlasest liikme ja endise Tallinna abilinnapea Yana Toomi kaebuse arutamine kaitsepolitseiameti (kapo) tegevuse õigusvastasuse tuvastamiseks ja ettekirjutuse tegemiseks.	26
est	-1	Õigusruumi korrastav jahiseadus peab end praktikas tõestama.	8
est	-1	Kuna U.S. Masters Swimmingu sarjas ei kehti USA Anti-Dopingu Agentuuri (USADA) dopingureeglid, ei kehti seal ka Armstrongi eluaegne võistluskeeld.	24
est	-1	Ja korras. Homme ei mäleta enam keegi midagi.	10
est	-1	Karl Kermese juhitav Monoteater esietendas stand-up-komöödia «Nüüd tõesti aitab jamast» 1. oktoobril Räpina aianduskoolis. Peeter Oja esitas publikule veidi enam kui tunni jooksul Eesti poliitikute tüüpe, tõi esile nende naeruväärsusi, vastutustundetust ja kaugenemist valijatest.	40
est	-1	No on ikka erilised ajuinvaliidi :D	7
est	-1	«Kui politsei kohale jõudis, oli sündmuskohal ainult sõiduauto. Juht oli lahkunud,» ütles politsei pressiesindaja Hedy Tammeleht ajalehele Saarte Hääl.	25
est	-1	13aastane meelas prantsuse modell tõi skandaali	6
est	-1	Kas tõesti kedagi tõsiselt häirib see, kui ma rongis istudes ühe õlle ära joon, samas kedagi teist ei tülita? Kas ka sel juhul peab politsei kutsuma?	30
est	-1	Kui viie aasta eest olid eestlased teistest ees, siis nüüd on nad teistest maas. Selmet leiutada asju, mida teised kasutavad, kasutavad eestlased nüüd asju, mida teised on leiutanud, kirjutab kolumnist Abdul Turay.	39
est	-1	Paraku on ikka on ikka ja jälle liikuma panevaks jõuks kokkuhoid, aga mitte mõistmine, kuidas igaühe elu õnnelikumaks muuta. Samamoodi on sotsiaalministeeriumis valmiva töövõimetuspensionide reformiga. Hakates täitma valimislubadust seadustada tööõnnetuste ja kutsehaiguste kindlustus tänapäevasel moel, avastati, et riigi rahakotist neelab aasta-aastalt üha enam miljardeid masu ajal kümnete tuhandete võrra kasvanud töövõimetuspensionäride armee.	59
est	-1	Kas siin on Skandinaavia?	5
est	-1	Teiste võimalike ohvrite otsingud käivad, rääkis Borno keskkonnaameti töötaja Saidu Yakubu ajakirjanikele.	14
est	-1	Iisraeli meedia andmeil kutsus Netanyahu eelmisel kolmapäeval kokku julgeolekujuhtide ja olulisemate kabinetiministrite erakorralise koosoleku, et arutada olukorda Süürias ja ohtu, et see kaotab kontrolli oma massihävitusrelvade arsenali üle.	31
est	-1	Seni ei ole mitte ükski äärmusgrupeering rünnakut omaks võtnud.	10
est	-1	Saa kaineks. Kujutad sa ette, milline paanika läheb selle peale Euroopas lahti?	15
est	-1	"Öiste madalate temperatuuridega ei harjunud ta lõpuni ja magas seetõttu öösiti katkendlikult. ""Kahetsesin, et eelnevalt häbiväärselt vähe talisuplust harrastasin,"" tunnistab Kertu."	27
est	-1	Tegelikult ei olnud VEB fond muud kui nõuete register, sest Venemaa ja VEB pole iialgi sellist moodustist nagu VEB fond tunnistanud. Moskvas külmutatud arve omanikuks sai aga PEP ja on seda muuseas siiani!	36
est	-1	Väga keeruline teema.	4
est	-1	Kusjuures erakondade libedakeelseid ja oma sõnavara kontrollivaid kommentaatoreid me ei suuda tõenäoliselt mitte kunagi minema peletada. Meil ei ole selleks alust. Või on? Avalik pahameel ei lähe neile niikuinii korda. Nad on nagu armee, kes kuulab oma kindralit, mitte oma südametunnistust.	48
est	-1	Nagu uute asjadega kipub olema, nii on üht-teist veel pooleli, näiteks oli laupäevalgi veel osa akvaariume tühjad. Ent see-eest on muuseum saanud kõneka eksponaadi, kurikuulsa Savisaare enda. Koguni kaks tükki paistis teisi olevat!	39
est	-1	«Mis puudutab meie saatkondadele ja konsulaatidele tekitatud kahjusid, kavatseme (Hiinalt) kompensatsiooni nõuda, sest see on valitsustevaheline küsimus,» ütles valitsuse peasekretär Osamu Fujimura Tokyos ajakirjanikele.	32
est	-1	Kõigepealt eemaldage siin Eesti Vabariigis sisemine oht ehk Eesti riiki sisemiselt õõnestavad ja selle vastu töötavad sisevaenlased igasugustelt linna- või riigivõimu juurest, siis saab alles kaugemale vaatama hakata.	30
est	-1	Kantseliiti kohtab ka mõnes pikemas lauses: «Elron pakub lisaks rongide sõiduplaanidest kinnipidamisele ja heale klienditeenindusele rongides reisijatele mitmeid väärtusi, mis koos moodustavad ettevõtte reisiteenuse. Reisiteenuse sujuvaks osutamiseks vajalike tegevuste järjepidevuse tagamiseks on teenus jagatud erinevateks teenusekomponentideks, millest igaühe eest vastutab ettevõttes konkreetne protsess.»	50
est	-1	Kui liikumise Vene Kool Eestis esindaja julges äsja arvata, et selle MTÜ baasil võiks kujuneda uus venelaste erakond Eestis, olid mitmed Keskerakonna juhtpoliitikud need, kes selliste mõtete väljaütlejaid kurjalt noomima asusid. Kes suudaks meenutada kõiki neid siseopositsioonide kadumisi, mis aastate jooksul Keskerakonnas on aset leidnud. Meikari juhtumi käsitlemine vaid alatu mässukatsena näitab, mis saab siis, kui Reformierakonna sees isemõtlemist ja võimu teostamise läbipaistvust harrastada julgetakse.	74
est	-1	mhh :) hullult pildirikas asi üles pandud.	9
est	-1	Kas Rakvere raamatukogus tegutseb tõesti pervert?	7
est	-1	see ju vihje, äkki võtab keegi murjami tööle !	10
est	-1	"""Ma tean, et ta sai pakkumise Türgist. Ja ma tean, mis otsuse ta talvisel üleminekuaknal vastu võtab, kuid ma ei saa seda avaldada,"" sõnas Sahin NTVSportile."	34
est	-1	mul vennanaisel sama probleem - peale sünnitust keeras naine ära , aga arsti juures käies (visiit 5-10min) ajab normaalset juttu ja psühhiaater arvab , et kõik on korras. rohi on selline , et laseb lihsalt magada ilusti. abikaasa vastu vaenulik ja , kui see kurdab arstile, siis arst usub haiget ja abikaasa peab elama oma naise igapäevase kiusu all - jube olukord.	68
est	-1	Ah soo, nüüd on siis teada, kust joodikud tulevad.	12
est	-1	Tegelikult ei olnud VEB fond muud kui nõuete register, sest Venemaa ja VEB pole iialgi sellist moodustist nagu VEB fond tunnistanud. Moskvas külmutatud arve omanikuks sai aga PEP ja on seda muuseas siiani!	36
est	-1	Paistab, et Rail Balticu trassi valik Eestis läks kohe algul valesse rööpasse. Algsete lähtekohtade mõtestamisel tehti põhimõtteline viga. Seda käsitleti ainitiselt majandusliku otsustusena. Veel halvem, otsustuse aluseks ei olnud niivõrd Eesti, kuivõrd kusagil eemal asuva majanduse vajadused.	44
est	-1	Zanettile tehakse täna põhjalikumad uuringud, mille järel selgub, kas argentiinlane saab jalgpallurikarjääri jätkata. Suvel 40-aastaseks saav Zanetti on teatanud, et sooviks vähemalt ühe aasta veel Interi särki kanda, kuid tõsisema vigastuse korral – kardetakse rebestust, mis jätaks jalgpalluri palliplatsilt eemale kaheksaks kuuks – võib nendel plaanidel kriips peal olla.	56
est	-1	Pakistani korrakaitsejõud teatasid mõrvasüüdistusest rõivavabriku ülemuste ja valitsusametnike vastu Karachis ligi 300 elu nõudnud põlengu tõttu.	17
est	-1	Nigeeria mošeerünnakus hukkus kümneid inimesi.	6
est	-1	Peaasi et kogu sest jutust nüüd vale mulje ei jääks – et mingi teatriavangardist on oma tegevuse lihtsalt filmi üle kandnud ja kavatseb vaatajaid lollitada. Mida ütleksite kokkuvõtteks?	30
est	-1	Politsei teatel viitavad kogutud tõendid, et kuriteod pandi toime tänavu suvel. Mehi kahtlustatakse eraviisilises jälitustegevuses. Neljast mehest ühte on varem karistatud altkäemaksu andmise eest	27
est	-1	Kui arutelu Tallinna tervishoiu strateegiliste valikute üle on oluline ja kahtlemata vajalik, siis vastastikku süüdistuste pildumine ei ole seda teps mitte. Linna ja riigi vägikaikaveo asemel on Tallinna tervishoiu korralduses vaja keskenduda koostööle patsiendi huvides. Nii nagu ei ole Keskerakonna ainuvõim Tallinnas igavene, ei pea igavene olema ka riigi- ja munitsipaalhaiglate vastandamine. Mõistlik on vaadata suuremat pilti ning hinnata adekvaatselt igaühe rolli selles. Patsiendi jaoks ei ole ju suurt vahet, kas haigla omanik on riik või linn, tähtis on teenuse kvaliteet ja kättesaadavus.	92
est	-1	Muret teeb aga, et kavandatud haridusreform tundub viivat meid hoopis vastupidises suunas. Põhimõte, mille kohaselt ei ole olemas odavat ja head, kehtib paraku ka hariduses. Tähendab ju hariduses koonerdamine tulevaste põlvede arvel elamist selle kõige otsesemas tähenduses.	43
est	-1	Lauljatar Lindsay Lohan murdus ja jõi veini, kuigi ta ei oleks tohtinud pärast võõrutusravi alkoholi pruukida.	18
est	-1	Süüdistuse järgi tungisid mehed 2004. aastal ööl vastu 4. oktoobrit Viljandi kesklinnas kallale toona 17-aastasele neiule, tirisid ohvri ühe maja hoovi ja vägistasid ta seal. Pärast vägistamist talutas Maisalu neiu Viljandist välja ja lükkas ta linna lähedal ojja.	41
est	-1	Netanyahu viitas oma kõnes rahvusvahelisele holokausti mälestamise päevale ning süüdistas Iraan holokausti olemasolu eitamises, «valmistudes samal ajal järgmiseks holokaustiks - juudiriigi hävitamiseks».	26
est	-1	Virumaa Teataja toimetusse, paljudele kontaktidele Eestis ja kogu maailmas saabus täna Vinnis tegutseva Hapro International Balti piirkonna juhi Taimo Kaldma nimel meil, kus ta palub 1800 eurot laenu, kuna on Ukrainas Luganskis reisil olles kaotanud nii rahakoti kui telefoni ja ainus võimalus temaga kontakteeruda on e-posti teel. Tegu aga on petukirjaga.	56
est	-1	«Rahvas oli õues, sees oli aga pime ja vaikne. Ma sain aru, et see vaikus on kõige õudsem vaikus.»	25
est	-1	Ma olen Tallinnas jalgrattaga sõitnud nii kaua, et ei mäletagi täpselt, kui kaua. Kümme aastat kindlasti. Iga päev. Aasta läbi. Ja sõltumata sellest, kas keegi parajasti edendab kergliiklust ja ehitab uusi rattateid või mitte. Minusuguseid on teisigi. Ja mõnikord tundub mulle, et jalgrattaga ei sõideta rohkem mitte võimumeeste tegevuse tulemusena, vaid hoopis selle kiuste.	66
est	-1	Olge,kes Te olete, ärge pasundage ajakirjanduses Eesti rahvale oma eraelu.Eraelu olgu puutumatu ja kuulugu ainult kahele.	20
est	-1	jama jah, et just Eestile kõige olulisemate probleemidega ei taheta tegeleda ega neid tunnistada, samas kus riigikogus istub 101 muidusööjat kes soovivad igal aastal oma palkasisd tõsta ja seda ka teevad, ja kahjuks seda oma kasvavas vaesuses elava rahva arvelt sh. alatoitluse all kannatavate laste arvelt.	51
est	-1	«Ühtlasi pole sooritatud kuriteo laadi ja raskust arvestades kantud karistus piisav, et täita oma üld- ja eripreventiivset eesmärki, sest reeglina peaks raske seksuaalkuriteo toimepanija kandma vangistuse tähtaja lõpuni,» lisas kohus. Samale seisukohale jõudis kohus Maisalu vabastamist arutades ka tunamullu detsembris, sama aasta oktoobris tegi aga kohus sama otsuse Maisaluga koos samas kuriteos osalenud ja karistada saanud Raul Kõlvaldi suhtes.	67
est	-1	Sotsiaalsed olud kujundavad põlvkondi. Üks niinimetatud indigolaste põlvkonna käitumise peamisi põhjuseid on suurenenud sotsiaalne turvalisus ning võimalus vabalt valitud tegevusalal ka keskpäraselt pingutades oma eluga enam-vähem normaalselt toime tulla. Loodud on kujutluspilt, nagu oleks nõudlus nende oskuste ja tööjõu järele igikestev.	45
est	-1	Sedasama ei saa kahjuks öelda humanitaarteadlaste kohta – isegi samal maal elavate ajaloolaste vaatenurgad erinevad sõltuvalt nende rahvusest, töökeelest, ühiskondlikust positsioonist (võrdleme näiteks baltisaksa ja eesti ajaloolaste kirjutatud Eesti ajaloo käsitlusi).	36
est	-1	Represseerituile oleks olnud mõttetu öelda, et ärge endast liiga palju arvake, ega’s ta teid represseeri. Mitte ainult mõttetu, vaid ka vale. Represseeris küll, nii kõiki koos kui igaüht eraldi. Oli muidugi ka juhuslikke ohvreid, kuid tervikuna iseloomustab Venemaa poliitikat läbi ajaloo, vastupidi, just silmatorkav konkreetsus.	58
est	-1	Toon omale liitri viina ja joon need krokodillid ilusaks.	10
est	-1	Saa kaineks. Kujutad sa ette, milline paanika läheb selle peale Euroopas lahti?	15
est	-1	"""Ma tean, et ta sai pakkumise Türgist. Ja ma tean, mis otsuse ta talvisel üleminekuaknal vastu võtab, kuid ma ei saa seda avaldada,"" sõnas Sahin NTVSportile."	34
est	-1	Aga nagu öeldakse: inimene mõtleb ja arvestab, jumal juhib. Jumal juhtis seekord niimoodi, et Eestist Venemaale pääsu pidime ootama kokku ligi kaheksa tundi. Kõik olekski ehk korras olnud, kui jumalateks poleks end pidanud ASi Transservis-N töötajad, kelle käes vägi ja võim vajutada nuppu, mis lubab ootavatel autodel sõita piirijärjekorda. Omaette teema on see, et enesestmõistetavalt käratavad nii putkajuht kui vahetult piiril korda pidav ametnik ootajaid nõudlikult vene keeles oma kohale, teatades, et eesti keeles nad ei kõnele.	90
est	-1	"Tuul, mis matkajaid tipu pool tervitas, oli hingematvalt külm ja Kertu pani selga päris mitu kihti riideid. ""Ülemise otsa peal soe pesu, vest, fliis, sulejope ja veel eraldi kaasa võetud soe ja veekindel talvejope. All samuti soe pesu, puuvillased suusapüksid ning nende peal omakorda veekindlad suusapüksid."""	57
est	-1	Nii on tekkinud Eestisse, eriti maapiirkondadesse, pruudipõud. Liiga paljud madalama otsa mehed on jäänud haridussüsteemi ja elu hammasrataste vahele, samal ajal kui naised lõpetavad oluliselt sagedamini ülikooli. Naised ei soovi end madalama haridustasemega mehega siduda ning nii tulebki välismaa poole kiigata. Tõsi, eks läände minemise põhjuseid ole teisigi, kuid sageli viib üks asi teiseni, meheni. Ju on nendes seal midagi, mida meil puudu.	75
est	-1	Eile õhtul läksin koju ja ehmatasin hirmsasti.	8
est	-1	Süüdimõistmisel võib kohus narkootilise aine suures koguses ebaseadusliku käitlemise eest määrata ühe- kuni kümneaastase vangistuse.	16
est	-1	Surnud ühiskond ei vaja elusaid inimesi ... nad ei sünnigi ... raha ei sünnita Elu.	16
est	-1	Nagu näha, on Eestis sõitvaid heal tasemel rallimehi vähe ning kõik see on kahandanud publiku huvi – rahvamassid olid raja ääres vaid Rally Estonial ja ilmselt tullakse ka Saaremaale, kuid napi säraga võistluste vastu puudub suurem huvi.	40
est	-1	Laps kasvab ja areneb oma väikeses maailmas mängides, et harjuda kohanemisega, et suurena mängida kõiki teisi mänge. Kuid nii nagu laps kipub unustama, nii unustame ka meie oma kohanemisvõime ning ühel hetkel ei tundugi elu enam nii tore – siis, kui oled mängust justkui välja lülitatud või jäetud, kui tunned, et sind ei ole enam vaja.	64
est	-1	äkki teed vahet 'kübereksperdil' ja 'küberPOLIITIKAeksperdil'??	10
