lang	sentiment	text	num_tokens
est	1	Piletimäng: võida vabapääse Rock Café homsele kontserdile	8
est	1	Kui ma kümne aasta eest esimest korda Eestisse sattusin, oli Eesti palju arenenum kui mu kodumaa Suurbritannia. See oli otsekui ilmutus. Just Eestis õppisin tundma sotsiaalvõrgustiku ideed.	31
est	1	Peatreenerist papa Soku sõnul said paljud mängijad juurde häid kogemusi ja suutsid tõestada, et võivad olla isegi paremad kui mõned Euroliiga pallurid. «See on väga suur vahe, kas mängida igapäevaselt siin koduliigat või Euroliigat,» nentis ta. «Nüüd tõstsid aga mõned mehed oma lati väga kõrgele.»	55
est	1	Alkoholilõhnaline vedelik peeti kinni ja suunati ekspertiisi.	8
est	1	Võitjate poolel said lisaks Ronaldole tabamuse kirja Raul Albiol, Mesut Özil, Karim Benzema, Luka Modric ja Angel di Maria.	23
est	1	Viinistu kunstimuuseum asub kunagise kalatööstuse kohal.	7
est	1	Pikemat aega tühjana seisnud majas inimesi ei viibinud ja keegi kannatada ei saanud.	14
est	1	Žüriid peab Janno väga tugevaks ja auväärt seltskonnaks, nii et iga sealt saadud 10 läks otse südamesse. Päris üllatusena kahe esimese hulka jõudmine talle ometi ei tulnud. «Eks väike lootus ikka alati kuskil on!» tähendab Janno. Eurolaval bänd ennast siiski veel ette ei kujutanud. «Kui kahe sekka saime, siis mõtlesime, et nende asjade peale oleks pidanud hakkama mõtlema siis, kui see oleks kätte jõudnud.»	78
est	1	Peciukievicius pallis mullu Vilniuse Sakalais ja oli Leedu meistriliiga paremuselt neljas söödumeister. Matulionis on aga mänginud Šiaulias ja Panevežyses ning olnud nendes meeskondades ikkagi mängumeeste hulgas. Ilmselgelt tulid mõlemad mehed Eestisse sooviga saada palju mänguaega ja koguda head statistikat. Tugevasti muutunud Pärnu võib kahe leedulase toel olla üks tänavuse hooaja musti hobuseid.  	56
est	1	Tundub äge saade tulevat. Hoian Vanemuisele pöialt :)	10
est	1	Oma seitsmeaastase poja Toni kohta tunnistab ta, et laps on lugema ja arvutama õppinud justkui salaja, igatahes kodus teda keegi õpetanud pole.	25
est	1	Karlsson, Sina või ? :-) Rahu, ainult rahu...	13
est	1	Üks paraadil osalenud uudishimulik sõdur küsis kuninglikult paarilt, kuidas George'il läheb ja sai vastuseks, et pisikesel printsil on kõik hästi ja ta veedab aega roomates ja süües.	30
est	1	Tõesti, ei ole mõtet püüda olla isekalt «elus», kui ise’t enam ei ole. Dr Peeter Mardnal on passi juures paber palvega, et teda ei elustataks kliinilisest surmast. Selline testament on ka mul taskus. Juriidilist jõudu sel ei ole, aga ehk arstid siiski arvestavad.	55
est	1	Loomulikult meeldib jahu oma rohkem.	6
est	1	Suurem osa Soome kolinud inimestest leidis kolme kuu jooksul töökoha ja enamasti leiti töö sugulaste või tuttavate kaudu. Kolmandik väljarändajatest töötas oma esimeses töökohas oskustöölisena ja neljandik lihttöölisena. Ligi kolmandik tegid tööd, mis oleks eeldanud madalamat kvalifikatsiooni. Kõige sagedamini leppisid oma kvalifikatsioonist madalama ametiga kõrgharidusega väljarändajad. 91 protsenti Soome kolinutest on oma tööga rahul.	60
est	1	Endrekson tuli ühepaatide konkurentsis rajale kolmandas eelsõidus ning sai seal ajaga 7.16,67 kindlalt teise koha. Esikoha saanud prantslase ajaks oli 7.11,41. Otsepääsme poolfinaali tagasidki kaks paremat.	29
est	1	Tartu kunstimaja pööning näeb välja nagu mõne teise sama suure ja pool sajandit vana maja katusealune. Erinevalt teistest on aga siit poole aasta jooksul läbi käinud kunstniku inspiratsioon, seda on puudutanud jumalik hingus.	36
est	1	Iseseisev Eesti riik on meie põhiseaduse toel kahe aastakümnega eesti kultuuri ja keele positsioone oluliselt tugevdanud ja seda mitte ainult  meie riigi piires, vaid avatud suhtluse abil ka meie piiride taga ELis ja kaugemalgi. Eesti on kujunenud võrdväärseks partneriks rahvusvahelises majanduslikus, poliitilises ja kultuurilises koostöös.	49
est	1	TJA jätkab täiendavalt juhtumi asjaolude väljaselgitamist, veendumaks lõplikult selles, et rikutud pole liikluse korraldamise või veeremi käitamise nõudeid. Samuti kogub amet regulaarselt teavet õnnetuse põhjuste kohta, et pakkuda välja meetmed, kuidas tagada edaspidi ohutus vältimaks taolisi olukordi.	43
est	1	See on üsna tavaline. Esimesed luulekogemused ongi laulu kaudu tulnud. Juba vanaisa laulis väga palju vanas põlves. Kui ta enam muud ei teinud, siis istus voodi ääre peal ja laulis Anna Haava sõnadele tehtud koorilaule. Tal oli repertuaar tegelikult väga suur. Vanasti kirjutati laule salmikutesse, külanaistel ja -meestel olid endale laulikud kirjutatud.	60
est	1	Nõustume, et õpetajate palga tõstmine on hariduse jätkusuutlikkuse ning kvaliteedi seisukohalt võtmetähtsusega.	14
est	1	«Meenutame, et paar aastat tagasi oli sama olukord Eestis, nüüd on meie kaupmehed jõudnud kohaneda ning sisseostuplaanid on tehtud optimaalsemad, seetõttu puudub ülevaru probleem. Näeme selgelt trendi, et klient teeb varasemast rohkem ostuotsused kvaliteetse ja seega kallima kauba kasuks,» lausus ta.	50
est	1	Palju, palju õnne!!!	7
est	1	Kehtib reegel: kord sumomaadleja, igavesti sumomaadleja. Sumo elustiili keskmeks on paljuski aupaklikkuse ning alandlikkuse väljendamine. Ka pärast sumokarjääri lõppu eeldatakse, et sumomaadleja jätkab tagasihoidlikku elu treeneri või sumoareenide valvuri/uksehoidjana ehk jätkaks oma edevusest vaba eluviisiga jaapanlike vooruste kehastamist. Baruto lõpetas oma intervjuu naeratusega – väljendades tagasihoidlikult lootust, et ta saab naasta oma armastatud kodumaale Eestisse ning elada lihtsat Eesti elu. Väga sumo!	71
est	1	Kenya valitsusallikate ja siseministeeriumi kinnitusel on kõik pantvangid vabastatud. Sõdurid kammivad suurt ostukeskust läbi ruum ruumi ja korrus korruse haaval.	22
est	1	Kaie Mikheim: põnevus ja ootusärevus on juba sees	9
est	1	Nelja Hõbepalli seas Vassiljevi sõnul tal lemmikut ei ole ning seejuures peab ta kõiki võidetud auhindu väga olulisteks. «Enam-vähem pean ikka arvet,» muigas Vassiljev viimaste aastate auhindade kohta. «Iga järgmine auhind on väga tähtis, kuna vanus ju paigal ei püsi ja selliste auhindade järel saad aru, et oled veel vormis ja võid inimestele rõõmu pakkuda.»	65
est	1	Eesti arengu jaoks on oluline, et ükski põlvkond ei kujuneks kadunud põlvkonnaks. Praegustel noortel on keeruline karjääriga kiiret algust teha, sest juhtivatel positsioonidel olevad 1990. aastatel tööturule sisenenud inimesed on veel küllalt noored, et ka järgnevad 20 aastat tüüri juures olla. Neil on küll kesisem akadeemiline haridus, kuid see-eest rikkalik praktiline kogemus. Tänapäeva noorte eelis on aga tugev akadeemiline vundament, mis annab pikaajalise eelise ning kui mitte kohe praegu, siis kümmekonna aastaga oleksid õige suhtumise korral neile kõik võimalused avatud.	90
est	1	1. klassi soovijatest valitakse välja need, kes on valmis kakskeelseks õppeks, suurematesse klassidesse tulijad teevad eri ainete teste. Õppetöö ongi sõna otseses mõttes kakskeelne. Igas klassis on nii eesti kui ka soome õpetaja, kord antakse ainet eesti, kord soome keeles, nii et sõnavara ja erialaterminoloogia omandataks maast madalast kahes keeles korraga. Suurematel, 7.–9. klassis on moodustatud juba soome ja eesti lastest segaklassid. Muudatus tehti seetõttu, et eestlased kaldusid pigem omaette hoidma ja ainult eesti keeles kõnelema, nii jäi soome keel tihti soiku.	96
est	1	Varem on Eestist Balti Tähe auhinnaga pärjatud Arvo Pärt (2007) ja Eri Klas (2012).	19
est	1	«Mulle meeldib laulu- ja tantsupidu rahvuslikkuse koha pealt väga, aga ma ei ole olnud ise nende ürituste aktiivne külastaja,» tunnistab ka bassimees Henno Kelp. «Ma mäletan, et kui mu vanem õde 1980. aastate keskpaigas laulupeol käis, tundus see olevat küll väga suur sündmus. Kuna elasime Võrus, oli tunne, et õde läheb nüüd kuhugi väga kaugele väga suurt asja tegema. Mul endal ei ole miskipärast olnud ka väga suurt soovi osaleda.»	84
est	1	Mängus Floraga haaras Levadia initsiatiivi juba kuuendal minutil, kui vabaks jäetud Igor Subbotini ilus kauglöök 25 meetrilt Marko Meeritsa väravas maandus. 63. minutil kasvatas Artur Rärtel Levadia kiire vasturünnaku lõpetuseks mõnelt meetrilt edu kaheväravaliseks.	37
est	1	Tribüünidelt väljapääsude poole tunglevad fännid arutasid elavalt, kas seekordne võit on kõvem saavutus kui 2001. aasta sügisel olümpiahõbeda Prantsusmaa alistamine või 1993. aasta EM-finaalturniiril hilisema võitja Saksamaa üle saadud võit. Otsus oli üsna üksmeelne – Euroopa korvpalli staaridega vürtsitatud Serbia alistamine on neist kõige vägevam saavutus! «Kindlasti kuulub see meie korvpalli suurvõitude hulka. Vastas olid ju mehed, keda saame iga päev telerist Euroliigas näha. Poiste üle on hea meel, et nad suutsid nii kõva partii panna.»	86
est	1	Pühapäeval pidas politsei kella 15.02 ajal Viljandis Põhja puiesteel kinni sõiduki Nissan Almera, mille roolis oli alkoholi piirmäära ületanud 79-aastane mees. Tema vanust ja tervislikku seisundit arvestades andis politsei ta aga esialgu lihtsalt omastele üle.	38
est	1	Õige OTSUS JA Tubli TÖÖ,!	7
est	1	Meil oli vaja emakeelset ülikooli, et noored võiksid õppida kodumaal ja omas keeles ning saada seeläbi parima võimaliku hariduse. See imepärane võimalus on meil olnud nüüd juba piisavalt kaua, et olla sellega harjunud.	37
est	1	Teine variant on jätkamine. Ilmselt ei ole see uus mõte, et Estonian Airi jätkusuutlikkuse tagamiseks on vajalik praeguse omaniku – riigi – rahaline toetus. Eelduseks on usaldus juhtkonna ja firma kui terviku vastu. Välistada ei saa juhtkonna vahetust. Uus juht ei pea olema lennunduse kogemustega, hea juht oskab vaadata kliendikeskselt, olles ise palju reisinud.	62
est	1	Järk-järgult juhib viisakas ülikonnas jutustaja (De Buysser) vaataja radadele, kus räägitakse nii ajalootraumadest, saatusest, sõprusest kui ka tänapäevase infoühiskonna pea peale keeratud tsensuurivormidest ning muidugi vajadusest vahel raamatuid põletada. Mõneti lausa arhetüüpse lihtsusega jutustatud muinaslugu saab endale aga Op de Beecki kirstus kiht-kihilt kooruvate kummaliste maailmadega võimsa lisadimensiooni.	55
est	1	Hea tervise tagab paraku ainult uriiniteraapia. Vaadake Savisaart- vanuse kohta krapsakas härra !	14
est	1	super	1
est	1	«Mulle meeldib laulu- ja tantsupidu rahvuslikkuse koha pealt väga, aga ma ei ole olnud ise nende ürituste aktiivne külastaja,» tunnistab ka bassimees Henno Kelp. «Ma mäletan, et kui mu vanem õde 1980. aastate keskpaigas laulupeol käis, tundus see olevat küll väga suur sündmus. Kuna elasime Võrus, oli tunne, et õde läheb nüüd kuhugi väga kaugele väga suurt asja tegema. Mul endal ei ole miskipärast olnud ka väga suurt soovi osaleda.»	84
est	1	Oleme selleks valitsuse otsusega planeerinud toetust Euroopa Liidu struktuurifondidest ning loodan, et pärast valimisi võimule tulev linnavalitsus on valmis keskuste rajamisele kaasa aitama.	25
est	1	Tuleks tegeleda eesti venelastega, et nad ei vaataks vene propakanda kanaleid.	13
est	1	Kaks etappi enne Tour de Ski lõppu hoiab norralanna Astrid Uhrenholdt Jacobsen naiste arvestuses esikohta ja temast võib saada läbi aegade esimene norralane, kes on suutnud Tour de Ski kokkuvõttes võita.	33
est	1	Kaks etappi enne Tour de Ski lõppu hoiab norralanna Astrid Uhrenholdt Jacobsen naiste arvestuses esikohta ja temast võib saada läbi aegade esimene norralane, kes on suutnud Tour de Ski kokkuvõttes võita.	33
est	1	"Olbri ei usu, et äkiline au ja kuulsus talle nüüd ootamatult pähe lööksid ja vanad kaaslased võõrastust tunneksid. ""Ükskõik kui laiatarbemuusikuks ma ka ei muutuks, ei tee ma ju popmuusikat, see on ikkagi nišivärk. Jätkan eksperimenteerimise ja ebatüüpiliste kõlade kasutamisega,"" lubab ta."	51
est	1	Üheks võimaluseks on sõeluuringute programmide rakendamine nii, nagu seda tehakse praegu näiteks naiste rinna- ja emakakaelavähi puhul, mis võimaldavad Euroopa ja Ameerika näitel suremust eesnäärmevähki vähendada kuni kolmandiku võrra. Samas tuleb uuringute puhul leida mõistlik kompromiss, et uuringutele kuluv rahastus oleks proportsionaalne avastatud keskmise ja kõrge riskiga vähijuhtumitega.	53
est	1	Nobeli preemia on sel aastal Frankfurdi raamatumessil kindel kõneaine kõigi nende kirjandusinimeste jaoks, kelle tegevus vähegi kuidagi PENiga seotud. Olgu siinkohal öeldud, et PEN (Poets, Essaysts, Novelists) on maailma suurim kirjanikke ühendav organisatsioon, millel on üle 140 keskuse enam kui sajas riigis.	51
est	1	Müncheni Bayern võitis koduväljakul peetud kohtumise 4:0.	8
est	1	Venemaa selgeltnägijate võitlus jõuab täna otsustava pöördeni, sest välja kuulutatakse sarja 14.hooaja finalistid. Saate lõpuminutid on seega ülipõnevad ning kirgi kütab otsus, mis on seotud Marilyn Kerroga.	31
est	1	Kolmapäeval avas Savisaar Harjumäel Edgari kohviku. Kuuma kohvi ja otse ahjust tulnud värskeid pirukaid pakkus linnapea ise.	19
est	1	Aga siis tulid välismaal esile mingid ansamblid, biitlid ja muud mehed, ja meie isetegevuslikud heliloojad ja lauljad said indu nende muusikast. Sõnavabadus oli nii palju lahtisemaks läinud, et ametlikule muusikasuunale tekkis vastukaal.	37
est	1	"Sparre, kes elab Tallinnas ja hakkas fotograafiaga tegelema alles hiljuti, võitis kontseptuaalse foto kategooria rabavalt sürreaalse fotoga „Päästeoperatsioon"", mis avaldas kohtunikele väga muljet."	29
est	1	Meie CENSis teeme oma iga-aastaseid aruandeid mitte selle jaoks, et keegi nõuab, vaid oma kolleegidele. Et info leviks, on tähtis eelkõige sisu: meie aruandes on uuringute, publikatsioonide, konverentsiettekannete jmt kokkuvõtted, kaitstud väitekirjad jne.	42
est	1	Tribüünidelt väljapääsude poole tunglevad fännid arutasid elavalt, kas seekordne võit on kõvem saavutus kui 2001. aasta sügisel olümpiahõbeda Prantsusmaa alistamine või 1993. aasta EM-finaalturniiril hilisema võitja Saksamaa üle saadud võit. Otsus oli üsna üksmeelne – Euroopa korvpalli staaridega vürtsitatud Serbia alistamine on neist kõige vägevam saavutus! «Kindlasti kuulub see meie korvpalli suurvõitude hulka. Vastas olid ju mehed, keda saame iga päev telerist Euroliigas näha. Poiste üle on hea meel, et nad suutsid nii kõva partii panna.»	86
est	1	Meil on siis umbes nii nagu Contral, et keda segab, see koristab. Ja kui üks juba üks pihta hakkab, siis on teisel kah imelik diivanilt pealt vaadata ja loomulikult lööb ka käed külge.	38
est	1	Siseministeeriumist kooskõlastusringile saadetud välismaalaste seadusse tehtud muudatusettepanekud seavad eesmärgiks paindlikuma rändepoliitika. Avatumaks muutuvad rändeliigid, mis aitavad kaasa ühiskonna ja majanduse arengule. Seeläbi on võimalik kasvatada heaolu ja luua lisatöökohti.	33
est	1	Sellega saavutati alagrupis teine koht ning jõuti kolme alagrupi parima teise koha meeskonnana poolfinaali, kus vastaseks omaealiste mitmekordne Leedu meister A.Sabonise Korvpallikeskus.	24
est	1	Monotüki teksti on kirjutanud Mart Normet ja Erik Moora. Nad elasid etendusele koos publikuga kaasa, ja nagu oli näost näha, jäid näitleja töö ja publiku vastuvõtuga igati rahule.	32
est	1	Võib abistada sobiva varjatud seadme leidmisel, oman pikaldasi kogemusi.	11
est	1	Eesti Rahva Muuseum on ainulaadne kogu maailmas oma soome-ugri rahvaste kogude poolest. Meil on võimalus võrrelda erinevate hõimurahvaste teadmisi ning oskusi, olla uurimis- ja õppimiskohaks nii meie kui ka teiste rahvaste üliõpilastele ja uurijatele.	37
est	1	Elroni kodulehe keelekasutus tekitab elevust	5
