lang	sentiment	text	num_tokens
fin	1	Mieheni on aivan ihana, rakastan häntä aivan liikaa voidaksemme erota.	12
fin	1	HYVÄÄ ITSENÄISYYSPÄIVÄÄ	2
fin	1	Itiksessä olen ollut asiakkaana 20 v ja ihan tyytyväinen.	10
fin	1	Voimia omaisille!	3
fin	1	Jos skaboissa on enemmän äijäenergiaa, ni voimalajejahan löytyy laidasta laitaan, vahvin mies-kisojen lajeja mukaeltuna (Taunuksenvetoa ym ;)	21
fin	1	:D sydän kun auki on, sinne jeesus tekee asunnon	11
fin	1	Hyvältä tuntuu kun toinen trolli kaipaa.	7
fin	1	Mun neuvo on se että kun pidät lääkityksen ja terapian hyvällä tolalla ja elämän rutiinit kunnossa niin varmasti selviydyt.	20
fin	1	Itse pidän hyvänä että kumppanissani riittää luonnetta kuin itsessänikin.	10
fin	1	Nyt ei kai muuta voi kun jäädä odottelemaan sitä törmäystä ;)	12
fin	1	Vai tuollainen, luomisen tuskan tulos ;D	8
fin	1	Tervetuola Hyvinkäälle :)	4
fin	1	Hyvin on pärjätty pakkasellakin:-)	7
fin	1	Moi!	2
fin	1	Olen ylpeä virheettömästä 607-pösöstäni ja aion myös pitää sen sellaisena.	11
fin	1	kaikilla oma makunsa..=) Ja kaikkien mielipiteitä ei kannata kuunnella...	13
fin	1	Kiitos!	2
fin	1	Näin edullista asumista harvoin kohtaa.	6
fin	1	kyllä,tekivät hyvän valinnan.Kumpikin mukavia ja persoonallia ja sopivat varmasti hommaan.Heikin tilalle löydetty oikeen sopiva uusi hahmo !!	20
fin	1	Mutta olen onnellinen suhteessani mistä en enää halua eroon mutta epävarma mutta rakastettu.	14
fin	1	:)	2
fin	1	Sauli on vahva ehdokas, monille ♥♫ ♥♫	8
fin	1	Olen eronnut vajaa vuosi sitten ja äskettäin tapasin miehen jonka kanssa voisi synkata oikeasti...minulla ei ole ollut mitään miesrintamalla, joten tämä tuttavuus on nyt ensimmäinen mies lapsen isän jälkeen joka on käynyt kahvilla jne..	38
fin	1	Mielenkiintoinen auto todella mielenkiintoinen.	5
fin	1	Eniten vastauksia on aiheista riemastuttaa ilahduttaa rönsyilyttää, sitten mitä tänään syödään:)	14
fin	1	Suloinen lapsi ja kaunis ajatus säveltäjällä!	7
fin	1	Tosi hienoa että on taas valoisaa pitkälle iltaan.	9
fin	1	Toivottavasti pääset Guinesin ennätysten kirjaan!	6
fin	1	tsemppiä sulle :)	4
fin	1	kiitos hyvistä nauruista, ja kaiketi osuit vielä naulankantaan...heheee!!!!;)	17
fin	1	Tervetuloa lämpimästi.	3
fin	1	Hyvä hunksz	2
fin	1	Tsemppiä!	2
fin	1	Tykkään laulaa esim. HIM-tyylistä melodista musaa.	7
fin	1	kyllä sinunkin päiviisi voi hyvää olla tulossa.	8
fin	1	Vielä sekin, että me muut saadaan voimaa,kuin toit esille tapauksesi,ei ole sinulta mikään mitätön uhraus.!Meidän kaikkien yhteiseksi hyväksi,tulevia,koetelemuksia varten,!Kiitos Arja.	36
fin	1	Siitä nautin kun on pahimmasta suoritusmyllystä jo VAPAA !!!	11
fin	1	Päivitänpä tilanteen: Sain ihanan soluhuoneen!	7
fin	1	Kehitys ja elintaso ovat kuitenkin menneet koko ajan eteenpäin.	10
fin	1	Mies taas on rauhallinen, itsevarma, älykäs, hauska ja kannustava ja vielä ulkoisestikin se pariskunnan näyttävämpi osapuoli.	20
fin	1	Älykkäät koirat oppii kyllä nopeasti.	6
fin	1	Olen onnellinen puolestasi.	4
fin	1	...että osaski olla mahtava meininki!!	8
fin	1	Voi Seppo raukkaa, mahtaa hänellä olla rankkaa :( no mutta eiköhän katariina kohta pelasta hänetkin :) jos Lari otti Kallen huoneen käyttöönsä niin Sepollehan jää vielä Eliaksen huone	31
fin	1	Kokoomusta ja Kataista ♥ ♥ :)	7
fin	1	Kiitoksia vinkeistä.	3
fin	1	asiallisia vastauksia miehet,kiitos;)	7
fin	1	Olen onnellinen.	3
fin	1	Onnea tulevaan!	3
fin	1	Tässä aivan sairaan hyvä peppupätkä: http://www.tubaholic.com/videoframe2.php?id=TXpZNU5qVTI=	11
fin	1	Putosin ristiltä... ;)	5
fin	1	mi voittaa kultaa!kultaa!suomi voittaa ksuomi voittaa kultaa!ultaa!suomi voittaa kultaa!suomi voittaa kultaa!suomi voittaa suosuomi voittaa kultaa!	28
fin	1	Sattuuhan sitä.	3
fin	1	Kyllä hän minusta pitää.	5
fin	1	Hei!	2
fin	1	Näytin kykyni ja nyt olen useamman vuoden ollut samalla työnantajalla ja nykyinen palkkani on todella hyvä.	17
fin	1	Omakotitalossa en ole asunutkaan sen jälkeen kun kotoa muutin. :)	12
fin	1	Mutta esim. Lämmin harmaanvihertävä tummanruskea sopii hyvin vihreille silmille.	11
fin	1	Kiitos vastauksestasi.	3
fin	1	Ensi kesänä sitten kokeilen työnhakua uudestaan, ehkä sitten onnistuu paremmin :)	13
fin	1	Tervehdys kaikille.	3
fin	1	Nyt on koe testit tehty ja aika positiivinen yllätys :)	11
fin	1	Itse voin YLPEÄSTI myöntää olevani ERITTÄIN, ERITTÄIN Onnellinen ollessani suhteessa ulkomaalaiseen mieheen, Intialaiseen mieheen.	17
fin	1	Ehkä leivon jopa sen taikinan:).	8
fin	1	Tätä herkkua suomenkin kouluihin	4
fin	1	Kannatan, hyvä idea.	5
fin	1	Huomentapäivää hänelle, kahvi juotu	5
fin	1	Niin ja pidin runostasi : )	6
fin	1	Count me in! :)	6
fin	1	Omani on pelannut vallan mainiosti jo 230tkm.	8
fin	1	💋💕💞💕	1
fin	1	Ja toivottavasti suhteenne kestää tämän yli, ihan lapsen parasta ajatellen.	12
fin	1	Kiitos mahdollisista vastauksistanne =)	5
fin	1	moensti tullu opeteltua, ja jotenki aina kun lopulta siihen tottuu ja elämä on ihanaa yksinkin niin johan huomaa että taas on sutinaa ilmassa.	25
fin	1	Pelkäsin aluksi ja hän näytti paljon kuvia aiemmista töistään ja oli paljon tosi hyvin onnistuneita muitakin potilaita..	18
fin	1	Minä myös Kiitän vastauksestasi,joka oli yllättävän pitkä ja pidän aina sellaisista.	14
fin	1	Niin ihan sairaanhoitajana työskentelen ja tietääkseni kirjoitan ihan hyvää tekstiä.	11
fin	1	Onneksi olkoon...Ja kiitos kaikille äänestäjille .	8
fin	1	Quenyax-kappaleitakin olis kiva kuunnella.	5
fin	1	Kiitos!	2
fin	1	Soppeenharjun päiväkoti on aivan ihana paikka.	7
fin	1	Voi sua reppanaa &lt;3	7
fin	1	kiitos paljon kaikille vastauksista.	5
fin	1	:DDD	2
fin	1	On niin katseenkääntävän kaunis, että varmasti muutama muukin on aivan ihastunut tähän tyttöön ;)	16
fin	1	iso ja pieni :)	5
fin	1	Ihanne autoni on musta Camaro -70 ja ratissa sellainen hymyilevä nallekarhu.	12
fin	1	Tänä päivänä vain nuo lapset taidetaan hankkia vanhempana kuin ennen...:)	13
fin	1	Vanha keskustelu joo, mut päätin vastata.😂	7
fin	1	Kunhan vain olet oma itsesi ja saat jakaa mielipiteesi ilman pelkoa,niin hyvä:)	16
fin	1	Etukäteen kiitos neuvoista!	4
fin	1	Itse olen päätynyt tähän vaihtoehtoon, ja tällä hetkellä omistan 4 säröefektiä, choruksen ja wah wahin ja pärjään ihan hyvin.	22
fin	1	Maiskis, sivelen TYRNI hyytelöllä ja kielellä puhdistan Se makujen singgolffonia	11
fin	1	Pitää levätä riittävästi ;)	5
fin	1	Vaikka elinkustannukset ovat täällä suurempaa luokkaa, pärjään silti ihan hyvin.	12
fin	1	Hyvät yöt vaan kaikille!	5
fin	1	Hyvin joudat meidän puolesta:-)	7
fin	1	MÄ RAKASTAN TEITÄ MIEHET KAIKKIA!!!!(*_*)❤	15
fin	1	Et ole mielestäni kohtuuton, uskon siihen että jokaisella on oikeus olla onnellinen parisuhteessaan, niin fraasilta kuin se kuulostaakin, sinä et ole onnellinen vaan äärimmäisen turhautunut tilanteeseen ja katkera.	32
fin	1	Tuulipussit ovat liikenneympyröiden taideteoksista parhaimman näköiset ja iloisin ilmeeltään mielestäni.	11
fin	1	Kiitos ammattimiehille jo etukäteen.	5
fin	1	"Sinun selostuksesi oli ihan riittävä, mutta noissa vanhoissa laeissa on aina ""sitä jotain"" ja siksi se piti nähdä :)"	23
fin	1	Valitettavaa mun kannalta! :)	6
fin	1	Nyt odottelen uuden aallon new-age heavyorkkaa joka rokkaa moskeijanpolttoheviä :D:D	13
fin	1	Lyhyesti: Kiitos=)	4
fin	1	Maksoin muuten omastani sielä 50£ (=75€), olinko vähän tyytyväinen ku huomasin että se maksaa täälä 130€.. :D	22
fin	1	Kiitos itsellesi hyvästä kirjoituksesta! :)	7
fin	1	Kiitos Sinulle vastauksesta.	4
fin	1	Toivon, että löydät monella tavalla raitista seuraa, vaikka hyvä on yksinkin olla.	15
fin	1	Siksi lapset ovatkin niin ihania!	6
fin	1	Kiitos.	2
fin	1	koneen suljettuani samlla unohdan kaikki höpinät, hauskatki paltalla, joten mikää ei rasita mun mieltäni sen pitempään,,,	21
fin	1	Olen kanssasi aivan samaa mieltä; kriittisyys on tärkeätä.	10
fin	1	"Nainen nuori neitonen, mies vajaa 40v. ravintolapäällikkö, ""hyvin säilynyt"" ja upea kroppainen."	18
fin	1	Blondit hiukset ja suuret rinnat toimii aina!	8
fin	1	Nyt tuli europarlamentarikolta asiaa!!	6
fin	1	Ihanaa Hanu!	3
fin	1	Kiitos - Sinulle myös kaikkea Hyvää risujen asemesta.	9
fin	1	Lämpöä piisaa riittävästi, käynnistyy erittäin hyvin ym.	9
fin	1	Tästä on hyvä jatkaa...	5
fin	1	Puhtaudesta kyllä huolehdin!	4
fin	1	Tauon aikana (asumuserossa,mutta tapailtiin) tosiaan huomasi kuinka toista voi rakastaa ja on se oikea, mekin ihan teinistä asti ollaan oltu kimpassa.	27
fin	1	Rakkaus on pitkämielinen, rakkaus on lempeä...!	9
fin	1	XD	1
fin	1	Kieltämättä komea koira silti se on..:)	9
fin	1	Mä olen koko ajan odotellut, että joku tulis ylistämään mun seksikkyyttä.	13
fin	1	Onnea :)	3
fin	1	puhumisessa ei ole ongelmia =).	7
fin	1	Joten jos sellainenkin löytyy olisis ihan kiva.	8
fin	1	Tämän kohdan olet Jeesuksen opetuksesta sisäistänyt oikein, hyvä!	10
fin	1	21 Minä kiitän sinua siitä, että kuulit minua ja pelastit minut.	13
fin	1	Me on asuttu Torniossa 3 vuotta ja minusta on kyllä kiva paikka.	13
fin	1	Siitä huolimatta naimme salassa, jotta hyvä tunnelma ei väljähtyisi ;-)	13
fin	1	Mutta pääasia on, että ei ota turhaa stressiä!	10
fin	1	Hienosti on koulutettu, palkittu ja ympäristöäkin suojeltu, lisäki asiakastyytyväisyys sen kuin nousee:-)	17
fin	1	Ois kiva kouluttaja vapaana,miespuolinen.	7
fin	1	Kyseessä voi olla loppuelämäsi nainen.	6
fin	1	Kokenut mies ymmärtää kyllä jos et osaa ja opettaa varmasti mielellään.	12
fin	1	Kiitos edes siitä.	4
fin	1	Omat koirat ovat aina olleet uskollisia meille molemmille, koirille tutut saavat tulla ja mennä, eikä heihin reagoida kuin häntää heiluttamalla ja syliin pyrkimällä.	26
fin	1	Minulle se sopii.	4
fin	1	Työn iloa!	3
fin	1	Kaikin puolin siisti ja hieno hotelli.	7
fin	1	Ei huono, ei huono.	6
fin	1	Onnea Sinulle elämässäsi ja rohkeutta elää niin kuin haluat.	10
fin	1	Joka kerta kun yrität ymmärtää, koska todella välität, sydämeni saa siivet.	14
fin	1	Kiitos tommosia peppu kokoelmia kun olisi enemmänkin, laitoin sivun muistiin.	12
fin	1	AWA ON IHANA!AWA ON IHANA!	8
fin	1	Mielestäni ihmisen elämä on aivan liian lyhyt töihin tuhlattavaksi, on osattava nauttia hieman pienemmistä asioista ja elää vähän vaatimattomasti niin näillä työkkärin rahoillakin kyllä loistavasti pärjää .)	29
fin	1	Se antaa pientä potkua ja energiaa, ja riuhtaisee pois itsesäälistä.	12
fin	1	Olo on aika ihana!	5
fin	1	Ainakin jos sen puheisiin voi luottaa ;)	8
fin	1	Kyllä jotain hyvääkin Ouluun liittymisestä jo nyt seurannut.	9
fin	1	nappasit:)) hyvin vedetty ja onnea vielä kerran.	11
fin	1	On ja samaan klassiin kuuluu noi Muslimit ihan samalla lailla :))	13
fin	1	itseasiassa yksi parhaista ideoista 5 vuoteen mitä nyt taksia oon väännelly.	12
fin	1	Ei noin tärkeä asia kuin virallisten nettisivujen ylläpito saa olla ns. lapspuolen asemassa ;)	15
fin	1	"Kyösti kiittää ""Näin on näreitä"" ajatuksia herättäneestä kommentista, kjäh kjäh."	14
fin	1	Kahvinjuonti on terveellistä puuhaa	4
fin	1	Mutta se ei ollut turhaa koska kotona oli nähtävästi juteltu ja pojista tuli tämän jälkeen kavereita ja käytiin jopa toisten synttäreillä vielä koulussakin.	24
fin	1	Kiitos!	2
fin	1	Iloa elämään.	3
fin	1	Moneskohan kerta tääkin taas oli Hahhahh!	7
fin	1	Ja ulkoilu raittissa ilmassa auttaa kans pitämään mielen vireämpänä.	10
fin	1	Hyvää Erkin päivää	3
fin	1	tosi pätevä pulju,tekee hommat hätäilemättä eikä velota liikoja.joskus korjuutin autoa ja päivän homman teki pilkkahintaan..	18
fin	1	Ennemminkin koiraani ihasteltin sen kuulemma poikkeuksellisen itsevarman ja lempeän käytöksen vuoksi ja ihasteltiin sen tottelevuutta.	16
fin	1	Toivon, että kaikki järjestyy vielä parhain päin.	9
fin	1	sä oot iso poika, juu:) Tuli kaikenlaista jne.	12
fin	1	Kiitos.	2
fin	1	"Juuri tällaista ""selostusta"" taisin kaivatakin."	8
fin	1	Kiitos jo etukäteen.. =D	5
fin	1	Onnea muillekin tarvitseville!	4
fin	1	tosi kiva!!	4
fin	1	Kiitos SataSeutu-lehdelle 141-keskustelun herättämisestä!	5
fin	1	Se vieras äly ei vierailisikaan ihmiskunnan tunteman fysiikan lakien mukaan. :)	13
fin	1	Kiinnostaa tietää ulottuuko tuo kallius elintarvikkeisiin vai vain kahvila- ja ravintola yms hintoihin. :)	16
fin	1	Soittele kun Turkuun päin tulet ja kivaa keväthuuman odottelua Manseenkin.	11
fin	1	Kiitos vaivannäöstä.	3
fin	1	Olihan nostalgista slowfox'ia Pillipiipareilla :D))), äänitys sen aikainen, mutta ksylofoni (ilmeisesti) ---soi ihanan kirkkaana!	24
fin	1	toivon pikaisia vastauksia.... :)	6
fin	1	Mutta rakkaus vie voiton	4
fin	1	huominen on parempi päivä, meille molemmille.	8
fin	1	:DDD	2
fin	1	Tärkeintä on se, että voit avata pääsi sisällä olevia ajatuksia jollekulle, koska se _ihan oikeasti_ helpottaa.	19
fin	1	RÖHÖNAURUA...	2
fin	1	Kannattaa kokeilla! :)	5
fin	1	Siihen aikaan kun itse kävin Kojon koulua kaikki oli hyvin.Miten kiva oli aamuisin lähteä kouluun vaikka joutuikin kävelemään kolmisen kilometriä säällä kuin säällä,joskus päästiin naapurinisännän hevosen jalaksilla jonkun matkaa mutta yleensä kävellen ja talvella suksilla jos omisti sellaiset.Kyllähän se pahalta tuntuu että Kojon koulu lopetettaisiin siihen liittyy parhaat muistot lapsuudestani.	53
fin	1	Ja tietysti saman tien =) Tulihan tuota itsekkin aikanaan käytyä alaikäisenä, silloin ei vaan seurauksia tiennyt.	19
fin	1	Tomppa, siinä tavallaan miehen ihanuus onkin, lapsi ja aikuinen samaan aikaan:)	15
fin	1	Hyvää matkan odotusta.	4
fin	1	Hyvää lomaa!	3
fin	1	Kyllä on mahtavia kirjailuja nuo!	6
fin	1	Tavalliset tunisialaiset ovat huipputyyppejä, elämänmyönteisiä ja erittäin vieraanvaraisia.	10
fin	1	Ilonan ohjelman aiheet ovat kiinnostavia.	6
fin	1	kiitos	1
fin	1	En osaa sulle muuta sanoa kuin että tsemppiä!	9
fin	1	Taisinpa jopa saada, vaikka tuumin ettei varmasti ole oikein...jospa toi sitten olisikin!	16
fin	1	Nami nami!	3
fin	1	Tervehdys!	2
fin	1	Puhu hänelle on hyvä elokuva.	6
fin	1	Kyllä yleensä tärppää ja uusintahan on joka tapauksessa ilimaanen, heh..	12
fin	1	saat lisää ystäviä.	4
fin	1	Toivottavasti kaikki tarkoitetaan eri henkilöä:).	8
fin	1	Käy kerran koirtanäyttelyssä katsomassa, kuinka tottelevaisia ja rentoja koirat siellä ovat.	13
fin	1	Toivottavasti mahdollisimman moni metsänomistaja lukee sen läpi!	8
fin	1	Mutta kiitoksia vinkeistä.	4
fin	1	Jos sulla ei apina ole muuta sanottavaa niin olisko kannattanu jättää sanomatta :D	14
fin	1	Tsemppiä sinulle!	3
fin	1	Olen kokeillut recover4all-ohjelmaa ja onnistuin sillä saamaan muutaman tiedoston takasin.	11
fin	1	Aina on toivoa :)	5
fin	1	Kauniisti ajateltu ja sanon tämä vaikka nainen itsekin olen.	10
fin	1	Aloitus on siitä hyvä että alkaa tekeen asioille jotain.	10
fin	1	Toimi muuten moitteettomasti muiden kans metällä ja minun kans ilman hihnaa metässä lenkillä!!	15
fin	1	Toivottavasti etsijä löytää etsimänsä ;)	6
fin	1	Olemme nyt deittailleet yhden mukavan miehen kanssa n.kuukauden yhteisiä öitä, seksiä, henkeviä keskusteluja.	16
fin	1	- Liikuntaa - Aurinkoa - Lavatanssit - Elämästä nauttimista	9
fin	1	niinpä niin, jos olis ollu, mutta ei ollu ;)	12
fin	1	David Pawsonin erinomainen opetus siitä, että kristitty ei ole laiton eikä lain alla, vaan Kristuksessa.	18
fin	1	Ei mikään hetken mielijohde vaan oikeaa arvokasta ja pitkäjäntestä työtä!	11
fin	1	miä ostin just sun kuvauksee sopivat jimmnjillist noin vuos sitte:) ehkä niil viel on niit	17
fin	1	Mopon vuokraus n. 150 batia per päivä, siellä on erittäin turvallista ajaa, tie on suora ja leveä, mopoilijoille on varattu omat reunat tiestä.	28
fin	1	Jos eivät, niin mitä sitten, saitpa hyvät naurut.	11
fin	1	Oon aivan samaa mieltä, ku eräs toinenkin, et on se kumma et sillon ku Suomi voittaa esim. Venäjän niin sillon kaikki on niin faneja ja kaikki sanoo;Hyvä Suomi!	33
fin	1	olisi kiva tietää missä nykyään asuu ja mitä kuuluu	9
fin	1	Kiitos..	2
fin	1	Mitään ongelmia ei ole ollut koskaan.	7
fin	1	En vaadi Kepun päätä vadille, päin vastoin, esitän yhtä tapaa nostaa sitä kannatusta kaupunkilaisten keskuudessa.	18
fin	1	kutsun sinut yhteiselle syntymäpäiwillemme tyttäreni kanssa :=) tawaraa on jo jos jonkinlaista?	15
fin	1	Olisi kiva kuulla mikä tälläistä voi aiheuttaa!	8
fin	1	Se on ihanaa!	4
fin	1	Mutta jos lämmin päivä sattuu niin mekko on varmaan mukavampi päällä.	12
fin	1	Hyvä, jos tunnet onnistuneesi uskossasi, mikäpä minä olen siihen mitään sanomaan.	14
fin	1	Olet aito, tunteva ihminen.	6
fin	1	Sekin on mulle plussaa ettei tarvi muistaa joka päivä, kunhan välillä tarkistaa että on laastari on paikoillaan.	19
fin	1	Ei japanilaisten tekemä ;)	5
fin	1	No toivotaan, että pääset jaloillesi ja kaikki sunkin kohdalla kuntoon tulee.	13
fin	1	Hei!	2
fin	1	Onnea teille.	3
fin	1	Hauskaa :)	3
fin	1	Terveisin	1
fin	1	”Mielenkiintoinen” on mahtava sana.	7
fin	1	On niin hyvä tarina että lainaan, kiitos !	9
fin	1	Kyllä...Ymmi ja Jäbä hyviä.....Krista hyvä näytteleen.	11
fin	1	keskustasta ja hyvin pelittää,oikeesti.	7
fin	1	Kiitos!	2
fin	1	Suosittelen!	2
fin	1	Tuohon dokumenttiin saa valittua myös suomenkielisen tekstityksen, mikäli jollekulle ei englanti aukea. :)	16
fin	1	Nightwishin miesväki on aina soittanut takuuvarmasti hyvin, siihen voi luottaa.	12
fin	1	Tuota en kirjoittanut peloitellakseni sua, vaan niin kuin rakasta ystävääni opastaen.	13
fin	1	Kiitos linkistä.	3
fin	1	Kaunis kiitos sanoistasi	3
fin	1	Ystävällisin terveisin,	3
fin	1	Kiitos!	2
fin	1	Terkuin Jossu	2
fin	1	Kiitos vihjeestä.	3
fin	1	Nälkäpeli, aivan mahtava sarja!	6
fin	1	Onnea vaan sulle jos oot löytänyt jonkun jonka kanssa haluat jakaa elämäsi.	13
fin	1	Miniällesi voi olla tärkeää nähdä äitiään mikä edistää hänen suhdettaan lapsen lapseenne ja eiköhän se rakkaus äidin ja lapsen välillä ole kuitenkin paras rokote kaikkea pahaa vastaan.	28
fin	1	:)	2
fin	1	hyvää yötä.. :)	5
fin	1	Jee!	2
fin	1	On kai parempi seurata KH:ta kuin vain GH:ta.	13
fin	1	💋	1
fin	1	Moikka !!!!	5
fin	1	Tässä hieno ja terve koira jolle haetaan huskynarttua	8
fin	1	Lapset mukaan!	3
fin	1	Haluaisin myös, että sinulla olisi kaikki hyvin.	9
fin	1	tää ei liity nyt kyl samsungii mut osaaks kukaan sanoa onko sony xperia m2 hyvä? :D	18
fin	1	Kiitos, peres kauniista sanoistasi..[kats.otsikkoa] ja mukvaa 19 pv. sinne ! :)	18
fin	1	Tsemppiä ja onnea työnhakuun!	5
fin	1	(Vivaldi on muuten minunkin suosikkejani!)	8
fin	1	Ns. parempi henkilöauto ajoi paikalle, autosta nousi vaalea, pitkähiuksinen, huolitellun oloinen kaunis nainen, Seija.	19
fin	1	"Olen alkanut tuntea suurta rakkautta sinua kohtaan, koska kaikesta huolimatta uskon vilpittömyyteesi ja siihen, että haluat ihmisten ""pelastuvan""."	23
fin	1	Rakkaudella!!	3
fin	1	Askohan toimii kuten sivistyneen herrahenkilön on toimittava.	8
fin	1	(:	2
fin	1	LOL!!	3
fin	1	Tanssimisesta kyllä tykkään.	4
fin	1	Vatsa näytti jopa pienemmältä aamulla :].	8
fin	1	Hyvää yötä vaalealle s-naiselle	4
fin	1	Ollos iloinen ja onnellinen loppuiltasi...:o)	9
fin	1	Onni!	2
fin	1	Nainen itsekin, mutta onnellinen.	6
fin	1	IP-numeron voi vaikka vaihtaa, jos se helpottaa syntisen hermoja ja elämää:) anna komento ipconfig command promptissa; se antaa nykyiset tiedot.	25
fin	1	Vatsalaukku täytyy ensin vuorata vähintään yhdellä Eurokossulla,jos tollaisia mehuja meinaa juoda :-)))	18
fin	1	Juuri tätä minä tarkoitan: kyllä muutkin osaavat rottia kasvattaa, kuin kasvattajat! :)	16
fin	1	Ajattelin, jos joku ystävällisesti kertoisi muuaman faktan, nii sanoisin eteenpäin kannattaako niin toimia..	16
fin	1	Kyllä mä ymmärrän sua, kuitenkin.	7
fin	1	Oikein hyvä	2
fin	1	Eli hän tietää kyllä että kosintaa kovasti odotan!	9
fin	1	Hih!	2
fin	1	Port Aventuraan kannattaa ehdottomasti mennä ja mielummin kahdeksi päiväksi että kerkeää kunnolla hurvittelemaan.	14
fin	1	Hyvin puhui suomea!	4
fin	1	ja vakoilen niin vallan mahdottomasti voi näitä oletuksia hyvää iltaa sullekki ;D	13
fin	1	Onnea ja menestystä - toivon myös että tämä kestää ikuisuuden ** . :)	15
fin	1	Ihan mukavaa on olut todeta yhdessä iehen kanssa, että meillä ei ihan toiveet käy yksiin, mutta voidaan kirjoittaa toisillemme ystävinä vielä jälkeenkin päin kuinka elämässä on käynyt.	30
fin	1	Kun juttuja kuitenkin tälläkin palstalla joskus on...)	9
fin	1	Jos itsellä olisi lomaa näin loppukesästä tai syksystä, niin luultavasti se olisi juurikin Portugal johon haluaisin lähteä!!!	21
fin	1	Laiskuudesta johtuu, että kynttilät säästyvät;)	8
fin	1	Positiivisuus ja iloisuus on kaunista ja luo hyvää oloa muillekin lähiympäristöön.	12
fin	1	Toivon roppakaupalla onnea ja rakkautta elämäsi varrelle, ansaitset sen!	11
fin	1	Eihän niin mukavaa ihmistä olekaan kuin manselainen!	8
fin	1	No joo meni sekavaksi..yritän vain sanoa yritetään olla inhimillisiä toisia kohtaan, edes oppia!	17
fin	1	Huuhaa on myös mukava palsta, siellä käyn naureskelemassa hassuille jutuille.	12
fin	1	Kerron arkeni pienistä iloista, kynsien lisäksi myös fitnessharrastuksesta, ruuasta ja muusta :)	15
fin	1	Ei haittaa vaikka soittaa väärin, kun soittaa itselleen, vaikka vaan yhtä säveltä tunnin... suosittelen.	18
fin	1	Studio 55 .n aiheena oli kiinnostava laivaristeily.	8
fin	1	itse olen saanut niin apua kuin hyvät naurutkin monesti hulluille kirjoituksille.	12
fin	1	Toki tykkään myös klassikoista, kuten Psyko, Hohto, Stand by me, 8mm... mutta ylläolevat leffat edustavat parhaimpaa aatelia...	23
fin	1	Onnea teille kaksosten kanssa!	5
fin	1	Katoppas hyvä duunari on hyvä duunari.	7
fin	1	Suosittelen.	2
fin	1	Tsemppiä vaan, kyllä se sujuu...	7
fin	1	Aina voin kuitenkin sinua lämmöllä muistella.	7
fin	1	Thänks!	2
fin	1	Parhaassa tapauksessa keskustelusta voi tulla mielenkiintoinen.	7
fin	1	Kyllä siihen varmaan ihan järkevä selitys löytyy :)	9
fin	1	Hän ON rakkaus.	4
fin	1	olis kiva kokeilla olla naisen alistuksessa olen 18v kundi	9
fin	1	Kiitoksia vastauksista!	3
fin	1	Toivottavasti löydätte keskusteluyhteyden ja mies tulisi järkiinsä:)	9
fin	1	Minä tarjoan ja reilusti.	5
fin	1	Miljoona kiitosta ja kukatkin lähettäisin kun tietäisi minne.	9
fin	1	Kiitos paljon =)	4
fin	1	"noiden kanssa pelehtiä, olisipa ihanaa nähdä kun tuollainen ""nainen"" työntyy mun pyllyyn!"	16
fin	1	Se on pitkä jouluateria ja samalla ihana hetki kaiken kivan merkeissä.	12
fin	1	Elämästä tulisi kuitenkin täydempää.	5
fin	1	"Toivon ""hipidihip"":lle menestystä ja antoisaa tulevaisuutta."	11
fin	1	:)	2
fin	1	Mitä tulee suuseksiin, en tiedä mitään niin paljon omaa halua kiihottavaa, kuin naisen elimen tuoksu ja maku, saada nuolla naiselle nautinnon huippu, nähdä hänen reaktionsa antaessani orgasmin.	32
fin	1	Kiitos vastauksestasi, minkälainen auto on kyseessä?	8
fin	1	Ihan joku linkki url riittää kiitos.	7
fin	1	Olen odotellut sinulta jotain viestiä, kuinka voit ja jos ei ole liikaa vaivaa, laita minulle tänne viestiä jaksamisestasijos sopii:))	24
fin	1	"Kunnes sitten kuin salama kirkkaalta taivaalta löytyikin ""se oma oikea""!"	13
fin	1	Selkeästi hevimies, ja melko pantava sellainen ;)	9
fin	1	Vettä tulee hanasta ja sokeria sekä hiivaa lienee varastossa, näiden ollessa lisäksi säilyvää tavaraa, joten Pentti-pojan kannattaa ostaa aina tarjouksista paljon kerralla. ; )	27
fin	1	Hoitajat osasivat hienosti suhteuttaa asioita niin ettei kaikki tuntunut katastrofilta. :)	13
fin	1	Kyllä te tulette sinne omaankin yhdistykseenne saamaan ihmisiä riittävästi, ei sitä tarvitse tehdä toisten mollaamisen kustannuksella :D	19
fin	1	ole vielä kovin vanha ja varmasti jossain vaiheessa löydät mukavan tytön.	12
fin	1	Hyvää talven jatkoa kaikille!!	6
fin	1	"suosittelen kääntymään hammaslääkärin puoleen tai purenta fysiologin.ilmeisesti sinulla on leukanivelen välilevyn pullistuma tai jokin muu vastaava mut hoidoksi yleensä on oireiden lievityksee purentakisko joka on akryylista tehty ""kisko""vähän niinkuin hammassuojat jotka on tehty juurin omiin hampaisiin sopiviksi hammasteknikolla."	42
fin	1	Olen kokenut aikuisista koirista mutta pentukoiraa en ole ikinä vielä omistanu, nyt ois pentu tulossa ensikuussa taloon :).	21
fin	1	Se on valmista ja hyvää ja menee helposti alas.	10
fin	1	Niin että kiitoksia vaan kaikille..pääsin avullanne eteenpäin!	10
fin	1	escapestarling@gmail.com kiitos :)	6
fin	1	Hei hei, hyvää matkaa!	6
fin	1	"Muutenkin suosittelen kaikille asiasta kiinnostuneille tuota Mark ""Gravy"" Robertsin mainiota paperia."	14
fin	1	Kirjoititpa itsekin hyvin.	4
fin	1	ja kumarrus!	3
fin	1	"Se hyvä puoli ""avarassa tavarassa""' on, että voi yleensä paukuttaa menemään rankemmin kuin tiukan naisen kanssa."	21
fin	1	Espoonlahti - ok, lähinnä kerrostaloaluetta keskellä, muuten paljon rivitaloja yms. reunamilla.	15
fin	1	Jarrut pelaa muuten hyvin.	5
fin	1	Kiitos jo etukäteen!	4
fin	1	serpico ja hikinen iltapäivä ovat todellakin nautittavaa katseltavaa.	9
fin	1	Kaikki sujui oikein hyvin.	5
fin	1	En myöskään tiedä, mitä uskoa lienee harjoittanut mies, joka on kotitaloni joskus kauan sitten rakentanut, mutta koti on nyt siunattu ja hyvä.	26
fin	1	Oikein hyvää yötä ja mukavaa huomista päivää!	8
fin	1	Halleluja, totisesti, kiitos väkevästä todistuksestasi!	8
fin	1	Pyydä ny jo taivaan tähden tota Emmaa deiteille.	9
fin	1	Kaikki mahdolliset havainnot on tervetulleita.	6
fin	1	Alussa joku vuokralainen häiritsi mutta mennyt parempaan suuntaa koko ajan ainakin meidän talossa.	14
fin	1	Kun näkee elämää muualta, usein kotiin palattua tuntuu, että ompa ihanaa olla omassa kodissa.	17
fin	1	Kiitos vastauksestasi!	3
fin	1	Kiitos.	2
