lang	sentiment	text	num_tokens
est	-1	Protestid jõudsid haripunkti teisipäeval, kui möödus 81 aastat päevast, kui Jaapani sõdurid korraldasid Mandžuuria raudteel plahvatuse, et leida ettekääne Hiina kirdeosa okupeerimiseks. Nõndanimetatud 1931. aasta Mukdeni intsidenti mälestatakse Hiinas igal aastal.	36
est	1	"Lauri Lagle võitis parima näitleja preemia Vilniuse rahvusvahelise filmifestivali Baltic Gaze võistlusprogrammis osatäitmise eest Veiko Õunpuu filmis ""Free Range/ Ballaad maailma heakskiitmisest"". "	25
est	1	Super pilt. See käsi mis kiigutab hälli- päästab maailma :)	12
est	1	Soomes ütles selle ajalehe Turun Sanomat seminaril septembris 1988 kõva häälega välja algaja poliitik, Rahva Hääle peatoimetaja asetäitja Siim Kallas.	22
est	1	Elroni müügi- ja arendusjuht Norbert Kaareste kinnitas, et Elron on probleemist teadlik. «Oleme esmaspäeval lõpetamas oma kodulehe tekstide toimetamist ning oleme abina kasutamas ka keeletoimetajaid,» ütles ta.	33
est	1	Argo Ideon: Läti on tubli	6
est	1	Venemaal sündinud ja senise karjääri jooksul rohkelt klubisid vahetanud Adediran on meeskonna mänedžeri Antti Vasara sõnul füüsiliselt tugev mees, keda saab kasutada ka tsentrina. Lisaks korvialusele mängule olevat tal ka hea keskpositsioonivise. Pärast USAs veedetud aastaid on ta viimastel hooaegadel pallinud Venemaa tugevuselt teises liigas ja vähemalt statistika järgi teinud seda hästi.	56
est	1	Siis pani keegi uuesti kärbse pähe, et proovi lavakasse. Õnnestus. Kaks aastat pidasin seal vastu.	19
est	1	Endine piloot Jean Alesi, kes praegu töötab Pirelli hüvanguks, lisas, et parim võidab niikuinii: «Vormelisõidu filosoofia on alati ette näinud kompromissi kiiruse ja rehvi kulumise vahel. Olen karjääri jooksul kihutanud kõikvõimalike rehvidega ning alati tuli nende iseärasusi tundma õppida. Pirellil paluti muuta F1 sari põnevamaks ning seda ka tehti. Põnevus ja tasavägisus on just see, mida kuninglik vormelisari vajab.»	70
est	1	"""Elavaid pilte"" on pärast rahvusvahelist esilinastust A-klassi festivalil Shanghais näidatud festivalidel Leedus, Venemaal, Gruusias, Soomes, Kanadas ja Indias. "	25
est	1	Juba homme avatakse Rakvere keskväljakul Belgiast pärit trupi t.r.a.n.s.i.t.s.c.a.p.e performance’iga Baltoscandal. Tähelepanuväärsemaid lavastusi tutvustavad Tartu Ülikooli Teatriteaduse Üliõpilaste Looži liikmed.	24
est	1	Õige. Maksustamine peaks arvestama auto väärtust.	8
est	1	Tänutäheks osutatud abi eest maksiski Ostapjuk Viksile kahes osas kaitsepolitseist saadud 2000 eurot.	14
est	1	Aivar Sõerd: uus Randvere kool on väga hea!	10
est	1	Vana Tallinn päästab hädast	4
est	1	Keskerakonna peasekretär Priit Toobali hinnangul on 3200 uue liikme lisandumine viimase viie aasta jooksul väga korralik number ning sama palju võiks erakonnaga liitujaid olla ka järgmise viie aasta jooksul, et tagada Eesti suurima erakonna positsioon.	37
est	1	Sind, rahutuvi kistakse sõtta Sinu soovunelmatest hoolimata samamoodi nagu teisi. Sinusuguseid hullukesi on kogu aeg olemas olnud aga on olnud ka sõjad. Targad inimesed arvestavad sellega. Helme ajas mõistlikku juttu nagu mõistlikule mehele kohane.	39
est	1	Ma ei pea sugugi silmas ettevõtetena toimivate praksiste muutmist munitsipaalasutusteks, sarnaselt Eesti Perearstide Seltsiga toetab ka sotsiaalministeerium keskuste loomist praksiste senist toimimismudelit lõhkumata.	25
est	1	Alates hooajast 2006/2007 osaleb Valga võistkond Eesti korvpalli meistriliigas. Esimesel osalemisaastal saavutati kümne võistkonna seas 8. koht, järgmisel aastal oldi juba kuuendad ning 2008/2009 hooajal saavutati 4. koht. Kahel järgneval aastal saavutati 5. koht. Seega on Valga juba tõestanud seda, et ei ole lühiajaline projekt, et ka Lõuna-Eestis on võimalik meistriliiga tasemel korvpalli mängida.	61
est	1	Muidugi on Raadi suurepärane ala ka festivalide ja konverentside, samuti vabaõhuetenduste korraldamiseks. Heaks alustuseks oli tänavusuvine Uue Teatri spetsiaalselt Raadile loodud «Opus Geographicum ehk naised valitsevad maailma», mis esietendus 8. augustil.	37
est	1	«Usun, et Moskvas tuleb võitmiseks heita 68 ja 69 meetri vahele – sinna, kuhu viimasel ajal on tiitlivõistlustel heidetud,» arutles ta. «Mullu suutsin ka enda suurvõistluse tulemuse viia tagasi üle 68 meetri, loodan tänavu olla samal tasemel. Usun, et Hartingul on viimaste aastatega võidunälg kustutatud, ja ma ei näe ühtegi põhjust, miks ma ei suudaks teda edestada.»	71
est	1	Alustan vajatuna tundmise õppetundi rohujuure tasandilt, proovin tunnustada iseend. Mind. Mina vajan mind. (Kas mitte kummalist paralleelresonantsi üle ajajõe ei kosta Mikk Mikiveri kehastatud tegelaskuju Hincuse sõnadest ühes lumevangis mägihotellis? «Mind nähti koridoris. Ja ka mina nägin mind. Ja mina sidusin mind kinni. Mina, mind... Saite aru? Mina. Mind.») Seon end lahti kammitsaist. Teod algavad igal hommikul uuesti, peeglisse vaatamisega, kinnitamisega, et täna tuleb ilus päev, sest ise ma ilutegija. Järgmiseks teen end vajalikuks, seejärel nõuan teistelt enda vajalikuks tunnistamist. Mõelda oskavad meist paljud, aga rääkida?	112
est	1	Hiljem on ta öelnud, et lõpetas suitsetamise järkjärgult.	10
est	1	IEA tegevus on laienenud väljapoole kütuse valdkonda ning pakub parimat analüütilist teadmist, ligipääsu statistikakogumikele ning rahvusvahelist võrdlusandmebaasi lisaks vedelkütusele ka muudes energeetika valdkondades, eelkõige gaasisektoris, aga järjest enam ka kliimapoliitikas, taastuvenergeetikas, energiatehnoloogiate vallas ning elektrimajanduses.	41
est	1	Näiteks hiljuti loeti üheskoos planeetidest, praegu on käsil Karlssoni-lood. Oskar oskab ka ise soravalt lugeda ja kirjutada, mis on katsetega kooli pürgimisel üks tähtsamaid nõudeid.	29
est	1	Praegu oma jalgpalliklubi Nõmme Unitedit arendav 41-aastane puurilukk naaseb pärast nelja aasta pikkust pausi väljakule, kui ta registreeriti värskelt teise liiga põhja/ida tsoonis mängivasse Tallinna Ülikooli amatöörmeeskonda.	29
est	1	Vahva pilt, palju õnne autorile!	7
est	1	"""Mina ja abikaasa ei survestanud Oskarit üldse, drilli ei teinud ja tundide viisi lapsega lugemis- ja arvutamisharjutuste taga ei istunud, kuna me ei tahtnud, et lapsel tekiks stress ja liigne pinge. Me lihtsalt usaldasime poja ettevalmistuse Vanalinna Hariduskolleegiumi õpetajatele, mille eelkoolis Oskar käis,"" tunnistab Evelin ja kiidab Nõmme munitsipaallasteaeda: ""Suure töö tegid ära Lauliku lasteaia kasvatajad, kus Oskar käib. Seal on tõesti väga head pedagoogid. Minu teada said tema lasteaiarühmast neli last kooli katsetega sisse – see on ju väga hea tulemus!"""	97
est	1	Merko Tartu projektidirektori Juhan Variku sõnul olid eilseks lõppenud hoone süvendi kaevetööd ja 90 protsenti vundamenditöödest. «Järgnevad suuremahulised tööd on kiviseinatööd, raudbetoonelementide paigaldamine ning teraskonstruktsioonide ja puitelementide montaaž,» loetles Varik. Sarikapeoks lubas ta valmis olla juba enne jõule.	45
est	1	Peatreenerist papa Soku sõnul said paljud mängijad juurde häid kogemusi ja suutsid tõestada, et võivad olla isegi paremad kui mõned Euroliiga pallurid. «See on väga suur vahe, kas mängida igapäevaselt siin koduliigat või Euroliigat,» nentis ta. «Nüüd tõstsid aga mõned mehed oma lati väga kõrgele.»	55
est	1	"""Villiko mõtles, otsis ja sebis asju. Ergo tuli meile appi väga lühikese etteteatamisega ja meie mõtted läksid loominguliselt väga kokku. Kõik käis nii kiiresti, et mõttest teostuse ja viimase lihvini läks umbes viis päeva,"" kiidab Tanja."	44
est	1	Praktilised kodundusoskused	2
est	1	Inimesed, elage ise ja laske teistel ka elada!	10
est	1	Homme õhtul kell 21 avab Rock Café uksed kõigile rokkmuusika austajatele. Laval astuvad üles Soul Thrower, Driven ja No-Big-Silence. Tallinncity loosib lugejate vahel välja kaks vabapääset kahele.	31
est	1	Teiseks meeldejäävaks sündmuseks 9.–24. märtsini kestnud reisi jooksul peab bändi laulja Holi pidustusi, kus üksteist värvipulbriga pildudes tervitatakse kevade saabumist.	23
est	1	«E3+3 ja Iraan jõudsid tuumaprogrammi osas kokkuleppele,» ütles Ashtoni esindaja.	14
est	1	Merko Tartu projektidirektori Juhan Variku sõnul olid eilseks lõppenud hoone süvendi kaevetööd ja 90 protsenti vundamenditöödest. «Järgnevad suuremahulised tööd on kiviseinatööd, raudbetoonelementide paigaldamine ning teraskonstruktsioonide ja puitelementide montaaž,» loetles Varik. Sarikapeoks lubas ta valmis olla juba enne jõule.	45
est	1	"""Kuna see oli esimene kord, kui suur väljak tühjaks tehti, siis ma arvan, et kõik olid väga huvitatud, et mis seal nüüd toimub!"""	30
est	1	Osana suurriigi positsiooni taastamisest on Venemaal mitme aasta vältel loodud süsteemi, mille eesmärk on toetada Venemaa sise- ja välispoliitilisi pürgimusi enam kui 35 miljoni välismaal elava Venemaa kodaniku ja sealt pärit inimese abil. Aluseks on 2010. aasta suvel uuendatud välismaal elavate kaasmaalaste toetamise seadus.	47
est	1	Taani Printsess Mary tuleb homme Eestisse. 	7
est	1	Kontsert oli suunatud ilmselgelt nooremale seltskonnale, kel Alice Cooperi loomingust vaid põgus ettekujutus legendide tasemel. Lõpus esitatud kolm klassikalist tükki, eriti finaaliks tulnud «School’s Out», täitsid aga hinge vana armastusega ja lahustasid algselt tekkima hakkava sademe.	45
est	1	Vene põhiseaduse järgi on Putinil õigus olla president kaks järjestikust kuueaastast ametiaega. Ta sai esimest korda presidendiks 2000. aastal ja oli ametis 2008. aastani, mil amet läks neljaks aastaks Dmitri Medvedevile, samal ajal kui Putin ise asus peaministri kohale.	43
est	1	"""Ta on meile väga palju toeks."""	9
est	1	Eile Rootsi võiduga lõppenud jäähoki maailmameistrivõistluste parimaks mängijaks valiti Šveitis kaitsemängija Roman Josi.	14
est	1	"""Me Viimsi inimestega isegi ei teadnud, et seal selline koht olemas on. Tuli välja, et see ongi alles väga värske, aga omanikud olid väga toredad ja seal oli mugav filmida,"" kiidab Tanja."	40
est	1	Mitte suurendada kaitsekulusid, vaid panna raha korraliku eesti vene meedia alla.	13
est	1	"Ly sõnul tuleb tööd teha rõõmuga, sest vastu tahtmist tegutsedes ei tule kunagi head nahka. ""Kui töö rõõmu pakub, hakkab juhtuma ilusaid asju,"" usub ta."	32
est	1	Väga lahe igal juhul :)	6
est	1	Sisse kahte kooli korraga	4
est	1	Selleks et Eesti pääseks tuleval suvel Sloveenias toimuvale EM-finaalturniirile, tuleb teisipäeval alistada kodus Island ja loota, et Serbia kaotab koduväljakul Iisraelile. Millise korvide vahega üks või teine kohtumine lõppeb, pole tähtis.	36
est	1	"Sparre, kes elab Tallinnas ja hakkas fotograafiaga tegelema alles hiljuti, võitis kontseptuaalse foto kategooria rabavalt sürreaalse fotoga „Päästeoperatsioon"", mis avaldas kohtunikele väga muljet."	29
est	1	Balti Tähe preemia asutati 2004. aastal, tunnustamaks Läänemeremaade kultuuri- ja kunstiringkondade esindajaid, ühiskonnategelasi, poliitikuid ja majandusinimesi, kes on andnud suure panuse humanitaarsidemete ja -koostöö arendamisse Läänemere regioonis. Sel aastal antakse preemiat välja juba kümnendat korda.	41
est	1	Festival haarab veel Y-galeriid ja Noorust. Esimeses näeme «Kuku nunnu» stipendiaadi Eike Epliku skulpturaalseid installatsioone ning teises ameeriklase Chris Fitzpatricku kureeritud 16 kunstniku loomingut pealkirjaga «Sõida tasa üle silla».	35
est	1	Iseseisev Eesti riik on meie põhiseaduse toel kahe aastakümnega eesti kultuuri ja keele positsioone oluliselt tugevdanud ja seda mitte ainult  meie riigi piires, vaid avatud suhtluse abil ka meie piiride taga ELis ja kaugemalgi. Eesti on kujunenud võrdväärseks partneriks rahvusvahelises majanduslikus, poliitilises ja kultuurilises koostöös.	49
est	1	Paljud eestlased kartsid, et uus iseseisvusaeg esimesest kauem ilmselt ei kesta. Siiski on läinud teisiti. See on tingitud tõsiasjast, et Eesti oskas nii vaimselt kui majanduslikult kerkida kiiresti iseseisvaks riigiks. See pole olnud kerge, kuid leidus piisavalt võimet haarata kinni olulisest. See on austust vääriv saavutus.	54
est	1	"""Märt Meos tegi ettepaneku, et ma tuleks suveks midagi lavastama ja tal olid välja pakkuda mõned mängukohad. Üks nendest oli Tapa raudteejaam, selle keskkonna mõju oli nii tugev, et ma ütlesin: jah, siin oleks küll põnev midagi teha, aga sel juhul peaks tegema midagi sellist, mille tegevus võiks samuti raudteejamas toimuda,"" meenutab Kalmet."	65
est	1	Mais avatav Viimsi kino on üks osa rajatavast avastamis- ja mängukeskusest, mis on ühendatud meelelahutus-, vabaaja- ning spaa- ja veemaailmaga.	23
est	1	Teiseks meeldejäävaks sündmuseks 9.–24. märtsini kestnud reisi jooksul peab bändi laulja Holi pidustusi, kus üksteist värvipulbriga pildudes tervitatakse kevade saabumist.	23
est	1	«Ta helistas mulle ja ma võtsin ta peale ja me sõitsime koos edasi. Aga kui ma hästi aus olen, siis käisin ma vahepeal lõunasalatit söömas ja võtsin korrale ühe pokaali punast veini,» seletas Siiri Õhtulehele.	41
est	1	Igatahes on poiss koolimineku suhtes väga hästi meelestatud.	9
est	1	Valikut, kes parima plaani esitas, oli korraldajate sõnul väga raske teha, sest laekus palju häid ja läbimõeldud ideid maailmapäevade läbiviimiseks, kuid parimaks valisid nad Oleski töö.	31
est	1	Olen rongiga viimasel ajal väga tihedalt sõitnud ja ainult üks kord nägin purjus noormeest, kuid tema käitumine ei häirinud, pigem häiris see teda ennast.	27
est	1	Ütleme nii, et ega rongis alko libistamine ei ole probleem iseenesest. Arvatavasti ei sega kedagi peale mingite karskusfüürerite näiteks pulmapeolt pohmakaga ja ülikonnastatult saabunud noormees, kes täiesti vaikselt ja omaette tiksudes 2-3 õunasiidrit ära libistab.	39
est	1	Mis bõstra? SÕSTRA	4
est	1	Naiste ühepaadil sai Pajusalu kolmandas eelsõidus ajaga 8.00,61 kolmanda koha ja pääses samuti poolfinaali. Eestlannat edestasid Tšehhi (7.41,53) ja Austria (7.47,32) sportlased.	28
est	1	Lindsay kainusvalvur ei lase teda hetkekski silmist ja järgneb talle kõikjale, mida iganes staar ka ette ei võtaks. Lindsay pole ainuke, kes omapärast teenust kasutab – Hollywoodis on inimestel, kes on valmis narko- ja alkoholisõltlastest kuulsustele omamoodi lapsehoidjaks hakkama, alati tööd.	47
est	1	"""Oskar on hästi uudishimulik ja seikleja tüüpi laps, kes, kuuldes koolikatsetest, tahtis ise katsetele minna. 21. kooli ta sisse ei saanud, kuid kahte vanalinnakooli – Gustav Adolfi Gümnaasiumi ja Püha Miikaeli Kooli – sai,"" räägib Evelin."	45
est	1	USA president Barack Obama väljendas ööl vastu pühapäeva sõlmitud Iraani tuumaleppe üle heameelt ja avaldas lootust, et tegemist on esimese sammuga suhete normaliseerumise teel.	26
est	1	Seda suurem oli elevus nüüd sinna minnes. Ja tõepoolest: remont on äratanud uuele elule nii eksponaadid kui silmanähtavalt ka inimesed, piletöörilgi paistis uudistajate rohkusest hoolimata silmasära jätkuvat.	31
est	1	Obama osales eile New Yorgis ÜRO peaassamblee tsiviilühiskonna ümarlaua kohtumisel ning heitis ühe sealse diplomaadiga nalja.	17
est	1	Aga Kükametsa Värdi pere, pereema Krõõt ja ta neli last Mats, Vidrik, Eedu ja tütar Vilma käivad kohalikus Hobuseemne küla ja Tuhamägede aleviku algkoolis,seal pole küll kõik õpetajategi kohad täidetud ,kuid tänu kooli kokkadele ja nõudepesijale saan tunni tööd kenasti ära antud õpilastele,need ,kes rohkem koerust täis kutsub korrale koolimajas endas elav katlakütja ja remoondimees Mäeltsamees. Küll on tore ,et meil koolis polnud mingit konkurssi ega arenguvestlusi ,sest muidu küla joodikust naise Ülle lapsed Joonas ja tütar Nadezhda poleks mingi valemiga sellisessegi kooli saanud.	97
est	1	"""Toni suur õde käib seal 2. klassis ja talle meeldib see kool väga."""	16
est	1	"""Meil öeldakse otsusekindla mehe kohta: tõeline mees!"" kiitis ta."	14
est	1	Aeg-ajalt tuleb ikka kodus remonti teha. Pruuni põrandavärvi, mille lehk ähvardas sõna otseses mõttes tappa, n-ö euroremontides enam ei kasutata, kuid ikka on parem, kui majalised selleks ajaks jalust ära lähevad. Värskema ilme saanud kodu ergastab vaimu, suurendab optimismi, parandab meeleolu ja sedakaudu vahest tervistki.	54
est	1	Alusta iga päeva nagu uut, keskendu tänasele	8
est	1	Täna pärastlõunal oli sõidetavus suurematel riigimaanteedel hea, teatas maanteeinfokeskus.	11
est	1	Eesti poodides on praegu müügil 400 sorti jäätist ning igal aastal tuleb juurde paarkümmend uut toodet. «Kuigi vaniljejäätis on Eestis nr 1, siis inimesed otsivad midagi, mis oleks teistmoodi,» tõdes Balbiino kvaliteedi- ja arendusjuht Kristel Männik.	43
est	1	Palju õnne võitjale :)	5
est	1	«Oleme arvamusel, et Briti politseinikud saavad rutiinsetes juhtumites hakkama relvata,» sõnas Fahy.	17
est	1	Pikemat aega tühjana seisnud majas inimesi ei viibinud ja keegi kannatada ei saanud.	14
est	1	«Teadsime, et Serbia tsenter Nenad Krštic ei tule kaitses korvi alt kaugele välja, Reinar aga viskab väljast hästi. Tegelikult oli see paras risk, aga nagu mäng näitas, külvas ta serblaste hulgas parajalt segadust,» selgitas Sokk ootamatu käigu tagamaid. «Lisaks oli selge, et korvi all võetakse Krštici vastu vigu – meile oli kasulikum, kui vähemalt esimese vea teeb Hallik, mitte näiteks Janar Talts.»	77
est	1	Austrias Obertilliachis toimuval noorte ja juunioride laskesuusatamise MMil teenis Rene Zahkna noormeeste 10 km jälitussõidus hõbemedali. Reedel oli Zahkna saanud sprindis pronksmedali.	24
est	1	Vaatasin CV-keskusest - Tallinna vesi otsib praegult keemikut. Ülesandeks reoveeproovide analüüs ja labori korrashoidmine. Palka polnud ära toodud.	21
est	1	Isiklikult kohtasin natukegi Kukekese moodi politseinikku viimati kaheksa aasta eest Lätis. Eranditult kõik viimase kümnendi kokkupuuted politseiametnikega on kinnitanud: vaatamata raskustele on Eesti riik suutnud korrakaitsjateks värvata inimesi, kes on arukad, kohusetundlikud, lugupidamist sisendavas füüsilises vormis ja hea väljendusoskusega.	45
est	1	Sellel nädalavahetusel kohtubki Motherwell kodusel Fir Parkil Celticuga. Ojamaa usub, et Celtic tuleb nende vastu oma tugevaimas koosseisus ning oodata on head mängu. «Mõlemale meeskonnale meeldib mängida jalgpalli, seega peaks tulema põnev mäng, mis meeldib ka neutraalsele vaatajale,» rääkis ta.	49
est	1	Eesti jalgpallikoondise poolkaitsja Konstantin Vassiljev võitis täna neljandat korda Hõbepalli. Kui Vassiljevi teine tabamus Hollandi koondise vastu oli tõeline iluvärav, siis sama kõrgest klassist oli ka tabamusele eelnenud Joel Lindpere sööt.	34
est	1	"""Valmistasime ette ühe Rajasthani rahvalaulu meie bändi võtmes ja see pani kogu platsitäie rahvast üles-alla hüppama,"" räägib Bombillazi laulja ja räppar Kill Kaare, kuidas bänd Indias Pushkari linnas kohaliku loo töötlusega kohe publiku poolehoiu võitis. ""Pärast kontserti tuldi kallistama. Praegu võib küll öelda, et Pushkaris teab meid suurem osa inimestest."" "	60
est	1	Praegu käib Laura Lee peale lasteaia ka eelkoolis, ning ema sõnul meeldib tütrele eelkoolis väga.	17
est	1	Kiired lahendused probleemidele on alati edasiviiv jõud.	8
est	1	Muide, ma teen selget vahet traditsioonilisuse ja keskpärasuse vahel. Need ei ole üks ja seesama. Traditsiooniliste vahenditega saab keskpärasust väga hästi vältida.	26
est	1	Rael Arteli sõnul tuleb muuseumi efektiivsema tegevuse tagamiseks aeg-ajalt üle vaadata tööjaotus.	13
est	1	«Lootsin võita, aga ei arvestanud sellega! Mulle ei ole veel kohale jõudnud, mis juhtus,» tunnistas Tanja pärast «Eesti laulu» võitu. «Olen 23 aastat Eurovisioni fännanud ja nüüd on mul võimalus seal esineda – minu elu unistus täitus!» ei varja lauljatar, et tema eesmärk oligi jõuda Eurovisionile.	60
est	1	Lisaks ülaltoodud näidetele tegi Kanada näitleja ja režissöör Sarah Polley ühe Munro novelli järgi filmi «Away from Her», mille stsenaarium kandideeris Oscarile. Hea kirjandus ei tunne piire ja ehkki Alice Munro loomingut eesti keeles veel lugeda ei saa, on meil järjest enam inimesi, kes mõistavad seda lugeda originaalis. Ja see on juba väga hea.	62
est	1	Nii Krista kui ka Norman on mõlemad aastaid tagasi toonud perekonda ka aasta prokuröri tiitli.	16
est	1	"""Võib-olla suure õe kõrvalt on piilunud. Ta on väga motiveeritud hästi lugema õppima, sest talle meeldivad koomiksid, lasteraamatud ja ta tahab viimse detailini teada, mida ""Star Warsi"" filmides tegelased räägivad."""	39
est	1	Esialgu suheldi telefoni, meili ja kirja teel, hiljem tegi Frederik salamisi mitu reisi Austraaliasse. 2001. aasta novembris teatas Taani nädalaleht, et printsil on Austraalia pruut. Järgmisel kuul kolis Mary Pariisi, kus hakkas andma inglise keele tunde.	43
est	1	Toni kool on kodust 7–8minutise jalutuskäigu kaugusel ning esialgu hakkab ema teda kooli saatma.	15
est	1	Muuseumi uus hoone valmib Raadil juba mõne aasta pärast. Koos sellega avaneb võimalus lõpuks ometi muuta piirkonna ja maastiku ilmet ning mainet kooskõlas kauni mõisapargi ja järvega. Kuigi suured alad on maetud betoonist lennuradade alla, on kunagise suletud lennujaama alalt leitud mitmeidki taimharuldusi, mille kaitseks on juba 2009. aastal tehtud ettepanek Raadi looduskaitseala moodustamiseks.	59
est	1	Ma olen jäänud ikka nende luuletajate hulka, kes on väga oluliseks pidanud luule lauldavust. Vahepeal juhtus niimoodi, et väga palju Runneli luuletusi leidis laulmise rõõmu, neid viisistati.	32
est	1	120 korda Eesti koondist esindanud ja 2009. aastal jalgpallisaapad varna riputanud väravavaht Mart Poom naaseb palliplatsile, liitudes II liiga meeskonna FCF Tallinna Ülikooliga.	25
est	1	Praegu oma jalgpalliklubi Nõmme Unitedit arendav 41-aastane puurilukk naaseb pärast nelja aasta pikkust pausi väljakule, kui ta registreeriti värskelt teise liiga põhja/ida tsoonis mängivasse Tallinna Ülikooli amatöörmeeskonda.	29
est	1	Nii majanduslikult kui tervishoiu-korralduslikult on hulganisti argumente mitmete erinevate liitumiskombinatsioonide toetuseks, aga kõige olulisem on sisuline koostöö ning võimalikult selge tööjaotus iga konkreetse eriala lõikes. Eesti maksumaksja on küll suutnud paari aasta jooksul eriarstiabi eelarvet ligi 20 protsenti kasvatada, kuid asjatu dubleerimine käib meile ilmselgelt üle jõu.	51
est	1	Rong oli tema hinnangul puhas, ilus ja äge. «Istmed olid küll esmapilgul jube kõvad, kuid ka pika istumise tagajärjel ei hakanud mul ebamugav. Mõtlesin sellel istmeteemal kohe pikemalt, et ilmselt on nii vinge tootjafirma taga siiski ka pikk arendustöö, et istumine oleks mugav aga mitte liiga pehme,» arutles ta.	59
est	1	Mina arvan, et loodusmuuseumil on lootust. Seda tõestab kas või tasemel sügisese seenenäituse jätkuv tase ja traditsioon. Kui keegi juhtumisi ei tea (neid inimesi on üsna vähe), siis seenenäitus on loodusmuuseumi klassika.	39
est	1	Sooviksin tõstatada ka ketserliku idee palgatõusuks raha leidmiseks. Võiks kasutada Costa Rica lähenemist, kes on ära kaotanud sõjaväe ja kõiki rahasid, mida muidu oleks kasutatud sõjaväe ülalpidamiseks, kasutatakse hariduse edendamiseks ja teistel sotsiaalsetel eesmärkidel.	39
est	1	Skandinaavia rongides võetakse küll einevõieleiva kõrvale mõni väike õlu ja keegi keelama ei tule. See polegi probleem - probleem on purjutamine, lällamine jms segamine.	27
est	1	Väga õige. Nii peabki!	6
est	1	Raporti kohaselt on ligipääs internetile Eestis jäänud võrreldes 2011. avaldatud raportiga samaks, veidi on kasvanud piirangud sisule, ent paranenud kasutajaõiguste kaitse.	24
est	1	MX2 klassis võistelnud Priit Rätsep sai esimeses sõidus 4. ja teises 6. koha. Kolmandas sõidus tuli oma klassis taas 4., kuid üldarvestuses päeva parim 11. koht. Kokkuvõttes oli Rätsep oma klassi neljas.	36
est	1	"Eesti Turniiripokkeri Föderatsiooni presidendi Marek Reinaasi sõnul õnnestus täita peamine eesmärk ehk jõuda kuue tugevama riigi hulka ning tagada seeläbi koht novembris toimuval MM turniiril. ""Vähemalt pokkeris oleme jõudnud viie edukama riigi hulka Euroopas ning seda vaid kolme aastaga,"" oli ETPFi president rahulolev ning rõhutas, et talle ei meenu ühtegi teist spordiala, kus Eesti rahvuskoondis oleks Euroopas hetkel esimese kuue hulgas. Eesti koondis oli ühtlasi ka edukaim ainult amatöörmängijatest koosnev võistkond. Turniiri võitis Iirimaa, teiseks tuli Venemaa, kolmandaks Hispaania ning neljandaks Suurbritannia koondis, MMile pääses veel Eesti järel kuuenda koha saavutanud EMi korraldajamaa Küprose koondis."	107
est	1	Lapse üldine koormus ei peaks suurenema, aga koormus selles valdkonnas, kus on anne ja loomupärane huvi, peaks püsima algkoolist gümnaasiumi lõpuni. Õpetajal peaks olema lihtsalt kättesaadavaid abivahendeid, et seda koormust tagada. Õpetaja ei peaks olema kohustatud «laia matemaatikat» või «laia loodusõpetust» ise välja mõtlema, kui väikese kooli klassi satub erihuviga laps. Piisaval hulgal lisamaterjale peaks olema riigi toel välja töötatud ja kõigile koos metoodiliste juhistega kättesaadavad.	79
est	1	Programmist toetatakse kaasaegse eesti laste- ja noortekirjanduse tõlkimist ja kirjastamist vene keelde, vahendas ministeeriumi pressiesindaja.	17
est	1	Tarbijakaitseametist öeldi, et teiste kupongide kohta neile kaebusi laekunud ei ole.	13
est	1	Kolmandaks tähtteoseks on valitud Kai Kaljo «Luuser», mis oma suure üldistuse ja peene huumoriga seda ongi. Flo Kasearu ja Anna-Stina Treumund on esitanud ääretult vaimukad videod inspireerituna Jaan Toomiku ja Kai Kaljo loomingust.	38
