lang	sentiment	text	num_tokens
fin	-1	Tyyppi syyttäköön itseään.	4
fin	-1	Mölysakki on mölysakki hallituksessakin!	5
fin	-1	Mua vituttaa niin, että ei tiä mitä sanois!!!	12
fin	-1	Oppis ne kiinalaisetkin lisääntyy vähän hillitymmin niin ois kaikki ihan hyvin sielläkin	12
fin	-1	Sama huolettaa minua..	4
fin	-1	Ei ole ateistista evankelistojen kaltaisiksi rosvoiksi!	7
fin	-1	Vammoistakin kun akat hakkasi - lapsia, joilla ei ollut niin isää kui äitiäkään - olen itsekin kuullut monenkin nuoren ja lapsenkin sanovan että en jaksa elää - ei koskaan saa surra, olla masentunut, vihainen, tuntea tunteita, ihmisten vihan kyllä tuntee omassa kehossaan - sitäkin on turha toitottaa ettei hyväksy tai ole hyväksytty - riiston maku kaikessa - ku joku kättelyssä jo ilmoittaa että mitäs sinne tai tänne oot tuppautumassa?	75
fin	-1	Tiedän useita sellasia ja niillä ei ole pokkaa kieltäytyä pas.ka hommista koska ovat vellihousuja ja eivät muuten pärjäisi.	19
fin	-1	sinä et tähän asiaan vaikuta mitään.	7
fin	-1	"Lapsesi menettivät vanhimman sisaruksensa.
1	1	0	1	4										1	1	12	5	comments2010e.vrt 3417902	pois murhemieli rinnasta paistaa hymy runostasi lukijalle ja voi että kuinka hyvä on viimeinen kappale kauniissa runossasi.
0	-1	0	0	2										1	-1	16	5	comments2007e.vrt 2692995	Itselläni myös se ongelma, että en selittänyt teorioita lainkaan, vaan mainitsin esim.
0	0	0	0	3										0	-1	20	5	comments2005b.vrt 1428861	Kansi ja siipipyörä nostettava akselilta äläkä hukkaa sitä pientä kiilaa, jonka avulla pumppu saa käyttövoimansa vetoakselilta.
1	0	0	0	4										-1	0	18	5	comments2010c.vrt 243073	Niitä aikaansa ja vaivaansa uhranneita, joille ratkaisuni on vaikea sulattaa, voin lohduttaa sillä, että sen tekeminen oli vielä vaikeampaa.
0	0	0	0	3										0	-1	19	5	threads2013b.vrt 1400024	[URL=http://aijaa.com/xneCs8]http://aijaa.com/xneCs8[/URL]
0	-1	0	0	2										0	-1	11	5	comments2013d.vrt 1758231	Ei oo oikein viimevuosina noussu.
0	0	0	0	3										-1	-1	6	5	comments2015d.vrt 1181147	Aloitus kai tarkoitti kiinnittää huomiota siihen asiaan että kaksi suurinta ketjua tekee samanlaaisen päätöksen samanaikaisesti, ei vaokuvauksen muuttumisesta.
0	-1	0	0	2										0	0	2	5	threads2007b.vrt 1557335	En tiedä mistä on kysymys, kun en saa yhteyttä millään tavalla.
0	0	0	0	3										-1	0	11	5	comments2006d.vrt 439846	No joo, eihän tähän kohteeseen kannattanut kaikkia lyödä.
1	1	0	1	4										1	1	11	5	comments2005d.vrt 1200566	Janni Elena -&gt; ihan ok
0	-1	0	0	2										0	-1	3	5	comments2010a.vrt 1228288	Onhan tämä ketju otsikoitu nimeäni käyttäen: Weijo tyrmää!"""	278
fin	-1	Mutta mitäpä siitä sai mitä halusi.	7
fin	-1	On se hirveetä kun julkkiksia mollataan!!	8
fin	-1	Jos naisella on tylsä, yksitoikkoinen ja huonosti palkattu työ, se on riistoa.	15
fin	-1	Viisaampia naisia odotellessa.	4
fin	-1	Poliisit nauttivat sadistisesta teostaan, koska poliisiopistoon hakee ainoastaan sadistit: http://www.urbaanisanakirja.org/word/sadisti Se on suurin tekijä sisäänpääsykokeessa, että omaa sadistisen ja narsistisen persoonallisuushäiriön, kuten tämän palstan poliisinpalvoja.	32
fin	-1	Kunhan se vaan on se hyvännäkönen tumma tukkanen kaupungin suurin huorpukki se saa vaik oksentaa mun päälle raflassa, ni kyll mää sille sit seuraavana päivänä soitan ja ehdotan treffei.	31
fin	-1	ja toinen juttu, saa käyttää vapaasti omia aivojaan jos ihmettelette onko tuo päivämäärä vai kellonaika??	18
fin	-1	Olen ruma ja kokematon.	5
fin	-1	Noi voi vihannes!	4
fin	-1	Ettekö te koskaan opi..	5
fin	-1	"Uudemmista autoista ehdoton surkki oli Moskvista Pajero maasturi, jonka ostin ""uutena"" (rahoitusyhtiö oli hakenut omansa pois ja ostin rahoitusyhtiöltä), täysi p##ska koko auto, useampi vaihteisto meni takuuseen, runko takaa poikki virheellisen vetokoukun kiinnityspisteen vuoksi ym. ym."	48
fin	-1	kyllä varmaa listaa voi jatkaa vaikka kuin mutta tosi asia on se että kepujen leikki on repinyt koko kunnan hajalle.	21
fin	-1	Ja mitä vittua tuo tarkoittaa, että MAT selittää todellisuutta, mutta ei ole sitä?	16
fin	-1	Yksinkertaisesti siitä syystä uskonnot ovat hölynpölyä, että uskonnollia oppeja ei voida tieteellisesti osoittaa oikeiksi, mutta hyvin monet voidaan todistaa vääriksi.	23
fin	-1	Kummalla on enemmän järjen valoa, uskovalla kristityllä tohtorilla vai hädin tuskin amiksen 1. luokan kahlanneella teinipojalla, jonka täytyy mennä massan mukana kun on coolia diivailla järjellään vaikkei ole oikeastaan mitään sanottavaa, eikä perusteluja.	37
fin	-1	Suurin syy on varmaan, ettei ne missään nimessä halua mamuinvaasiota omalle paikkakunnalleen..!	15
fin	-1	"Liikaa ählämejä kyttäämässä että löytisikö ""sopivaa""."	9
fin	-1	Miesraukka rupsahtaa vuosi vuodelta ja tupakointi on osasyynä kera kahvin.	11
fin	-1	Onpa Forssan kesävieraalla outoja herjaavia mielipiteitä.	7
fin	-1	Rehellisyys on lapsellista	3
fin	-1	NISKAT SANOO MORJESTA,JOS KANNISKELEN NEITIÄ YLI TUNNIN.	10
fin	-1	"Onko siinä mitään kadehdittavaa, jos joku ajaa omalla autolla 50 km ja polttaa ""työaikaa"" muutaman tunnin ja saa silleen myytyä vaikkapa satasen edestä halppistuotteita (ja nekin ostetaan säälistä), josta ite jantteri saa händyyn noin 30 €uroa -verot yms."	45
fin	-1	_miehet_ ovat luopuneet erikoisasemastaan ja eduistaan.	7
fin	-1	Joka näkyy vain hämärässä HYVIN pienessä osaa laitteita, ja jotka Apple vaihtaa uusiin ilmaiseksi, jos ne jotain sattuvat haittaamaan?!?	24
fin	-1	En kestä :'(	5
fin	-1	Tämä on surullinen päivä suomalaisessa demokratiassa.	7
fin	-1	Muista, että lääketietelliset häiriöt löydetään, persoonallisuushäiriöt keksitään.	10
fin	-1	Vittu kyl meit on moneen junaan!!	8
fin	-1	mä oon ollu jo kauan masentunu..	7
fin	-1	JA KAIKKI ON PERSEESTÄ!!! ELI PC ON PARAS!	12
fin	-1	mä haluun löytää elämääni ihmisen jonka kanssa voi rakentaa tulevaisuuden kun näin sut toisen kanssa tajusin sun kusetukset sillon ja päätin lopettaa tapaamisen kun huomasin että leikkit vain leikkejäsi	29
fin	-1	Kirjoittelet, että minä kirjoitan epäloogisesti, etkä itse huomaa omien kirjoitustesi kehäpäätelmiä.	14
fin	-1	Sori vaan.	3
fin	-1	Sanoin aina ex-miehellekkin että onko menkat päällä, kun se rähisi jostain ihan oudoista ja typeristä asioista aina muutaman päivän kuukaudesta.	22
fin	-1	Raha ei todellakaan tee onnelliseksi.	6
fin	-1	"Ei haluta mitään ""emmä tiiä"" vastauksia."	9
fin	-1	"On yksi Virolainen, Anu Sagim, joka on tänne meille tullut ""paistattelemaan"" R.Ratian siivellä ja mollaamaan suomalaista naista, omilla typerillä mielipiteillään!"	26
fin	-1	En tosin usko enään siihen että selviän tästä ahdingosta, koska on ylitetty niin monta rajaa mitä ei voi ikinä enään korjata.	23
fin	-1	Ihan tul paha mieli, kun ei oo ymmärretty mitenkä hirveesti sitä on kiittollisuuven velassa lahen taakse!	18
fin	-1	Joten välitysfirmojen pomot te pidätte turpanne kiinni tällä kertaa kun duunarit puhuvat.	13
fin	-1	Ja juuri sitä soosia pitäisi välttää.	7
fin	-1	Ja pelkään ihan hirveästi, nielunäytettä.	7
fin	-1	"Aijoo, sinähän keksit ne ""virheet"" itse!"	10
fin	-1	Huh hu	2
fin	-1	Tämä voi kuulostaa kauhealta naapurikyttäykseltä, mutta meteli on niin valtavaa että kyttäämättäkin alkaa häiritä.	16
fin	-1	Vai tultu ainoastaan kirkkoa lainaamaan?	6
fin	-1	MIksi he puhuvat sellaista johon itsekään eivät usko eivätkä noudata omia heuvojaan. :-))))))	21
fin	-1	Hirveitä kärsimyksiä ja henkisiä tuskia ja taas niiden seuraamuksia, kalliita hoitokustannuksia ja omaisille monenlaista huolta ja murhetta, ja taas niidenkin hoitokustannuksia, koska saattavat synnyttää tressiä, henkistä ahdistusta.	32
fin	-1	Ne kerrat kun ei niin ei voi valittaa sillä pili on ollut fiksumpi kuin kantajansa.	16
fin	-1	Ei luulisi kaikkivaltiaan itsetunnon olevan niin löyhässä, että tarvitsisi itsetuntoaan kohottamaan ihmisten uskoa häneen.	16
fin	-1	- Osa heistä oleilee Suomessa pysyvästi ja sen LISÄKSI ON HAVAITTU (!) henkilöiden lyhyitä käyntejä maassamme, sanoo Supon päällikkö Seppo Nevala.	25
fin	-1	Ei mene jakeluun, ei sitten mitenkään.	8
fin	-1	Siitä tulee niin infernaalinen darra ettei mistään!	8
fin	-1	jos ei tuo kelpaa niin tässä sitten herralle Inglesin sää kun niin kovasti siitä pitää puhua?	17
fin	-1	Kaikki vääristellään oman edun mukaiseksi, ja selän takan puhutaan paskaa.	12
fin	-1	Perjantai 30. syyskuuta 2016: Suomalaisen sananvapauden synkin päivä!	10
fin	-1	No et sit ilmeisesti tykkää musta :(	8
fin	-1	minä otin kerran yhtä paskiaista kurkusta kiinni ja puristin niin lujaa, että siltä lensi silmät päästä ja veri roiskui korvista.	22
fin	-1	On vaan huono tapa aloitta seurustelu kännissä ja ekana yönä sängyssä.	12
fin	-1	Itse ennemmin olisin yksin, kuin kolme kertaa eronneen miehen ottaisin riesakseni.	13
fin	-1	No minä en ymmärrä uskiksia joten en pysy vaiti.	10
fin	-1	Mutta se ei liikuttanut minua pätkääkään.	7
fin	-1	Ei vittu siis mitä mä just kuulin?	8
fin	-1	valehtelet	1
fin	-1	Te olette itse niin täydellisiä ja katsotte velallista kuin vanhaa makkaraa, joten mukavampi se on kun joku muu soittaa, vaikka asian voisi itsekin hoitaa...	27
fin	-1	Ja by the way - minähän en ole väittänyt että et saisi vittua.	14
fin	-1	Ei onnistunut suvakkien raivoisa itkupotkukampanja saamaan karvakädestä äärioikeisto-breivikkiä, vaikka yritys oli todella kova.	15
fin	-1	Tervehdys mongoloidit..	3
fin	-1	Siis juuri ne valittaja ja ruikuttajageenit naisten puolelta siirtyvät vapaasti eteenpäin.	12
fin	-1	"mikä vittu sua vaivaa?? onx sul joku ""titteli"" ?? teinit on meijän tulevaisuus ja luulis sunki vähä arvostavan niitä :D"	26
fin	-1	Äläpäs valehtele tai minä kerron joulupukille.......†	8
fin	-1	"Voisin toki sanoa jotakin yhtä ""mukavaa"" sinusta, mutta niin idiootti en edes minä ole!!"	19
fin	-1	Kaikkea saatanaa ne mulqwistit keksivät?	6
fin	-1	Miten te naiset luulette pääsevänne ulos tuosta valheen verkosta?	10
fin	-1	No oon ostanut pari witch lehtee, mutta ne ei vaan jotenkin kolahda.	14
fin	-1	Mietippä rehellisesti tiedätkö oikeasti narsistisesta persoonallisuushäiriöstä mitään ja mitkä asiat hänessä siihen OIKEASTI viittaa.	15
fin	-1	Kaikkia ketkä on millonkaan äänestänyt persua on höynäytetty.	9
fin	-1	*Menee pukeutumaan säkkiin ja paiskaa peilin h**vettiin*	12
fin	-1	Mitä sitä teille kuuluu.	5
fin	-1	Annan peli ärsyttää!!!	6
fin	-1	Et sä sit tykännyt minusta.	6
fin	-1	Perhana menee kohta hermot!	5
fin	-1	Eiköhän työllä ja materiaalilla täytetä henkisesti köyhää elämää ja mielikuvituksen puutetta.	12
fin	-1	Jos rouvalla on niin paljon aikaa et pystyy pesemään paskavaipat käsin,ekä ne edes lähde sellai kunnolla puhtaaks,ni tuu meillekki pesemään.. ja vies himaas ne kuivuu ku mulla ei niitä oo kovin paljon tilaa kuivatella sisällä..Ja sitte jos sä ainoona niitä kierrätät ni ei se saastumiseen paljon auta..	55
fin	-1	Miehet ei ainakaan taida ymmärtää, että naiset ovat mielummin yksin tai satunnaisseksisuhteissa, kuin parisuhteessa tylsän ja mitättömän miehen kanssa.	22
fin	-1	Pitää olla suunnilleen zompi jos ei mielialat vähän vaihtele.	10
fin	-1	Kielen käyttönne on niin ällöttävää, että inhottaa.	9
fin	-1	Kyllä minä sinulle osaan sanoa sanottavani tälläkin nikillä, että nyt sormi pois perséestä ja järki käteen.	18
fin	-1	Nyt ahneudesta on tullut hyve ja kaikkien kuuluu ahnehtia kaikkea ja sehän tietysti pääoman apinoita harmittaa kun nyt heille jää vähemmän.	22
fin	-1	On tämä nyt oikeesti jo yhtä helvettiä.	8
fin	-1	Ymmärsin että koronlaskua markkinoilla odotettiin, ja sitä ei tullut, niin propaganda kukoistaa, kun saa aikaan tuollaisen kirjoituksen, EIHÄN SITÄ koron-nousua kai kukaan ja mikään odottanutkaan!!!!!!!!!!!!!!!	44
fin	-1	Homot odottavat kieli pitkällä vaseelinpurkki kädessä uutta Babylonia.	9
fin	-1	Tämä kirjoitukseni tuntuu menevän naisilta yli hilseen.	8
fin	-1	ja siitä syystä ikäänkuin loukkaantui ja antoi minulle anteeksi...minun OMAN pahan oloni...	15
fin	-1	nyt kun tuohon pääsin, suoraan sanoen vituttaakin kaikki mukahurskaat kerettiläiset raamatun tulkitsijat.	14
fin	-1	On vaikeaa saada pidätettyä ja aina ei edes onnistu, vaan lirahtaa vähän housuun :(.	17
fin	-1	"Sinä käyttäydyt kuin sinulla olisi tuomionvaltaa, sinun ""hyvät"" neuvot ovat naurettavan ylimielistä yleistämistä ja haukkumista, hirveä vatvominen alkoholismista sun muusta niille ihmisille jotka eivät oikeastaan edes ryyppää, teet olkiukon jostain ja sitten mukamas tulet parantamaan. :D"	43
fin	-1	Mikään ei saisi maksaa mitään eikä raha ainakaan saisi mennä niille jotka sen eniten ansaitsevat.	16
fin	-1	Sitäkin näille onnettomille reppanoille piti saada.	7
fin	-1	Aivan älytön ajatus.	4
fin	-1	Helvetti mikä superluuseri.	4
fin	-1	-Mitä kaikkea sairasta sen jälkeen onkaan tapahtunut.	8
fin	-1	Ette te saa muuta aikaa kuin huudatte vaan lisä mamuja ja Mamuilletalp lisää tukia.	15
fin	-1	2 vuotta seurustelun nymfon kanssa eikä siltä herunu ikinä muutaku pesää...	12
fin	-1	Tämä on kaikkien ongelmien äiti.	6
fin	-1	Mut ehkä te selviätte, samaa shaibaa tää palsta on täynnä.	12
fin	-1	Minulla vaan ei auennut...=(	7
fin	-1	Luuserin Jorma; arvaa kertoiko tää varaton-työtön-tuloton TOTUUTTA itestään ja tilanteestaan, sen enempää kuin tää LUOTETTAVAKSI ja KUNNOLLISEKSI itseään mainostava live-tapaus ominaistavastaan pitää varanaissuhdetta yllä.	27
fin	-1	Soinin puheet ja teot on niin pahassa ristiriidassa ettei apuja tule.	12
fin	-1	et pääse mihinkään, ellei lähtökohta ole alkumetrillä oikea...,	11
fin	-1	Voi tyhmää pikkulikkaa.Minä olen se jonka kanssa hän on asunut 3 vuotta.Ikinä ei aio jättää minua.Eikä tarvikkaan,minä jätän hänet sinulle kun huumanne on ohi.Kun ehdit rakastua häneen,saat kokea pian saman tuskan mitä te kaksi paskaa aiheutitte minulle.	42
fin	-1	Tuolla lukemalla joukkue yleensä häviää...	6
fin	-1	Member kannatta prkl vie hankkia!	6
fin	-1	Saatte polttaa niin paljon kuin haluatte KUNHAN MINÄ TAI MUUT SAVUTTOMAT IHMISET EIVÄT TARVITSEE HENGITTÄÄ MYRKKYÄNNE!!!	19
fin	-1	känniääliö hommakaan ei kannata!	5
fin	-1	Ei siitä mitään tule.	5
fin	-1	ole se tyyppi jönka känniörveltelyistä 7 Päivää lehtikin tässä äskettäin kirjoitti.	12
fin	-1	Toivon että puolisosi saa edes joskus tietää minkälaisen sairaan kanssa on.	12
fin	-1	Et ymmärrä nyt tämän hetkistä pointtia.	7
fin	-1	Mielummin olen rasisti kuin isänmaan petturi !!	8
fin	-1	Tuskin sunkaan nahkas kovin paksua on	6
fin	-1	Onnistuit tuhoamaan parisuhteen, mutta harmi vaan että siitä saavutuksesta ei jaeta mitaleja.	14
fin	-1	Aika paska kertomus oli en jaksanut lukea edes loppuun.	10
fin	-1	Kyllä minä en semmosen mummon antas penskojani nähäkkään jos mulla ois niin pimee äiti!	15
fin	-1	*nyyh* sinne hän jäi vilkuttamaan *nyyh*	10
fin	-1	Katteleppa niitä apukoulun opuksia vähän tarkemmin!	7
fin	-1	Etet vaan olis nainen jolla olis kyrpä, eli transu.	11
fin	-1	Anna kakara pois	3
fin	-1	Hyvät ja asialliset viestit ylös ja räkänokkien alas.	9
fin	-1	Koska ihminen on saatanallinen laumaeläin jonka mielestä rangaistuksen tulee määräytyä sen mukaan KUKA on uhri, ei sen mukaan KUINKA PALJON uhri kärsi.	24
fin	-1	Täällä saa ostaa kaupasta lisää wc paperia jos tarvitset,mutta älä suosi suomalaista Serlaa, se on täällä markkinoiden ala-arvoisin tuote.	23
fin	-1	"Siellä se vinkuu suu auki, kun petetty ja ""jätetty"" aviomues ei hoida!"	16
fin	-1	Todella naurettavaa vallata katua.	5
fin	-1	Ikävää suhtautumista oman kansansa jäseneen on kateuden tuoma pahuus ja siitä tulevat lausumat.	14
fin	-1	Kukahan se siellä on väärintulkinnut TS:n.	9
fin	-1	Keskityt nyt vaan sen pohtimiseen, mitä pikku päässäsi liikkui, kun menit tuon suhteen mokaamaan.	17
fin	-1	Jos nyt otan eron, tunnen syyllisyyttä siitä että jätän hänet pulaan.	13
fin	-1	"Täytyy olla aika ""kaheli"", joka lähtee Suomesta asti moottoripyörällä Barcelonaan ja kilpailujen jälkeen heti takaisin Suomeen!"	20
fin	-1	suurin osa saa tuomionsa ja jäännös pelastuu?!	9
fin	-1	Kohta tekee elämänkertakirjan jossa kertoo avioerostaan ja haukkuu Junoa.	10
fin	-1	Tämä 30/30 onkin aivan TAHVO ja joka paikassa räksyttämässä.	10
fin	-1	Rahvas saa maksaa erikseen.	5
fin	-1	Loordi nyt kirjoittelee satujaan, yhdelläkään nuorella lääkärillä ei ole puolustusvoimissa 55 v eläkeikää, tämä on Fakta, vain vanhoilla jotka jo eläkkeelle jääneet tai juuri jäämässä, oli upseerin nimitys ja palvelusvuosien jälkeen oli tuo oikeus.	39
fin	-1	Vaatimukset kovenee ja kohta pystyy kävelemään spermapankkiin ja ostamaan laatu~uroksen jälkeläisiä jääkaapista..	13
fin	-1	Mamu ja matu eivät ikinä muutu suomalaiseksi, niillä on aina synnyinmaa ykkössijalla, vaikka sieltä on pitänyt paeta mutta ne olot kuitenkin tänne halutaan.	26
fin	-1	Mutta panun alkoholiriippuvaisuus ja vieraat naiset nyt kaikki tietää.	10
fin	-1	Muuten, taitavat ne Haaviston suosittelijat olla vähän itsekin jollakin lailla omituisia!!!	15
fin	-1	Joskus olen yrittänyt viedä keskustelua joidenkin kanssa syvemmälle tasolle mutta turhaan.	12
fin	-1	Jumala vihaa uskottomuutta ja hylkäämistä.	6
fin	-1	Se on aikojen alussa jo niin määrätty, Sitten joudutte SIPERIAAN, PERUNOITA KASVATTAMAAN ÄHÄ KUTTI	16
fin	-1	En voisi enää seurustella kenenkään katkeran suomalaisen naisen kanssa.	10
fin	-1	Miten niin ÄLY hoi?	5
fin	-1	"Romanit ei voi sietää valkolaisia (enimäkseen), vaikka edessä näyteltäisi kuin hyvää kaveria, niin takanapäin sitä ""ystävää"" haukutaan ihan surutta :("	27
fin	-1	Eipä muuta, tomppeleitahan tässä ollaan kun halutaan sitä ja tätä.	12
fin	-1	Valtiomies väyrynen ajattelee vain ja ainostaan itseään,sitten ehkä suomeakin	11
fin	-1	Ei paljon auta rötös-Kaikkosen höpinät	5
fin	-1	Paskaa jauhettiin Elviksestäkin tämän kuoleman jälkeen ja suurimmaksi osaksi siinä osallisina olivat helluntalaiset.	14
fin	-1	"Tässä korostuu ahneus ja se ""joukkoirtisanominen""on yksi osoitus tuosta häikäilemättömyydestä jota sieltä osattiin odottaa.Minusta voivat ihan vapaasti lähteä nostelemaan sillä silloin voidaan ottaa tuontihoitajat peliin joiden motivaatio on ihan toisella asteellaa.Sota ei yhtä porukkaa kaipaa sanotaan jo sanalaskussakin.Ahneella on paskanen loppu sanotaan sananlaskussa.Mitäpä tekee esim raitiovaunun tai bussinkuljettaja muuta kuin todella vastuullista työtä ja ihan pienellä palkalla (esimerkkinä)yhdestä ryhmästä."	66
fin	-1	Yksilöitä on palstoilla ja he koettavat kylvää epäuskoaan ja vihaansa kristillisiin asioihin.	13
fin	-1	Söin mä hampurilaisaterian siellä, oli vähän ällö.	9
fin	-1	..niin kauan kuin minussa henki pihisee, en tule hyväksymään homoja enkä mitään muitakaan hihhuleita!	17
fin	-1	Ei näytä kivalta, tulee inhottava fiilis :P	9
fin	-1	Näitä tällaisia tapauksia on koko pori täynnä Aloittavat alkoholilla ja kannabiksella ja päätyvät huumeluoliin raiskattaviksi	15
fin	-1	Muut: Hän on hullu, eikä meitä kiinnosta, mitä hullut tekevät.	14
fin	-1	Pois.	2
fin	-1	älkääkä koko aja käskekö mua kertomaan ku kerron sitte ku ne oikeesti on..	14
fin	-1	Näitä erilaisia negatiivisia puoliakin olen kuullut vartuttuani ja ehkä itsekkin joskus johonkin törmännyt.	14
fin	-1	Ei hyvää päivää täällä jaksetaan olla negatiivisia ja haukkua muita.	11
fin	-1	Ei saa kiisata!	4
fin	-1	net Sieltä saat hieman esimakua kommunistien elämään... ja kuolemaan!	11
fin	-1	Pölhöin marginaali suomenruotsalaisista	3
fin	-1	"Kyllä mä ainakin koen sen niin, et jos en lainkaan pääse miehen ""sisälle"", eikä se lainkaan osoita mulle herkempää puoltaan, niin kyllä mä tiedän, et mussa on jotain vikaa silloin, koska tiedän et se kumminkin avautuu sit jollekin toiselle naiselle."	48
fin	-1	Onko oikeasti järkevää että yhteiskunta säätelee aikuisten ihmiseten toimintaa.	10
fin	-1	Jos joku ei ole jennin kanssa samaa mieltä, niin silloin jenni haukkuu ja tölvii tosi törkeesti.	18
fin	-1	En haluaisi hylätä ketään rahan takia, mutta...	9
fin	-1	Jouluhan on itsekkyyden juhla ja kuluttamisen.	7
fin	-1	”Johanna Tukiainen piinaa, vainoaa, pahoinpitelee ja uhkailee!	11
fin	-1	Siis se viikonloppuinen muutama olut-juopottelu, jolloin riitely muuttui entistä pahemmaksi.	12
fin	-1	Haha nauroin oikein ääneen pitkästä aikaa, enpä ole netissä näin turhaa viestiä ennen lukenutkaan!!	17
fin	-1	Menee ihan säälittäväksi toi sun itku.	7
fin	-1	pahoittelen että luulin sinua Siivekäs ansisidonnaisen nauttijaksi, siinä erehdyin ilmeisesti.	12
fin	-1	Ei kumpikaan...sä olet feikki,sua vaan harmittaa kun et pääse kenenkään naisen pöksyihin...	17
fin	-1	Aivan älytön aikaikkuna toimitukselle 16:30-21:00.	6
fin	-1	Sanat ja teot eivät kohtaa, ja kansaa sumutetaan.	10
fin	-1	Kyllä siinä kuulkaas palsta tyhjenee vittu ihan kaikista kirjoituksista.	10
fin	-1	Kylähullu pelle.	3
fin	-1	Anopit ovat ilkeitä ja jne.	6
fin	-1	mutta sanoit sen sitten olevan 600-7oooooe arvoinen.	8
fin	-1	noin vastaa todellinen vesipää, joka ei paremmasta	8
fin	-1	Onpa kauhea asia.	4
fin	-1	Omistaja tappeli omassa baarissa, oikein hyvää mainosta	8
fin	-1	"Kerropa Tiltu, että MISSÄ on se ""voittanut"" Neuvostoliitto?"	12
fin	-1	tai sitten naisille joku emäntäkoulu pakolliseks..	7
fin	-1	En yleensä tartu 13 vuotiaan trollaukseen, kyllä sunkin henkinen kapasiteetti vielä jonain kauniina päivänä kasvaa siihen mittaan, että ymmärrät pyöräilyhousujen/paitojen olevan ilmanvastuksenkannalta aika oleellisia.	27
fin	-1	Yksi piirre mikä näissä ketjuissa aina toistuu joka kerta on että naiset tuomitsevat kunnollisen kiltin miehen.	17
fin	-1	TM--------&gt;HUOMIOTAKO HAET? ^^^^^^^^^^^^^^^^^^^^^^^^^^^^^^^^^^^^^^ Puutteessa oleva palstatietäjä.	16
fin	-1	Hesa täynnä USISTA JA ISISTÄ	5
fin	-1	Tyhmäkin?	2
fin	-1	Helvetti!!!!!!	7
fin	-1	Se sekopää olet sinä.	5
fin	-1	kokeiltu jo, eivät maistu miltään.	7
fin	-1	Ja lisää meille köyhille maksettavaa!!!!	9
fin	-1	Okei tottahan se on, mutta modernimpi versio realistisempi ja se kuuluu näin: se mikä ei tapa, se vituttaa!	22
fin	-1	"Vain pisara sairastunuttta vettä pystyy sairastuttamaan 100% toisen akvan""!!!"	14
fin	-1	Ja mä muistan kun mä itkin kun mä olin kuullut, et sä pidit mua tyrkkynä roikkujana, näin hän mulle sanoi.	23
fin	-1	Haluammeko me tätä?!	5
fin	-1	Aijai, sattuu!	4
fin	-1	"Hymyilette viellä 5v sisään ja kiitätte itseänne ettette koskeneet psykiatria-""lääkäreitten"" rahaa tuottaviin neuvoihin."	17
fin	-1	"Tai siis palkoista ei ainakaan uutisissa ole hiiskuttukaan, vaan koko ajan on vain toitotettu ""osa-aikaorjiksi alistettujen vapauttamista""."	21
fin	-1	yritin puhua järkeä mutta ei..	6
fin	-1	Sillä on läheisriippuvaisia laumasieluja...	5
fin	-1	Ei ainakaan näin !	4
fin	-1	Niih, voihan sitä yrittää elää terveellisestikin, mutta kuollaan kuitenkin ns. ennenaikaisesti.	14
fin	-1	Oli miten oli, muta en soisi ikinä kenenkään lapsille samaa kohtaloa kuin meidän, että isä hylkää omat lapset ja vaihtaa ne vieraisiinja ulkopuoliisiin naisiin, lapsettomiin naisiin, jotta saisi olla rauhassa ilman lasten häirintää.	38
fin	-1	ei lähde nukkumalla:( eikä malttais nukkumaan mennä jos vaikka... vaan eihän se niin oo.	18
fin	-1	Nasse linkitti tänne kerran tämän jumalattoman hauskan sivun, jolle on kerätty poikkeuksellisen rumien ihmisten kuvia: http://www.uglypeople.com Ja sitten me ateistit naurettiin niin!	27
fin	-1	Enkä kyllä ihmettele yhtään, jos luokkassa on kaltaisiasi tyhjäntoimittajia.	11
fin	-1	kohta painetaan pihvit sulle perseeseen ja itket kuin pikkutytöt.	10
fin	-1	Se tykkää vähän saatanasti kaasunpummpaamisesta parkkipaikalla!!!	9
fin	-1	Älykääpiöt kerkes ensin...	4
fin	-1	kauhea ikä reilu	3
fin	-1	Kot kot ..	3
fin	-1	Siksi en tullut sinne rypemään,,,, oluessa.	11
fin	-1	Köyhän kansanosamme eteen on tehtävä työtä - vasemmistopuolueet ovat Suomen köyhälistön katkerasti pettäneet!	14
fin	-1	Ja taas tätä logiikkaa...	5
fin	-1	Mutta minä rankaisen sinua toivuttuani ankarammin kuin kukaan ketään koskaan missään!	12
fin	-1	hyysäreitä, kukkahattutätejä sekä munattomia voivottelijoita vastaan.	8
fin	-1	Itkimme molemmat, minulla oli monta päivää tosi paha olla ja purskahdin helposti itkuun kun näin tai kuulin esimerkiksi vauvojen ääniä.	22
fin	-1	Halpatuotantoa joka vain on brändätty.	6
fin	-1	Mutta FAKTA-OSIO on surullista luettavaa, sitä samaa, mikä bio-vanhemmille on yleensä tuttuakin tutumpaa:	16
fin	-1	Speden tytär vankilaan 4:ksi vuodeksi	7
fin	-1	Varoitatko minua heittä sun ja muitten påålle joka tekee syntiä!	11
fin	-1	taidat olla asiantuntija, niinkuin useimmmat muutkin täällä.	9
fin	-1	Lapset kärsii siitä, että vieras ihminen tulee ja hukkuu heidät lyttyyn ihan syyttä.	15
fin	-1	Kymmenenvuottako kärsivät puutteesta ja nälästä ,roikkuen löyhässä hirressä ja kun vihdon eläkkeelle pääsevät ,mitä on jäjellä?	19
fin	-1	Sä olet liian hintelä..	5
fin	-1	Skippaan veke moiset idiootit jo intuitiolla.	7
fin	-1	Taas ulkomainen kylttyyri rikastutti suomalismusikoiden arkea.	7
fin	-1	Onhan jenkkeissä paljon paskaa mutta kun ovat vihollisen vihollinen number uno!	12
fin	-1	Just nyt tulin niin vihaiseksi etten pysty enään jatkamaan tätä tekstiäni loppuun.	13
fin	-1	Kaikenlainen rienaus, vihapuhe, valehtelu ja painostus yrittää eksyttää uskovaisia hylkäämään uskon ja siirtymään rienaajien leiriin.	18
