lang	sentiment	text	num_tokens
est	-1	Maksim Viksile mõisteti hiljem kohtus altkäemaksu võtmise eest karistuseks viie kuu pikkune reaalne vangistus.	15
est	-1	Jälle üks suure läbisõiduga naine, Eesti ka kahjuks neid täis :(	13
est	-1	Praegu on taas Maarja küla raske valiku ees ning kuna riigilt rahastust pole ja projektirahad saavad otsa, tuleb külas väljaarendatud töökeskuseid otsast sulgeda, juhendajate töökoormust vähendada ning mõned inimesed isegi tööta jätta.	35
est	-1	Erinevalt Mardist pole teater mulle mingi asendusaine. Otsuse, et nüüd hakkan filmi tegema, tegin alles seitse aastat tagasi, pärast seda, kui reklaamitööst sai kõrini – muidu polnuks see võimalik. Kirjutasin ühe loo valmis, see kandis pealkirja «Paradiisiväravad» (miilits Feliks, kelle elu on ummikusse jooksnud, korraldab 1960ndate algul NSV Liidu esimese raharöövi, põhineb tõestisündinud lool – TT). Näitasin seda vanale tuttavale Piret Tibbole (Allfilmi produtsent – TT), kes ütles, et see on täielik jama.	93
est	-1	Esimene pruut võttis unerohtu	4
est	-1	Siiski võib jääda mulje, justkui oleks meil vähemasti valikuvõimalus. Kas lubada sisse head ja kasulikud, kes tõmbaksid asjad käima, kuigi nad ei huvitu kohalikust koloriidist, või neid mitte lubada ja jätkata aeglasema tempoga, see-eest ehedana ja rahvusriigi tuleviku suhtes lootusrikkalt. Aga seda valikuvõimalust pole. Sest «nemad» ei tule üldse, kas keeleta või keelega – kui jutt on natuke suuremast hulgast. Ainsad, kes siia tuleksid, on venekeelsed, ka endistest liiduvabariikidest. Nii et kes realistlikult mõtleb tulijate peale, arvestagu selle kontingendiga.	97
est	-1	Kontserdi algus tekitas pisikese kahetsuse – kuni «Man Behind The Maski» esitamiseni kribeles hinges kahtlus, kas Alice pole tulnud seekord lavale lihtsalt väikse sisemise sooviga tunda mõnu publiku mõnitamisest. Kogu värk oli unine, meenutas kaverbändi esinemist, ja klassikalise inimese/nuku tapmise puudumine (mis aastakümneid on kaasnenud looga «No More Mr. Nice Guy») ainult süvendas tunnet.	65
est	-1	Lisaks tuleb sensitiividel uurida mõistatuslikku mõrvajuhtumit. Smolenski lähedalt leiti tee äärest neiu ja noormehe laip ning nüüd soovivad sõbrad ja sugulased teada, kes noore pereisa maha lasi ja mis seob teda tapetud neiuga.	36
est	-1	Saksa loomaaias tappis tiiger talitaja	5
est	-1	ei tea, kus puu otsas see raha siis nüüd kasvab? kogu aeg ju halab valitsus, et raha pole ja raha pole.:)	27
est	-1	Selle peale läks kogukonnas lahti ärev arutelu. Kas niisugune asi ikka liiga kallis ei ole? Iga lapsevanem ei saa endale ju sellist edevat asja lubada, eriti kui peres on mitu last ja igaühele oma vaja läheb. Ja pealegi, see rikub ära lapse silmad ning hävitab tähelepanuvõime. Õpiasjad tuleb krihvliga tahvlile kriipida, nagu meie omal ajal, vaat see on õige õppimine!	69
est	-1	ma ei tea, kas te olete lollid võii ? Ülistada Volgat ? Miks ? Minna Venemaale ? Miks ? Minna tiirutama ümber Musta merd ? Miks ? Tundub, et midagi on teie peas valesti ?	37
est	-1	Kui neid igahommikusi ehitusmeestest koosnevat järjekorda hinnata siis paistab et eestlasele meeldibki 1.85 euri maksev vedel koorest siirupist kakaopulbrist jms koosnev ollus - kohviga on siin suht vähe pistmist	29
est	-1	Kohus märkis, et süüdimõistetut, kes on isikute grupis toime pannud vägistamise ja olnud aktiivne kaastäideviija, ei ole võimalik vabastada vangistusest tingimisi enne tähtaja lõppemist, kui eksisteerib kõrge uue kuriteo sooritamise oht.	36
est	-1	Praegu on taas Maarja küla raske valiku ees ning kuna riigilt rahastust pole ja projektirahad saavad otsa, tuleb külas väljaarendatud töökeskuseid otsast sulgeda, juhendajate töökoormust vähendada ning mõned inimesed isegi tööta jätta.	35
est	-1	vänta aga. võetagu vändagängster ja tema vändabande kah kampa	10
est	-1	Kolm majast põgenemiskatsel hukkunud võitluskaaslast said Osula kalmistule ümber maetud möödunud aastal ja nüüd lahkuvad legendaarsest lahingupaigast nüüd viimasedki metsavennad, kes saavad maetud austusavalduste saatel, mis neil kunagi on saamata jäänud.	34
est	-1	Praegu oleks õige aeg Putinil tankidega tulla ja Värska tiblad sellest rõhuvast koormast ''vabastada''.	17
est	-1	«Meie süsteemid ei ole nii head kui teistes maades, sest me hakkasime nende asjadega varem tegelema. ID-kaarti tehtaks tänapäeval teistmoodi.»	25
est	-1	Kiievis kogunes Iseseisvuse väljaku lähistele kümneid tuhandeid inimesi, kes avaldasid protesti valitsuse otsuse vastu loobuda integreerumisest Euroopa Liiduga.	20
est	-1	Mullu kevadel Viljandimaal taksojuhi mõrvanud ja selle eest karmi karistuse saanud Viktor Kabanovi ja Andrei Karanetsi süüdimõistmine jõustus lõplikult, kuna riigikohus ei võtnud reedel nende kaitsjate kassatsioonkaebuseid menetlusse.	30
est	-1	Siis jääbki üle ka lahkuda mitte soovivatel noortel ja aktiivsetel tegeleda näiteks ettevõtlusega, mille edu puhul kiiresti nähakse, et suured turud on välismaal, või saada spetsialistiks ja avastada, et laias maailmas on rohkem võimalusi.	39
est	-1	Nii jõuamegi jalgratturi elu kaootilisuseni. Kui autojuhil üldiselt ei teki Tallinnas küsimust, et kas ikka pääseb mingilt teelt autoga läbi, siis jalgratturil tekib selline küsimus pidevalt.	30
est	-1	Lepp rääkis, et masuaegsetest ja –järgsetest palgakärbetest on üle saadud ja palgad grupi ettevõtetes on samal tasemel, mis nad oli enne kärpeid. «Nihutame neid nüüd ülespoole,» sõnas ta. «Üldiselt on palkadega lihtne – kui on surve palgatõusule, siis oledki fakti ees, et kas maksad juurde või inimene läheb ära,» rääkis ta. Lepp lisas, et Maagis üritatakse häid töötajaid ka palgaga kinni hoida, vahel see õnnestub, vahel aga mitte. «Olle (Olle Horm, Maag Lihatööstuse endine juht, kes augusti keskpaigast töötab Atria Balticu tegevjuhina – toim) osteti meilt üle, oli väga kahju, aga midagi polnud teha,» lisas ta.	123
est	-1	Aeg-ajalt sõidab nende auto Raekoja platsilt läbi ja siis kaob kuhugi ... arvatavasti siis jalgrattureid varitsema? No tulgu taevas appi! Ja tulgu veel kord appi.	28
est	-1	Endine USA president Bill Clinton pidas kaasdemokraadi Obama eest kampaaniat ning võttis sõna tema rivaali, vabariiklaste kandidaadi Mitt Romney vastu.	22
est	-1	piilu ja salakaamerad,täiskohaga lapsehoidjad.	7
est	-1	Esmaspäeva õhtul puhkes tulekahju Haapsalus raudteemuuseumis seisvas vagunis, tulele pandi kiiresti piir, kuid vagun sai märkimisväärseid kahjustusi.	20
est	-1	Õppetöö Ida-Virumaale viimise korral on mõju akadeemiasse astuda valdavalt tõrjuv. Praegustest kadettidest koguni ¾ leiab, et nad ei oleks soovinud õppima tulla, kui kõrgkool oleks paiknenud Ida-Virumaal. Eriti asukohatundlik sihtgrupp on magistrandid, kes on valdavalt juba vähemobiilsed töö- ja pereinimesed. Et SKA on mitme rahvusvahelise organisatsiooni, sh Euroopa Politseikolledži, ELi välispiiride kaitse agentuuri FRONTEX ja Euroopa rändevõrgustiku koolitus- ja arenduspartner Eestis, on vajalik lähedus rahvusvahelistele transpordisõlmedele. Sama argumenti kasutasime ELi IT-agentuuri Tallinna toomise eelisena.	85
est	-1	Linnateater imetles ainult ennast.	5
est	-1	Lõpuks pean aga tunnistama, et pea suvaline kontsert on natuke parem kui plaadikuulamine. Kas see peab lõpuni paika ka Nokias kitsas ja hapnikuvaeses saalis, pole juba Alice Cooperi probleem.	33
est	-1	Forbesil on õigus. Just nimelt Twitteris. Ei mujal.	11
est	-1	Tapeti ka Yavuzi elukaaslane Bill Langdon. Türgi ajalehe Hürriyet andmeil kohtus paar Nairobis ja oli Kenya pealinna naasnud hiljuti, nad valmistusid oma esiklapse sünniks.	27
est	-1	Mis küll juhtub, kui kiriku liikmeskond väheneb? Viimastel päevadel räägivad ja kirjutavad sellest isegi need inimesed, kes pole mulle varem erilise usulise hardusega silma jäänud. Üks tont on moraalne allakäik. Et kui pole pidepunkte käsulaudadelt, võtab võimust arvamus, et ükski moraalireegel (näiteks «ära varasta») pole parem isegi täiesti vastupidisest seisukohast ning niisugune lõtv hoiak viib lõpuks ühiskonna lagunemiseni. Puruneb jutlustajate vaevaga loodud kaitsekiht ning igaühest saab metsik enesekeskne olend, kes astub sõtta kõikide vastu.	88
est	-1	Võib olla küll ihaldusväärseim tööandja, kuid kontor on küll üks paras mess. Selline avatud kontor on paras peavalu ja pead-jalad koos töötades on tulemused halvemad kui oleks vähemalt vaheseintega eraldatud. Tööandjale on selline moodus küll odav ja lihtne, kuid töötajatele ja nende töötulemustele mõjuks väike eraldatus palju paremini.	53
est	-1	Mick Jaggeri pruudid on end varemgi meeleheitest tappa tahtnud	9
est	-1	Aga miks, MIKS on vaja rongis kõva häälega telefoni röökida? Ei suuda paari tundigi suhtlemata olla?	19
est	-1	"""Vanaema karistas mind lapsepõlves sellega, et pani mu pimedasse vetsu kinni,"" meenutas Hardi Volmer telesaates ""Laula mu laulu"" oma foobia tekkimist, millest ta pole siiani üle saanud. "	35
est	-1	Nagu igal aastal, kogunesid rünnakutes hukkunud ligi 3000 inimese lähedased New Yorki Maailma Kaubanduskeskuse kaksiktornide asukohta ehk nn Ground Zero juurde ja lugesid ette kõigi hukkunute nimed.	29
est	-1	Arvad et kui Saksamaal türklased märatsevad, et siis seal on kohalikud pollad?? Ole ikka Blond küll	19
est	-1	Mina ei pea teda ennast eriti nutikaks....mis ma selle infoga nüüd pihta hakkan? Keda huvitab, mida ekspeaminister peab nutikaks ja mida mitte?	27
est	-1	krt küll vaene laps kes sündis, talle hakatakse väikesest peale juba õiguspoliitikat peale suruma... kindel on et mingi aeg viskab see üle ja temast saab hoopis pätt...	30
est	-1	Selles saates või siis reklaamis tundub küll, et tädi oli seni vaid sealaudas elanud ja nüüd pääses järsku sealt välja. Sellisel juhul on reaktsioon ilmselt ka täiesti mõistetav.	31
est	-1	Robert kirjutab, et ta jäi ellu, kuna otsustas triikida särki, millest sai nüüd tema õnnesärk. Seetõttu ei olnud ta poes tragöödia juhtumise ajal, vaid jõudis sinna mõni hetk hiljem. Ta lähenes peasissekäigule ajal, mil suur otsasein kokku varises. Ta tunnistab, et ei mõistnud juhtunut koheselt. See, mis järgnes, oli eelmisest veegi hullem. See vaikus oli täiesti kohutav.	71
est	-1	Võimas E-riik oma E-Rongiga. Nad ei suuda piletimüüjate koormuse vähendamiseks isegi piletimüügiautomaate suurematesse jaamadesse paigaldada. Online süsteemid igalpool mujal, aga meie liigume tagurpidi. Papist pilet võiks olla kuhu teed mulgustajaga augu sisse.	37
est	-1	jutt oli kaaskodanike häirimisest, kui sellest veel aru ei saanud.	12
est	-1	Sel hooajal Mengel rohkem ei võistle. Vigastuse tõttu tuleb tal vahele jätta 9. mail algavad Euroopa meistrivõistlused ning ära jäi ka võimalus kaitsta mullust tiitlit Põhjamaade meistrivõistlustel. Kuna suvi on Mengeli treeningplaanides alati hooajaväline aeg, mil ta tegeleb rohkem üldfüüsilise ettevalmistusega, siis praegune olukord ei sea suvistele treeningplaanidele erilisi piiranguid. Küll aga jäävad teatavad piirangud söömisharjumustesse. Lõualiigeste liikuvus on veel piiratud ning süüa tohib ainult pehmet toitu. Šašlõki söömisega tuleb oodata jaanipäevani.	80
est	-1	Iga riigi puhul vaadeldi kodanike takistusi internetile ligipääsemisel, piiranguid seal leiduvale sisule ja muude kasutajaõiguste rikkumisi, näiteks blogijate vahistamisi, makstud poliitkommentaatorite olemasolu või rünnakuid teisitimõtlejate vastu.	30
est	-1	Ah et kõiges on süüdi ikka see tasuta sõit? Et kui seda poleks, siis poleks joodikuid ka? Huvitav, kui lihtsalt saab ühe valusa probleemi lahendada. Miks küll keegi varem pole selle peale tulnud?	39
est	-1	Samaaegselt vahistati Hispaanias Eesti kodanik, kes kahtlustuse järgi on skeemi eest Hispaanias vastutav isik.	16
est	-1	Kas torud on vähemalt silla peale rihitud? KUi seda pole ja esimesena ei lasta, siis pol emitte millelgi mõtet... Jahuge edasi.	25
est	-1	Alustatud paarikümnest kriminaalasjast on 10 seotud kalapüügiseaduse ja kuus metsaseaduse nõuete rikkumisega. Kaks kriminaalmenetlust on alustatud seoses välisõhuprobleemidega ja kaks kaevandamisega.	23
est	-1	VAU!!! Milline mitte midagi ütlev galerii :D	11
est	-1	Kui lipakat tahate näha siis vaadake Kardashiane :D	9
est	-1	"Lindsay, kes on viibinud võõrutusravil kuuel korral, sattus eilses ""Lindsay"" episoodis vastasseisu oma kainusvalvuri AJ Johnsoniga, vahendab Female First."	25
est	-1	Püütakse siin partei sisedemokraatiat näidelda. Et lausa erinevad arvamused on Rõivasel ja Ansipil?	15
est	-1	ütlen et ära virise.......	5
est	-1	Samuti avastati suur kogus pudelietikette, korke, tühje pudeleid ja erineva suurusega tühje kanistreid. Viina margi järgi otsustades oli kaup mõeldud Soome illegaalsele turule.	27
est	-1	Kiirabiteenistuse juht Armand Plorinsh kinnitas, et hukkunute seas lapsi ei ole. Tragöödias sai viga ainult üks laps, kelleks on 5-aastane poiss, kes sai peatrauma ja lebab nüüd lastehaiglas.	33
est	-1	Oma laps pole kunagi liigselt kaitstud. Selliseid juhtumeid olnud varemgi hulgi.	13
est	-1	Sel hooajal Mengel rohkem ei võistle. Vigastuse tõttu tuleb tal vahele jätta 9. mail algavad Euroopa meistrivõistlused ning ära jäi ka võimalus kaitsta mullust tiitlit Põhjamaade meistrivõistlustel. Kuna suvi on Mengeli treeningplaanides alati hooajaväline aeg, mil ta tegeleb rohkem üldfüüsilise ettevalmistusega, siis praegune olukord ei sea suvistele treeningplaanidele erilisi piiranguid. Küll aga jäävad teatavad piirangud söömisharjumustesse. Lõualiigeste liikuvus on veel piiratud ning süüa tohib ainult pehmet toitu. Šašlõki söömisega tuleb oodata jaanipäevani.	80
est	-1	JA LUGU POLE KA MIDAGI LÄHEB ÜHEST KÕRVAST SISSE JA TEISEST VÄLJA.... NULL EMOTSIOONI	15
est	-1	Kolmapäeval maksti linnakassast ettevõtluse arendamise sihtasutusele (EAS) tagasi 47 578 eurot juba saadud toetust,  peale selle jääb linnal saamata 59 273 eurot, mida polnud EAS veel Haapsalule üle kandnud, kirjutab Lääne Elu.	38
est	-1	Meil eesstis on palju poissmehi.. aga meie naistele nad ei kõlba...vaja on siit minema joosta inglismaale ja mujale.	22
est	-1	Kas Rakvere raamatukogus tegutseb tõesti pervert?	7
est	-1	ja suure armastuse märgiks lähed pärkusse oma ihasid rahuldama.Jälkus.Aga hea,et kapist välja tulid,nüüd on teda kellest lapsi eemale hoida.	24
est	-1	Mis küll juhtub, kui kiriku liikmeskond väheneb? Viimastel päevadel räägivad ja kirjutavad sellest isegi need inimesed, kes pole mulle varem erilise usulise hardusega silma jäänud. Üks tont on moraalne allakäik. Et kui pole pidepunkte käsulaudadelt, võtab võimust arvamus, et ükski moraalireegel (näiteks «ära varasta») pole parem isegi täiesti vastupidisest seisukohast ning niisugune lõtv hoiak viib lõpuks ühiskonna lagunemiseni. Puruneb jutlustajate vaevaga loodud kaitsekiht ning igaühest saab metsik enesekeskne olend, kes astub sõtta kõikide vastu.	88
est	-1	No näe sõnum jõudis kohale.Seakisa hakkas kohe pihta.	9
est	-1	Tartu Ülikooli emeriitprofessori Tiit-Rein Viitso rõhutab, et sõna 'maismaapiir' tohivad ka juristid ning riigikogu kasutada ainuüksi maismaal paiknevat piiri silmas pidades, mitte selle tähendust moonutades.	29
est	-1	Ma ei tahaks kuidagi parastada inimesi, kelle isiklik elu pole kulgenud kõige roosilisemat rada. Aga kui Silvi ja teised üksildased juhataks õnneni feissbuk, siis paluks neil kõigil lahkesti sinna minna. Kas või igal õhtul kolmeks tunniks või kauemakski.	43
est	-1	Knaacki sõnul vahejuhtum, mis leidis aset tiigrite avaliku toitmise ajal, pealtvaatajatele ohtu ei kujutanud, kuid loomaaed suleti pärast seda.	23
est	-1	Mick Jaggeri pruudid on end varemgi meeleheitest tappa tahtnud	9
est	-1	Esialgsete andmete kohaselt toimus jalakäija surmaga lõppenud otsasõit töötava foorisignalisatsiooniga varustatud raudteeülesõidukohal Tallinn-Tartu kiirliini rongiga. Tehnilise Järelevalve Ametile teadaolevalt rongireisijad ning veeremijuht vigastada ei saanud. Samuti ei esinenud veeremil sõidu jätkamist keelavaid vigastusi.	36
est	-1	Siiski jäi Worrel vähemusse ning suurem osa ujujatest ja võistluse korraldajatest ei tahtnud Armstrongi võistlemas näha.	17
est	-1	See info andis prokuratuuri teatel metsaveofirmadele võimaluse raskeveokite marsruuti muuta, et vältida kontrollijatega kokkusattumist. Kriminaalmenetlusele viidates ei avalda politsei statistikat, kas tänavu suvel vähenes ülekaaluliste veokite tabamise hulk.	32
est	-1	Haiged kommijad , no tõesti millegiks rohkemaks teie mõistus vist mõtlema ei anna, sest kõrvu hoiab kummipael pea küljes, ülejäänu on tühjus, mis kolu sees.	29
est	-1	On olemas kaks võimalust, kas see tegevus on lubatud või keelatud, mingit kolmandat võimalust mina ei näe, seda et hakataks näo ja käitumise järgi otsustama, kes võib tarbida ja kes mitte. Ei sure ka see pulmapeolt tulnud noormees sinna rongi ära, kui seal siidrit lakkuda ei saa, selline oht võiks ainult mingit rasket alkohoolikut ohustada.	63
est	-1	Kas ta on nende kõigiga nikkund ka või	8
est	-1	Vigastada sai jalgratast juhtinud 16-aastane noormees, kes toimetati Põhja-Eesti regionaalhaiglasse. Politsei palub kõigil, kes liiklusõnnetust pealt nägid, võtta ühendust  politsei lühinumbril 110.	27
est	-1	Koloneli sõnul oli see esimene kord, kui politseinikud näevad narkomuulana kasutatavat last.	14
est	-1	Tallinn on vastu võtnud dokumendi «Tallinna huvihariduse võrgu arengukava 2007–2017», kus kirjas, et loodus- ja tehnikahuviharidusega on Tallinnas ajaloolistel põhjustel halvasti, aga 2008–2009 oli plaanis eraldada pea 5,5 miljonit krooni uute huvihariduse valdkondade arendamiseks ning keskkonna-, loodus- ja tehnikavaldkonna eelisarendamiseks. Võimalik, et selle tegevuse tulemus ei kajastu Postimehe vahelehes avaldatus, aga tundub, et plaan ei ole väga edukas olnud.	70
est	-1	TV3: raudteemuuseumis toimunud vagunipõlengus kahtlustatakse süütamist	7
est	-1	Kiirabiteenistuse juht Armand Plorinsh kinnitas, et hukkunute seas lapsi ei ole. Tragöödias sai viga ainult üks laps, kelleks on 5-aastane poiss, kes sai peatrauma ja lebab nüüd lastehaiglas.	33
est	-1	Juulis uppus Eestis kümme inimest, ülejäänud kuudel on uppunute arv olnud oluliselt väiksem. Mais uppus seitse, juunis viis, septembris viis, jaanuaris kaks, veebruaris kaks, märtsis üks ja aprillis samuti üks inimene.	39
est	-1	mis Te nüüd tühjast paanikat teete, kui ei ole kasvatamiseks aega siis saab ju eestis lapse lastekodusse anda, kasvõi otse sünnitusmajast või siis veidi hiljem, kui ema parasjagu huvitava töö leiab.	35
est	-1	Kell 20.20 said korrakaitsjad teate, et Tartu maanteel asuvas söögikohas ähvardasid joobes kliendid  kaasavõetud süütevedeliku abil tulekahju tekitada. Kahtlustatavatena viidi politseijaoskonda 34- ja 35-aastane mees.	28
est	-1	ära kilka avalikult ja ongi rahu majas, ega sa nüüd nii kõvasti ka huvi paku	16
est	-1	Loosungi saab keerata ka teistpidi: kui valitsuse tulud ei tule kodanikelt, vaid näiteks naftamüügist, välisabist või väga kitsalt ringilt, tekkib loomulik kiusatus öelda, et teil, niinimetatud kodanikud, pole ka tulude jaotamise juures sõnaõigust. Valitsusest saab üleolev kingituste jagaja, rahvast tegusate otsustajate asemel almuseid ootav mass: näpuotsaga tsirkust ja leiba teile, võim ja luksus meile. Naftariik Norra on küll vastupidine eeskuju, aga palun tooge näiteid Norra järgijatest!	80
est	-1	Eile avalikustatud rahvastikuregistri andmed annavad taas põhjust muretsemiseks. 2012. aastal on Eestist väljarändamine võrreldes aasta varasemaga peaaegu kahekordistunud. Tõsi, samal ajal kasvas ka Eestisse tagasipöördujate arv, aga negatiivne saldo ikkagi üle 6000 inimese, rohkem kui ühelgi teisel aastal viimase kümnendi jooksul.	47
est	-1	Eelnevast järeldub, et väikeriigi eesmärgiks peaks olema selline kaitsevõime, mis paneb potentsiaalse «suure ümberkujundaja» mõtlema, ega seesinane riigike ei kujune liivateraks hammasrataste vahel. Ei maksa arvata, et suurvõim ründab paljusid korraga, tegemata väikeriikidele seda au, et isegi rünnates neid kuigivõrd märgata. Võibolla mingil mikroskoopilisel määral kehtis see nii keiserliku kui natsliku Saksamaa puhul, kuid kindlasti mitte Venemaa puhul, kes seal ka võimul poleks.	76
est	-1	Iraani välisminister Javad Zarif hoiatas varem päeval, et tuumakõnelused maailma juhtriikidega on jõudnud kriitilisse etappi ning Teheran ei kavatse alluda «ülemäärastele nõudmistele». Suurbritannia, Hiina, Prantsusmaa, Venemaa ja USA ning Saksamaa välisministri saabumine Genfi «näitab kõneluste tõsidust», lisas ta.	49
est	-1	Sellise soovituse järgi peaks Vigala Sass juba ammu vähist terve olema.	12
est	-1	Kui probleemiks on igavus, soovitan raamatut või ajakirja. See, kui inimene tarbib alkoholi üksinda ja igavuse peletamiseks, viitab probleemile.	24
est	-1	elu siin eestis ei ole nii roosiline kus majanduskriisis pere peab arvestama kuidas saab kõik maksud maksta et söögiks raha ka jaks majandus olukorrad nõuab mõnikord suured muutused olen laste lastega ja laste ema töötab valismaal isa kes arvab et ta ei pea toetama oma lapsi elab oma elu aga no ja ma näin kui suur pudus tunnevad lapsed oma emas noorem tüdruk vittis albumis pilti ja pani patjapele et saks ette kujutada et emme on kõrval pisar tuleb silmis .	81
est	-1	Lilled eesti rahva hauale.	5
est	-1	Veerandtunni jooksul, mil suutsin end sundida seda õudust kuulama (aga saatekava järgi oli kolmetunnine sünnitis alles poole peal), hakkasin küllap kõrvust ja näost punetama nagu moosivarguselt tabatud marakratt.	33
est	-1	Eelnevast järeldub, et väikeriigi eesmärgiks peaks olema selline kaitsevõime, mis paneb potentsiaalse «suure ümberkujundaja» mõtlema, ega seesinane riigike ei kujune liivateraks hammasrataste vahel. Ei maksa arvata, et suurvõim ründab paljusid korraga, tegemata väikeriikidele seda au, et isegi rünnates neid kuigivõrd märgata. Võibolla mingil mikroskoopilisel määral kehtis see nii keiserliku kui natsliku Saksamaa puhul, kuid kindlasti mitte Venemaa puhul, kes seal ka võimul poleks.	76
est	-1	«Kahtlustatavad kogusid andmeid politseinike liikumissuuna, asukoha ja tegemiste kohta ning edastasid neid isikule, kes omakorda levitas saadud infot metsavedudega tegelevatele äriühingutele,» vahendas politsei pressiesindaja prokuratuuri uurimisandmeid.	32
est	-1	Eelnevast järeldub, et väikeriigi eesmärgiks peaks olema selline kaitsevõime, mis paneb potentsiaalse «suure ümberkujundaja» mõtlema, ega seesinane riigike ei kujune liivateraks hammasrataste vahel. Ei maksa arvata, et suurvõim ründab paljusid korraga, tegemata väikeriikidele seda au, et isegi rünnates neid kuigivõrd märgata. Võibolla mingil mikroskoopilisel määral kehtis see nii keiserliku kui natsliku Saksamaa puhul, kuid kindlasti mitte Venemaa puhul, kes seal ka võimul poleks.	76
est	-1	Mulle tundub, et käes on ajajärk, kus meie traditsioonilised žanrimääratlused enam ei kehti. Keegi peaks midagi uut välja mõtlema. Ma ise tajun instinktiivselt, et niipea kui ma žanrikeskselt mõtlema hakkan, muutun ma igavaks, asi läheb rappa. Tuleb mõtelda loost, mitte žanrist. Võtame või vennad Coenid, kes mulle väga meeldivad – mis see nende žanr on?	67
est	-1	"Hetkel, mil meespeaosa Oscari võitja välja kuulutati, nägi kogu maailm DiCapriot, kes teleekraanil pisaraid vaevu tagasi hoidis. Kohe täitus ka kogu maailma sotsiaalmeedia DiCapriole kaasatundvate hüüatustega: ""Vaene Leo!"""	36
est	-1	Arhitekt Emil Urbel märkis, et juurdeehitise näol on tegemist suurima puithoonega, mis viimastel aastatel Eestis kerkinud.	19
est	-1	Arhitekt Emil Urbel märkis, et juurdeehitise näol on tegemist suurima puithoonega, mis viimastel aastatel Eestis kerkinud.	19
est	-1	Väga palju rõhutakse tänapäeval statistikale, kuid kas see peegeldab ikka tegelikku olukorda? Toon näite. Ühe suure teadusorganisatsiooni äärmiselt tuumakad tulemused avaldatakse ka uurimisraportitena. Thomson Reutersi andmebaasis kajastuvad need aga niimoodi, et autoriteks on kõik, kes seal asutuses töötavad, kaks-kolm tuhat inimest.	49
est	-1	Aga nagu öeldakse: inimene mõtleb ja arvestab, jumal juhib. Jumal juhtis seekord niimoodi, et Eestist Venemaale pääsu pidime ootama kokku ligi kaheksa tundi. Kõik olekski ehk korras olnud, kui jumalateks poleks end pidanud ASi Transservis-N töötajad, kelle käes vägi ja võim vajutada nuppu, mis lubab ootavatel autodel sõita piirijärjekorda. Omaette teema on see, et enesestmõistetavalt käratavad nii putkajuht kui vahetult piiril korda pidav ametnik ootajaid nõudlikult vene keeles oma kohale, teatades, et eesti keeles nad ei kõnele.	90
est	-1	"Madis Kalmet: ""Ka teatripäeval peaks olema kriitiline, ei saa ju hüüda ainult halleluuja."""	18
est	-1	Mupo teavitab, et taksopiraatide vastu ei aita üksi politsei poolne kontroll ja trahvimine, ka tavakodanik peab loobuma ebaseaduslikult pakutavast taksosõidust. Enne taksoteenuse kasutamist tuleb kontrollida, kas sõidukil on kõik taksotunnused - plafoon kirjega «Takso», hinnakirjad parempoolse tagaukse aknaklaasil ja armatuurlaual paremal pool ning printeriga ühendatud taksomeeter esipaneelil. See on kindel tunnus, et tegemist on seadusliku teenuse pakkujaga.	67
est	-1	Neljandaks pannakse kohalikele omavalitsustele ja koolidirektoritele õigusaktidega kohustused, mille täitmiseks ei eraldata piisavalt raha. Nii on see praeguseks juhtunud näiteks riigi lubatud tasuta koolitoiduga põhikooliõpilastele – riik toetab koolilõuna maksumust vaid osaliselt, puuduva osa peab aga leidma KOV.	42
est	-1	eiei, mis te jamate, kuuuurija ütles, et nüüd on kõik parem:)	16
