lang	sentiment	text	num_tokens
est	1	Legendi kohaselt oli Jaapani esimene keiser otsene päikesejumala järglane, kelle järeltulijad järkjärgult said inimesteks. Kõige paremad sumomaadlejad aga liiguvad vastupidises suunas. Inimesest jumalaks.	27
est	1	Üks vahvamaid aineid, mille üle meilgi tasuks mõelda, on aga töökasvatus – työelämän harjoittelu. See on sõna otseses mõttes päris töö tegemise harjutamine. Iga laps otsib ise töökoha ja töötab seal nädal aega, kuus tundi päevas. Kui ta on väga tubli, võidakse talle ka tasu maksta, aga tavaliselt raha selle tööharjutuse juurde ei käi. Kes käib lasteaias abikasvatajaks, kes poes, restoranis või ka haiglas. Igatahes saab õpilane nii maitse suhu, mida päevast päeva lihtsa töö tegemine tähendab. Kõige enam õpetavat see seda, mida tähendavad töötamine meeskonnas ja lugupidav suhtlemine. Seda on ju kõigil vaja.	111
est	1	Kavandatav kaitseala paikneb lennuvälja tagumises osas, ruleerimisraja ja Hiinalinna vahel. Kuigi Tartu vallal oli alale tehtud detailplaneering, kavandatud teedevõrk ja infrastruktuur, oli vallavalitsus valmis vastavalt vajadusele plaane muutma. See on heas kooskõlas ka valmiva muuseumihoonega.	41
est	1	Sama lugu on 65-aastase Alice Cooperiga. Omaaegne õudustekuningas ja tema show näevad praegu välja päris naljakad. Kahjuks jagati seda nalja Tallinnas vaid näpuotsaga, kuid hiiglasliku Frankensteini ilmumine lavale tekitas minus isiklikult pea hüsteerilise naerupurske. Midagi nii armsat ja toredat pole muusikamaailmas juba ammu kohanud. Parim ebakuju, keda nähtud ja kes lisaks oma kentsakale välimusele suutis hämmastavalt täpselt imiteerida Alice’i kehakeelt.	69
est	1	Evelini sõnul on Oskar tõeline filosoof, kes tahab iga päeva aina rohkem maailma asjadest teada. Poja lemmikraamatud vahetuvat kogu aeg.	23
est	1	Kui me teaksime, kui – heas mõttes – vähe teised (ka elevant) meie vastu huvi tunnevad, siis me ei muretseks nii palju, arvab kirjanik Mihkel Mutt.	32
est	1	Vahel tundub, et me ikka veel ei hooma, mida ette võtta endise lennuvälja üüratult suure alaga. Paarkümmend aastat tagasi loodeti ala võtta uuesti lennuväljana kasutusele. Õnneks jäi see mõte soiku.	35
est	1	Teine variant on jätkamine. Ilmselt ei ole see uus mõte, et Estonian Airi jätkusuutlikkuse tagamiseks on vajalik praeguse omaniku – riigi – rahaline toetus. Eelduseks on usaldus juhtkonna ja firma kui terviku vastu. Välistada ei saa juhtkonna vahetust. Uus juht ei pea olema lennunduse kogemustega, hea juht oskab vaadata kliendikeskselt, olles ise palju reisinud.	62
est	1	Nüüd on prantsuse Lolita tagasi ja esitleb Twitteris uhkelt ajakirja Jalouse fotosid, kirjutab Today.com. Thylane näeb märksa tagasihoidlikum välja kui paar aastat tagasi. Meik on minimaalne, juuksed hobusesabas ja rõivad lihtsamad. Äsja täitus tal 13 eluaastat. Ent kas pole ta ikkagi modellitööks liiga noor, küsib USA veebikülg.	55
est	1	"""Inimene peab ju midagi õppima, ta peab enne surma inimeseks saama. See ongi niimoodi, et noorena paned pea tulle, nüüd enam mitte."""	29
est	1	«Pakkumine tehti meile eelmisel suvel. Tantsuinimesed olid juba ühe Pantokraatori loo, «Linnamäng», peale tantsu ära teinud. Ja tantsupeo muusikaline juht Toomas Lunge tuli minu juurde küsimusega, kas mul oleks võimalik teha nullist veel üks lugu,» räägib Sakkov. «Teemaks see, et poiss läheb linna, saab palju raha, aga lõpuks selgub, et raha ei olegi kõigi asjade vastus. Tegin mingi jupikese, seda kuulati, arutati omavahel ja lasti ümber teha. Neil oli vaja pikka sissejuhatust, kus tantsijad kogunevad, ning pikkus pidi jääma kolme minuti kanti,» seletab Sakkov, kuidas sündis spetsiaalselt tantsupeoks «Rahalaul».	117
est	1	Me koristame üle nädala ning jagame korteri pere peale ära: laps koristab oma toa, mina köögi, kabineti ja sauna, naine magamistoa, elutoa ja muud väiksemad ruumid. Vaibad klopin ka mina. Pole 12 kooselatud aasta jooksul kunagi olnud mingit vaidlust või porinat selles osas.	51
est	1	Mary on tuntud laitmatu stiilitunde poolest, mis on tõstnud ta ajakirja Vanity Fair stiilseimate edetabelisse.	17
est	1	23-aastasel Jacksonil on seljataga korralik ülikoolikarjäär, ent ka vigastusest tingitud pikk mängupaus. Seni ainsa ühise pallitreeningu põhjal on Sõbral temast hea mulje – tegemist on kõva viskajaga. Makševi meeskonda jäämine on küsitav, ent talle antakse veel nädala lõpus kontrollmängudes võimalus. Samal ajal on Sõbral olnud agendiga juttu ka ühest serblasest tagamehest.   	57
est	1	Pulga vanas rehetoas võis igaüks endale valmistada kadrimaski, millega õhtul oma kodutänavas kadrisanditama minna. Igaüks, kel mask valmis, sai minna koos väljaõppinud kadrisantidega Köstriaseme tallu katri jooksma.	32
est	1	Räpina publikule tegi palju nalja kohaliku eluolu naljaks keeramine. Naerma pani ka Oja oskus rakendada näitlejameisterlikkus kodanikuseisukoha väljendamise vankri ette. Moran seevastu liikus Tartus laval vähe ning rõhus loomulikule pajatajasoonele.	33
est	1	Mitmed analüütikud usuvad, et Angela Merkeli tagasivalimine kolmandaks ametiajaks Saksamaa liidukantsleriks on hea uudis ka Venemaale.	18
est	1	Koos Lätiga on siin Põhja-Euroopas kujunenud oma katkematu mini-euroala Soome, Eesti ja Läti näol. Järgmine ühineja peaks olema Leedu aasta pärast. Loodame, et kui Rail Baltic eestlasi ükskord Berliini poole hakkab sõidutama, saab Poolatki läbides restoranvagunis juba zlotihindu lugemata hakkama.	46
est	1	Kõik muu on aga vaid eelmäng või järellainetus Moskva MMile. Kuigi Moskva on Eestile lähedal, plaanib Kanter enne tiitlivõistlust seal kümmekond päeva treenida ja oludega kohaneda ning seejärel kõige kõrgemasse mängu sekkuda.	35
est	1	Direktor lisas, et struktuurimuudatuste kaugem eesmärk on pakkuda nii Tartu kui ka kogu Lõuna-Eesti kunstipublikule senisest köitvamat muuseumi.	20
est	1	Kaido oli Eestis lihtsurelik, Jaapanis sai temast justkui Kurrunurruvuti saare hiiglaslik valgenahaline Eefraim Pikksukk ehk pooljumalus.	18
est	1	Tartu Ülikooli rektor Volli Kalm rääkis, et nende suuremate, selgema visiooni ja pikema arenguplaaniga allüksuste juhtimine saab olla stabiilsem ka finantsilises mõttes, ka võimaldab valdkonnapõhine koondumine likvideerida dubleerimist nii üksikutes õppekavades, õpetatavates ainetes kui ka õppekavades endis.	42
est	1	Praktilised kodundusoskused	2
est	1	"""Sealt on lugemine-arvutamine väga hästi külge hakanud. Teeme kodus kooliülesandeid ka,"" kirjeldab Dagmar ettevalmistusi 1. septembriks. Laulja kiidab eelkooli lihtsaid ja lapsesõbralikke meetodeid."	29
est	1	Mais avatav Viimsi kino on üks osa rajatavast avastamis- ja mängukeskusest, mis on ühendatud meelelahutus-, vabaaja- ning spaa- ja veemaailmaga.	23
est	1	Nobeli preemia on sel aastal Frankfurdi raamatumessil kindel kõneaine kõigi nende kirjandusinimeste jaoks, kelle tegevus vähegi kuidagi PENiga seotud. Olgu siinkohal öeldud, et PEN (Poets, Essaysts, Novelists) on maailma suurim kirjanikke ühendav organisatsioon, millel on üle 140 keskuse enam kui sajas riigis.	51
est	1	Ehk oleks mõistlik järgida siin vana rahvatarkust, mille kohaselt tark ei torma? Saame aru, et palgatõus eeldab muudatusi koolide töökorralduses, kuid neid ei tohiks teha kiirustades. On ju võimalik lahendada olukord kahes etapis: esimeses järgus teha ära need muudatused, mis puudutavad õpetajate palgatõusu, ja pärast põhjalikumat arutelu ka need, mis puudutavad koolikorraldust laiemalt.	63
est	1	Ootasin mingisugust selgust, praktilist väärtust, mida õppida. Et mulle õpetataks oskusi, kuidas näitlejana toime tulla. Ma ei tahtnud mingit vaimu­udu ja aeroobikat ja ...	29
est	1	«Me mõistame üksteist hästi ja tekitame ründes hea duo. Kui saame omavahelise suhtluse ja liikumised paika, siis on meie vastu raske mängida,» selgitas Ojamaa. «See, kui palju Michael on väravaid löönud, on suurepärane ja meeskonna jaoks ülioluline. Mul on tema üle hea meel. Olen talle palju väravasööte jaganud, kuid viimane kord andis tema aga minu väravale söödu. Olen oma hooajaga väga rahul ja tunnen, et olen võrreldes eelmise aastaga sammu edasi teinud.»	88
est	1	Eesti võrkpalluritele toetuv Rennes’i Volley lõhkas Prantsusmaa meistrivõistlustel üllatuspommi, alistades esimeses veerandfinaalmängus suursoosiku Tours VB 3:2.	20
est	1	Kehtib reegel: kord sumomaadleja, igavesti sumomaadleja. Sumo elustiili keskmeks on paljuski aupaklikkuse ning alandlikkuse väljendamine. Ka pärast sumokarjääri lõppu eeldatakse, et sumomaadleja jätkab tagasihoidlikku elu treeneri või sumoareenide valvuri/uksehoidjana ehk jätkaks oma edevusest vaba eluviisiga jaapanlike vooruste kehastamist. Baruto lõpetas oma intervjuu naeratusega – väljendades tagasihoidlikult lootust, et ta saab naasta oma armastatud kodumaale Eestisse ning elada lihtsat Eesti elu. Väga sumo!	71
est	1	Naisi oli 28 ja kaheksast riigist: USAst, Kanadast, Šveitsist, Inglismaalt, Saksamaalt, Venemaalt, Tansaaniast ja Eestist. Peale Kertu käis matkal veel kolm vaprat eestlannat.	32
est	1	Kettaheitevõistluse ajal leidis individuaalses arvestuses kolmanda koha saanud Londoni OM-hõbe Ehsan Hadadi aega ka jalgpalliga žonglöörimiseks. Mõningate oskuste näitamise järel jõudis tema juurde ka Piotr Malachowski, kellele Hadadi ka lahkelt palli söötis. Vaatamata vahepealsele kõrvalepõikele jõudsid mõlemad mehed ära teha kõik kuus katset kettaringis.	48
est	1	Inimesed, elage ise ja laske teistel ka elada!	10
est	1	"See on Tanja esimene muusikavideo. ""Mul polnud seni tõesti ühtegi videot,"" tunnistab ta."	18
est	1	"""Ma arvan, et see on Eesti ajaloos kõige kiiremini filmitud video. Olen kuulnud, et tavaliselt tehakse ikka pikalt ettevalmistusi ja filmitakse ka veel paar päeva. Meil läks ideest viimase lihvini kokku vaid viis päeva!"" naerab Eestit tänavu Eurovisioni lauluvõistlusel esindav Tanja Mihhailova, kelle laulu ""Amazing"" nüüd ka muusikavideona näeb."	60
est	1	“Suutsime konkreetset turniiriformaati arvestades valida optimaalse strateegia, mida muutsime meeskonna turniiripositsioonile vastavalt - pärast keskpärast algust võitlesime end agressiivse mänguga esikuuikusse ja viimases voorus läksime juba nii-öelda kindla peale oma positsiooni hoidma,” selgitas Reinaas, kelle sõnul olid Eesti koondise tugevusteks otsustavas turniirifaasis just meeskonnavaim ja ülidistsiplineeritud mäng.	53
est	1	Mais avatav Viimsi kino on üks osa rajatavast avastamis- ja mängukeskusest, mis on ühendatud meelelahutus-, vabaaja- ning spaa- ja veemaailmaga.	23
est	1	Muuseumi uus hoone valmib Raadil juba mõne aasta pärast. Koos sellega avaneb võimalus lõpuks ometi muuta piirkonna ja maastiku ilmet ning mainet kooskõlas kauni mõisapargi ja järvega. Kuigi suured alad on maetud betoonist lennuradade alla, on kunagise suletud lennujaama alalt leitud mitmeidki taimharuldusi, mille kaitseks on juba 2009. aastal tehtud ettepanek Raadi looduskaitseala moodustamiseks.	59
est	1	Läbirääkimistel peniga kulus kõvasti juustu	5
est	1	Naiste ühepaadil sai Pajusalu kolmandas eelsõidus ajaga 8.00,61 kolmanda koha ja pääses samuti poolfinaali. Eestlannat edestasid Tšehhi (7.41,53) ja Austria (7.47,32) sportlased.	28
est	1	"Just neid, nii küla kaastöötajaid kui elanikke, nimetab Ly oma töö juures kõige lahedamaks. ""Mitte kuskil mujal ei ole siiramaid inimesi, kes ütlevad nii head kui halvad asjad otse näkku. Mitte kuskil mujal pole nii suurt lustlikkust ja rõõmu igapäevaelu üle,"" lausub ta. Kõige parem õppetund, mis Ly on oma tööst saanud, pärinebki külaelanikelt. ""Alusta iga päeva nagu uut, keskendu tänasele. Ära kanna kaasas eilset, ära muretse homse pärast,"" sõnastab Ly selle ja muigab, et ta kipub vaatamata sellele muretsema."	100
est	1	Turun Sanomat: Eesti on huvitatud Soome miinilaeva ostust	9
est	1	"Paljud on täheldanud, et Mary sarnaneb välimuselt prints Williami kaasa Kate Middletoniga. Moekeiser Karl Lagerfeld on neid brünette kaunitare lausa kuninglikeks sõsarateks nimetanud. ""Kate on otsekui noorema õe eest Maryle, kes on ühtaegu kaunis ja elegantne,"" kiitis Chaneli moemaja juht."	48
est	1	Ta on maailma looduse fondi WWF juhatuse liige ning tiigrite kaitseks on näitleja annetanud kolm miljon dollarit.	18
est	1	Juuli lõpuks jõudis valitsussektori eelarvepositsioon tasakaalu lähedale - puudujääk kahanes pisut alla 0,2 protsendi SKPst.	16
est	1	Valimiste-eelne aeg on toonud pealinnale palju uusi tänavaid, munitsipaalobjekte ja muud äsja valminut. Sel nädalal on linnapea Edgar Savisaar viibimas kokku seitsmel avamisel.	26
est	1	"Vilniuse rahvusvaheline filmifestival toimus 20. märtsist 4. aprillini. Lisaks ""Free Range'ile"" osales festivalil veel kaks eesti filmi. Eesti-Gruusia koostööfilm ""Mandariinid"" (režissöör Zaza Urushadze, eesti tootja Allfilm, produtsent Ivo Felt) oli samuti valitud Baltic Gaze võistlusprogrammi ning Prantsusmaa ja Eesti koostöös valminud dokumentaalfilm ""Loits pimeduse peletamiseks"" (""A Spell to Ward Off the Darkness"", režissöörid Ben Rivers ja Ben Russell, eesti tootja MTÜ Must Käsi, produtsent Indrek Kasela) osales prgrammis Critics' Choice."	91
est	1	Soovitan lembitul otsida õige arst ja lapsed saavd lõpuks endale normaalse ema.	13
est	1	Lõpetuseks tuleb ikkagi kiita Rael Artelit ning Kaisa Eichet, kes eelmisel aastal elustasid hääbuva Tartu kunstikuu, tähti ümber paigutades moodustasid põneva nime, tõid veebruarist septembrisse ja organiseerisid kohale Marina Abramoviči, kes pärast Otto Dixi esinemist 1921. aasta Pallase näitusel oli teine maailmanimi Tartus. Noored on julged ja hakkajad – ja neil on lubatud ka eksida. Iseasi on 72 aasta vanuse Tartu kunstimuuseumiga.	69
est	1	"""Mina ja abikaasa ei survestanud Oskarit üldse, drilli ei teinud ja tundide viisi lapsega lugemis- ja arvutamisharjutuste taga ei istunud, kuna me ei tahtnud, et lapsel tekiks stress ja liigne pinge. Me lihtsalt usaldasime poja ettevalmistuse Vanalinna Hariduskolleegiumi õpetajatele, mille eelkoolis Oskar käis,"" tunnistab Evelin ja kiidab Nõmme munitsipaallasteaeda: ""Suure töö tegid ära Lauliku lasteaia kasvatajad, kus Oskar käib. Seal on tõesti väga head pedagoogid. Minu teada said tema lasteaiarühmast neli last kooli katsetega sisse – see on ju väga hea tulemus!"""	97
est	1	Kairi Kroon: tänukummardus diakooniahaiglale	5
est	1	Gregor Arbet juhtis tähelepanu, et edu saavutatu meeskondliku mänguga: «Andsime kokku 23 resultatiivset söötu – kõik jagasid palli, olid ühise asja eest väljas ja võitlesid kõik 40 minutit.»	34
est	1	Näitleja Mari-Liis Lille kõne «Mis on sellel pildil valesti?» ei öelnud uut, ent ma leian, et see ei olnudki tema peamine sõnum. Hoopis olulisem oli siirus ja julgus rääkida sellest, mis südamel. Ja see oli see, mis tegelikult pani tema kõne harvanähtava võimsusega resoneerima.	54
est	1	Nelja Hõbepalli seas Vassiljevi sõnul tal lemmikut ei ole ning seejuures peab ta kõiki võidetud auhindu väga olulisteks. «Enam-vähem pean ikka arvet,» muigas Vassiljev viimaste aastate auhindade kohta. «Iga järgmine auhind on väga tähtis, kuna vanus ju paigal ei püsi ja selliste auhindade järel saad aru, et oled veel vormis ja võid inimestele rõõmu pakkuda.»	65
est	1	"""Sealt on lugemine-arvutamine väga hästi külge hakanud. Teeme kodus kooliülesandeid ka,"" kirjeldab Dagmar ettevalmistusi 1. septembriks. Laulja kiidab eelkooli lihtsaid ja lapsesõbralikke meetodeid."	29
est	1	Keskerakond on vahemikus 2009-2014 saanud juurde 3215 liiget olles kokku 14 226 liikmega Eesti suurim. Keskerakonna peasekretäri Priit Toobali sõnul võib olla rahul, et Keskerakond suurima liikmeskonnaga on.	31
est	1	Meie mällu jääb Raudne Leedi siiski enamasti koos Ühendriikide presidendi Ronald Reaganiga kui külma sõja võitja, Nõukogude impeeriumi lammutaja ja meie kindel toetaja hiljemgi. Kümme aastat tagasi ilmunud raamatus «Statecraft» («Riigivalitsemiskunst») andis Thatcher soovituse võtta kolm Balti riiki NATO liikmeks: «Need arenenud, väga andekad ja üdini Euroopa rahvad näevad end osana läänest ja tahavad olla sellega tihedasti lõimitud. Venemaal ei ole õigust seista nende teel.»	79
est	1	Sealhulgas sotsiaalmaksu laekus eelmisest aastast 88,8 miljonit eurot, juriidilise isiku tulumaksu 59,1 miljonit eurot ja käibemaksu 48,7 miljonit eurot enam.	22
est	1	Kontsert oli suunatud ilmselgelt nooremale seltskonnale, kel Alice Cooperi loomingust vaid põgus ettekujutus legendide tasemel. Lõpus esitatud kolm klassikalist tükki, eriti finaaliks tulnud «School’s Out», täitsid aga hinge vana armastusega ja lahustasid algselt tekkima hakkava sademe.	45
est	1	Seega, eesti mehed, kõik on meie endi kätes! Just meie pingutused on need, mis suudavad trendi murda – tagada, et paremad piigad meid ei jäta ja et elu (Eesti)maal teps mitte välja ei sure. Meil on valida, kas uhkelt ja üksi lõpuni või natuke end painutada, et maailm muutuks paremaks paigaks meie naistele ja seeläbi ka meile.	69
est	1	Inimesed, elage ise ja laske teistel ka elada!	10
est	1	Projekti toetab Eesti välisministeerium arengukoostööks ette nähtud rahast.	9
est	1	Hunt on ekspertide sõnul sellel nädalal toimuva draft'i üks põnevamaid tegelasi. Kuigi tema ameerika jalgpalli kogemus on võrreldes teistega väike, korvab ta puudujäägid atleetlikkusega.	29
est	1	Rong oli tema hinnangul puhas, ilus ja äge. «Istmed olid küll esmapilgul jube kõvad, kuid ka pika istumise tagajärjel ei hakanud mul ebamugav. Mõtlesin sellel istmeteemal kohe pikemalt, et ilmselt on nii vinge tootjafirma taga siiski ka pikk arendustöö, et istumine oleks mugav aga mitte liiga pehme,» arutles ta.	59
est	1	Kiribatilt pärit kaluril Toakai Teitoil, kes 106 päeva triivis oma paadiga sihitult Vaiksel ookeanil, õnnestus raskest katsumusest eluga pääseda.	22
est	1	Paljud eestlased kartsid, et uus iseseisvusaeg esimesest kauem ilmselt ei kesta. Siiski on läinud teisiti. See on tingitud tõsiasjast, et Eesti oskas nii vaimselt kui majanduslikult kerkida kiiresti iseseisvaks riigiks. See pole olnud kerge, kuid leidus piisavalt võimet haarata kinni olulisest. See on austust vääriv saavutus.	54
est	1	"""Minu ämm ütleb, et ka Toni isal ja isaisal on hea matemaatikapea."""	16
est	1	Vastavalt statuudile saab 500 euro suuruse preemia koos kirjanik Anton Hansen Tammsaare poolt armastatud õunu-pohlamoosiga eelmisel aastal raamatu ilmutanud Eesti kirjanik, eelvalik tehakse nende raamatute põhjal, mida Albu valla lugejad kõige enam armastavad, vahendas ERR Uudised «Aktuaalset kaamerat».	44
est	1	Teises setis võitis Crawford kaheksa punkti järjest, murde Kontaveidi servi ja võites enda pallingugeimi, teist korda murdis ta Kontaveidi servi üheksandas geimis, võites seega nii teise seti kui ka matši.	34
est	1	Peciukievicius pallis mullu Vilniuse Sakalais ja oli Leedu meistriliiga paremuselt neljas söödumeister. Matulionis on aga mänginud Šiaulias ja Panevežyses ning olnud nendes meeskondades ikkagi mängumeeste hulgas. Ilmselgelt tulid mõlemad mehed Eestisse sooviga saada palju mänguaega ja koguda head statistikat. Tugevasti muutunud Pärnu võib kahe leedulase toel olla üks tänavuse hooaja musti hobuseid.  	56
est	1	Lisaks pakub Viimsi stereoskoopilise efektiga 3D-kino, mida saab esmakordselt Eestis nautida suuremate kergete 3D-prillidega.	16
est	1	«Süsteem toimib tänapäeval nagu kellavärk,» kinnitas salapärane mängija.	12
est	1	Au poomüüjale, tema tegi mida eesti politsei ei julge teha: üks kord ja korralikult probleemist lahti saada	19
est	1	Muuseumi direktor vastutab muuseumi igapäevase töö ja strateegilise juhtimise eest. Oluliseks ülesandeks on muuseumi sisulise ning majandustegevuse lühi- ja pikaajaline planeerimine ning kavandatu elluviimine.	26
est	1	Kaie Mikheim: põnevus ja ootusärevus on juba sees	9
est	1	Kolm veerandaega leedukate dikteerimisel kulgenud mäng sai virulaste jaoks õnneliku lahenduse 12 sekundit enne lõpuvilet tabatud kolmesega, mis vormistas mängu lõppskooriks ühepunktilise võidu 59:58.	26
est	1	"""Sain paar kuud tagasi tädiks ja tulin õele ja õetütrele külla. Pere on mulle väga tähtis. Ma pole õde ammu näinud ja vahepeal on nii palju asju juhtunud!"""	33
est	1	Eeltoodud arutlusele tuginedes oleme ette valmistanud ja kooskõlastusringile saatnud välismaalaste seaduse muudatusettepanekud, mis lihtsustavad ja kiirendavad oluliselt elamisloa taotlemist töötamiseks tippspetsialistina, ettevõtluseks või õppimiseks. Tingimused lihtsustuvad ka asjaosaliste pereliikmetele.	33
est	1	Suvel plaanib Rimi koostöös SA Õpilasmalevaga korraldada koolinoortele ka suvemaleva. 	11
est	1	Barcelonas võidutsenud Alonso meelest on Ferrari kõva sammu edasi teinud ning ta läheb Monaco etapile vastu lootusrikkalt.	18
est	1	Praegu kehtiv looduskaitseseadus sätestab, et rannal või kaldal asuva kinnisasja valdaja on kohustatud tagama inimeste ja loomade vaba läbipääsu kallasrajal.	22
est	1	Sellega saavutati alagrupis teine koht ning jõuti kolme alagrupi parima teise koha meeskonnana poolfinaali, kus vastaseks omaealiste mitmekordne Leedu meister A.Sabonise Korvpallikeskus.	24
est	1	Langdon oli auhinnatud arhitektuurifirma Regional Associates rajaja ja direktor.	10
est	1	minuarust on see just lahe kui ta münikord odavaid riideid kannab :)	13
est	1	USA president Barack Obama väljendas ööl vastu pühapäeva sõlmitud Iraani tuumaleppe üle heameelt ja avaldas lootust, et tegemist on esimese sammuga suhete normaliseerumise teel.	26
est	1	Siim Kallas – armas luiskaja 	5
est	1	Inimeseks on vaja saada. Inimeseks, kes hakkab mõtlema ja hinge tagasi loitsib, taas ellu ärkab ja vaatab maailmale uue pilguga.	24
est	1	Laupäeval tuli aga Hallik platsile ja kostitas juba avaveerandil Serbia korvi kahe tabava kolmesega. Kohtumise lõpuks kogus ta 14 punkti, tabades seejuures kolmeseid viiest neli. Peatreener Sokk ütles hiljem, et Halliku kolmesed tõmbasid terve meeskonna reele ja järsku hakkasid kõik tabama.	46
est	1	Kõik palgatõusud on minu jaoks alati rõõmustavad, sest riigi eesmärk peaks olema seal elavate kodanike hea elu. Kõrgem palk aitaks sellele kindlasti kaasa.	26
est	1	Lisaks pakub Viimsi stereoskoopilise efektiga 3D-kino, mida saab esmakordselt Eestis nautida suuremate kergete 3D-prillidega.	16
est	1	Laupäeval tuli aga Hallik platsile ja kostitas juba avaveerandil Serbia korvi kahe tabava kolmesega. Kohtumise lõpuks kogus ta 14 punkti, tabades seejuures kolmeseid viiest neli. Peatreener Sokk ütles hiljem, et Halliku kolmesed tõmbasid terve meeskonna reele ja järsku hakkasid kõik tabama.	46
est	1	Kullamäe sõnul on Dimša kõva töömees ja võitleja, kes ei löö üheski olukorras risti ette. Mehe taset näitab äsja Poola turniiril saadud parima mängija auhind, seejuures möllas mees kerge jalavigastuse kiuste. Väga rahul on peatreener ka Ing­ramiga, kes paneb tagaliinist mängu hästi käima ja hoiab meeskonda üleval. Nende kahe mehe kohta pole tartlaste juhendajal öelda ühtegi halba sõna – mehed olevat tipp-topp tasemel.	70
est	1	Huvitav,minu käest on palju kordi küsitud,kas LIIS on mu sugulane.AGA kahjuks ma ei tea,sest enda teada pole mul sellenimelist sugulast.Või...kes teab,äkki on ka,lihtsalt ise ei tea,sest see võib ka juhus olla,et nimed samad.Aga igal juhul---palju õnne nimekaimule,perekonnanimega nimekaimule.	59
est	1	Eesti võrkpalluritele toetuv Rennes’i Volley lõhkas Prantsusmaa meistrivõistlustel üllatuspommi, alistades esimeses veerandfinaalmängus suursoosiku Tours VB 3:2.	20
est	1	Argo Ideon: Läti on tubli	6
est	1	"""Inimene peab ju midagi õppima, ta peab enne surma inimeseks saama. See ongi niimoodi, et noorena paned pea tulle, nüüd enam mitte."""	29
est	1	Hunt on ekspertide sõnul sellel nädalal toimuva draft'i üks põnevamaid tegelasi. Kuigi tema ameerika jalgpalli kogemus on võrreldes teistega väike, korvab ta puudujäägid atleetlikkusega.	29
est	1	Ma ei pea sugugi silmas ettevõtetena toimivate praksiste muutmist munitsipaalasutusteks, sarnaselt Eesti Perearstide Seltsiga toetab ka sotsiaalministeerium keskuste loomist praksiste senist toimimismudelit lõhkumata.	25
est	1	"""lubaduste katteks kuluvad paarsada miljonit leitakse"""	8
est	1	P.S heale hoidjale on mõistlik maksta HEAD PALKA ;)	10
est	1	Me elame võimaluste mängu vormis, kus eesmärgistatud edasiminekuks tuleb valida vajalik roll, kus mitte ainult ei saa, vaid suisa peab leidma lahendusi, et vältida ebakindlat seisakut. Ükski lahendus ei ole iseenesest halb, olgu selleks siis elukoha muutus või tegevusala vahetus või kasvõi näiteks sama asja teisiti tegemine.	54
est	1	Praegu leian, et kindlasti oleks vaja paljudel riigiasutustes töötajatel palku tõsta. Eelkõige toetan ma palkade tõstmist neil, kes kuuluvad palgasaajate püramiidi alumisse osasse. See aitaks kaasa stabiilse keskklassi tekkele.	34
est	1	Eesti neljapaat koosseisus Kaspar Taimsoo, Tõnu Endrekson, Allar Raja ja Andrei Jämsä alustasid sõitu võimsalt ning kasvatasid pidevalt edumaad. Lõpuks edestati teise koha saanud Ukraina paatkonda rohkem kui kolme sekundiga.	34
est	1	Ja mis puutub Airisse, siis tema on tubli Eesti naine, kes on suutnud alati ennast ära toita. Ja see kui lõtv on kellegi püksikumm ei ole küll kellegi teise öelda. Vaadake enne enda kumme, kui teiste omasid kommenteerima hakkate.	45
