lang	sentiment	text	num_tokens
fin	1	"Siinä ei jää mahdollisuutta tehdä koneella mitään hyödyllistä kun örkintorjunta vie kaiken ajan ja konetehon. ;)
-1	-1	0	-1	2										0	-1	10	9	threads2011b.vrt 3901798	Nyt meni ruokahalut.
-1	-1	0	-1	2										0	0	4	9	comments2007a.vrt 3648036	ja pilsuja ja jauhoja niin s***nasti.
-1	0	0	0	2										0	-1	11	9	comments2008c.vrt 1672654	Eikä ihmisiä pitäisi kategorisoida niin rankasti hyviin ja huonoihin, riman alapuolelle/yläpuolelle kuuluviin.
-1	0	0	0	2										0	0	18	9	comments2012b.vrt 2160132	Savuttaessa sisään paljastuu halkeamat pakosarjassa.
1	1	1	1	5										0	-1	2	9	comments2008b.vrt 1698563	toivottavasti oli jotain apua!
-1	-1	0	-1	2										0	-1	6	9	comments2016a.vrt 2508474	Aikamoinen kalmisto on kaverilta jäänyt.
1	-1	-1	-1	2				-1	-1	0				0	-1	14	9	comments2008e.vrt 2080369	Harmi :(
0	0	0	0	3										0	-1	5	9	threads2009b.vrt 6326994	Päinvastoin, pohjoismaisuus on entistä tiiviimmin viiteryhmäämme.
0	0	0	0	3										1	-1	17	9	comments2013e.vrt 2051520	Käykö tässäkin samoin kui terveydenhoito koulutuksessa, että tekijät tuodaan tulevaisuudessa ulkomailta.
0	1	0	0	4										0	0	6	9	comments2006a.vrt 3215500	Kyllä se oikea nimi loksahtaa vielä kohdalleen.
0	0	0	0	3										0	-1	5	9	comments2013a.vrt 3482406	Ei kai se voi haalistua pois kuten tumma väri.
0	0	0	0	3										0	1	6	9	comments2012c.vrt 2569636	Sehän olisi tietysti ilmiömäistä...
0	0	0	0	3										0	-1	10	9	comments2012d.vrt 1669381	Lue vielä vähän lisää.
0	0	0	0	3	-1	0	0							1	1	1	9	comments2006d.vrt 1000792	(Ef.1:7)
0	0	0	0	3										0	-1	12	9	comments2006a.vrt 640204	Kysymys on vaan siitä jotta saataisiin nämä karvan verran alle 80 setkin innostumaan näistä hommista.
0	0	0	0	3										0	1	3	9	comments2015a.vrt 2223553	Eri asia tuleeko häkää niin paljon että se aiheuttaisi ongelmia.
0	0	0	0	3										0	0	9	9	comments2011c.vrt 3289678	5. Hiusten pituus nyt?
1	0	0	0	4										0	-1	20	9	comments2008e.vrt 242515	T.KIRSI
1	-1	0	0	3				-1	-1	0				0	0	3	9	threads2009a.vrt 3710439	Mies ei kuitenkaan vaikuttanut kovin mukavalta, vaan enemmänkin naistenmieheltä.
0	0	0	0	3										0	1	15	9	comments2015a.vrt 273088	mieheltäsi minä en oo lähetelly tänään yhtään viestii...eikä tällä mun ystävällä ole vaimoa.
0	0	0	0	3										0	1	13	9	comments2008f.vrt 993842	Veikkaan myös että Kia Ceed diesel farkku on yksi myydyimmistä ensi vuonna - ei välttämättä nbr 1, mutta kärjen tuntumassa.
0	0	0	0	3										0	1	4	9	comments2018b.vrt 1895378	Eikö meillä kaikilla ole sama isä?
0	0	0	0	3										0	0	19	9	threads2009a.vrt 4152875	Hyväksytkö naisten ympärileikkauksen?
0	0	0	0	3										0	-1	20	9	comments2012b.vrt 1181212	Kunhan yrittää pelotella eläkeläisiä äänestämään velanottopuolueita.
0	0	0	0	3										0	1	10	9	comments2018a.vrt 1341260	Itseasiasiassa pieninä annoksina sukurutsasta"" hyötyä, katso islantia tai japania, maailman sisäsiittoisimmat JA terveimmät kansat"	521
fin	1	Siis kiitos niistä hänelle!	5
fin	1	Mutta olen varma, että Tunisiaan matkustaminen ainakin on turvallista.	11
fin	1	Vaihdoin kierukkaan ja taas mennään upeasti.	7
fin	1	Sinällään äijät vaikuttavt rehdeiltä perheenisiltä, jotka pyörittävät varustekauppaa.	10
fin	1	Mutta asuntoa odotellessa... ja onnea jo asunnon saaneille:)	11
fin	1	Kiitos	1
fin	1	"Olet muikuista kaunein, käteeni osunut näen huohotat vielä
1	0	0	0	4										0	1	20	4	comments2013c.vrt 2331139	Ainahan klamydia ei parane ensimmäisellä antib.satsilla, siksi kontrollitesti on äärimmäisen tärkeä ja ei seksiä ennen sitä!
0	0	0	0	3										0	-1	19	4	comments2014e.vrt 2588046	todellakin olisitko valmis luopumaaan noista kissoista?
0	0	0	0	3										1	1	8	4	comments2003a.vrt 3835834	ettei vain gastroskopia eli vatsalaukun tähystys.
0	0	0	0	3										0	1	13	4	comments2009a.vrt 1270937	Ja sitten on sellainen asia kuin kaupan työehtosopimus, TES, jonka mukaan palkataan.
1	1	0	1	4										0	1	4	4	comments2017d.vrt 2328359	Ihanat syksyn värit alkaa muodostua....luontoa värittää...
0	0	0	0	3										0	-1	5	4	threads2009a.vrt 5744910	Pitäisi päästä kotisivuille..
-1	0	0	0	2										0	-1	9	4	comments2011c.vrt 81754	Köyhän kansan presidentti
-1	-1	0	-1	2										0	0	12	4	comments2015d.vrt 2837798	Pukama Opaman mielestä kaikki häntä kritisoivat voidaan tppaa itsenäisiin valitoihin, Se on jumalan käsky ja seisoo raamatussa, kuten Timo Soinikin kertoo olevan palestiinalaisten tappamisen ja pitämisen Gazan keskitysleirillä.
-1	0	0	0	2										0	0	10	4	comments2013e.vrt 200976	Pituus on ainoa asia mitä saa toivoa ja mistä saa tuntea vaivautuneisuutta, jos on huono itsetunto.
0	0	0	0	3										1	-1	15	4	threads2005a.vrt 1383674	Noin viikko sitten kävin katsastustarkastuksessa yhdessä huoltamossa.
0	0	0	0	3										0	-1	6	4	comments2013b.vrt 2765277	Sulla: alussa 05 ja lopussa 2 parillista.
0	0	0	0	3										0	-1	2	4	comments2018d.vrt 885024	Arkisto suomennettuihin J.D.
0	0	0	0	3										1	1	16	4	comments2011b.vrt 3492585	http://www.youtube.com/watch?v=EA1-G4Mj194
-1	0	0	0	2										0	0	16	4	comments2013c.vrt 2173031	Jos olet pastorin työn vastaanottanut ja palkattu se tekemään, niin sinun on mentävä ITSE vanhusten kotiin ja autettava, rukoiltava heidän puolestaan!
0	-1	0	0	2										0	1	5	4	comments2011e.vrt 833392	Eihän kukaan voi pysty ottamaan sellaista vastuuta lähes loppuun ajetuista romuista.
0	0	0	0	3										1	1	10	4	threads2007a.vrt 6262165	Ei se kyllä tuolla konstilla parane, että käytetään sitä sun tätä.
0	0	0	0	3										-1	-1	10	4	threads2007a.vrt 6246197	Onko jollakin kokemuksia tai jotain kuultuja mielipiteitä helsingin matemaattisluonnontieteellisen meteorologikoulutuksesta?
0	0	0	0	3										0	-1	8	4	comments2012a.vrt 896493	sinä joka asut Helsingissä ja olet raskaana kamerunilaiselle miehelle joka asuu Tampereella.
0	0	0	0	3										0	0	9	4	comments2010c.vrt 6019	en osaa ratkaista tätä mysteeriä olleskaan.
0	0	0	0	3										0	-1	17	4	threads2007a.vrt 5649981	pjpi150_04.dll O9 - Extra button: Messenger - {FB5F1910-F110-11d2-BB9E-00C04F795683} - C:\\Program Files\\Messenger\\msmsgs.exe (file missing) O9 - Extra 'Tools' menuitem: Windows Messenger - {FB5F1910-F110-11d2-BB9E-00C04F795683} - C:\\Program Files\\Messenger\\msmsgs.exe (file missing) O12 - Plugin for .spop: C:\\Program Files\\Internet Explorer\\Plugins\\NPDocBox.dll O16 - DPF: {17492023-C23A-453E-A040-C7C580BBF700} (Windows Genuine Advantage Validation Tool) - http://go.microsoft.com/fwlink/?linkid=39204 O16 - DPF: {2917297F-F02B-4B9D-81DF-494B6333150B} (Minesweeper Flags Class) - http://messenger.zone.msn.com/binary/MineSweeper.cab31267.cab O16 - DPF: {8E0D4DE5-3180-4024-A327-4DFAD1796A8D} (MessengerStatsClient Class) - http://messenger.zon/REDACTED/cab31267.cab O16 - DPF: {F6BF0D00-0B2A-4A75-BF7B-F385591623AF} (Solitaire Showdown Class) - http://messenger.zone.msn.com/binary/SolitaireShowdown.cab31267.cab O18 - Protocol: msnim - {828030A1-22C1-4009-854F-8E305202313F} - C:\\PROGRA~1\\MSNMES~1\\msgrapp.dll"" (file missing) O23 - Service: Sonera Tietoturva (BackWeb Plug-in - 4436233) - Unknown owner - C:\\PROGRA~1\\SONERA~1\\backweb\\4436233\\Program\\SERVIC~1.EXE O23 - Service: ewido security suite control - Unknown owner - C:\\Program Files\\ewido\\security suite\\ewidoctrl.exe (file missing) O23 - Service: F-Secure Gatekeeper Handler Starter - F-Secure Corp."	637
fin	1	Lapsille kiva leikkinurkkaus.	4
fin	1	Naurattaa...heheeehee.	4
fin	1	Kiitos!!!	4
fin	1	Liika pitkästä sais taas ottaa ylimääräset pois, ku joka sentti ei sinne mahru :)!	17
fin	1	"Heippis, ""Reilu""-Fafner"	6
fin	1	että pieni napaiset tomaatit maistuvat paljon paremmalle kuin iso napaiset tomaatit....kyllä nyt on himmee olo.....	18
fin	1	Mität kuuluu?	3
fin	1	moensti tullu opeteltua, ja jotenki aina kun lopulta siihen tottuu ja elämä on ihanaa yksinkin niin johan huomaa että taas on sutinaa ilmassa.	25
fin	1	Onnea uuden vauvan tulosta :)	6
fin	1	H. Se ;)	4
fin	1	*nauraa*	3
fin	1	Totesin juuri ilokseni, että kaikista sikaviesteistä oli tehty poistopyyntö.	11
fin	1	kyllä oinas tykkää sellaisista ihmisistä, jotka ottavat,uskaltavat tehdä aloitteita.eli kysy vain kahville,jos ehdit ennen oinasta!!	22
fin	1	Onneksi vihreät ajavat esimerkiksi perustuloa, se helpottaisi pätkätyöläisten ja muiden köyhien asemaa huomattavasti.	15
fin	1	Tämähän oli mielenkiintoinen sivu!	5
fin	1	Akin juttuja kiva lukea.	5
fin	1	Apuja kaipailisin, kiitos!	5
fin	1	LOL.	2
fin	1	Kiitos vinkistä.	3
fin	1	Haluaisin myös, että sinulla olisi kaikki hyvin.	9
fin	1	Siunausta Yeshuassa !	3
fin	1	No onnex kisuilki seuraavana pvnä peli Kirvesmiehiä vastaan,voi olla ett kisut väsyneit:)	16
fin	1	En voi muuta kuin sydämestäni teitä kiittää.	8
fin	1	Suosittelen kaikille joilla sama ongelma.	6
fin	1	Aamen!	2
fin	1	Exänsä kanssa oltiin niin paljon enemmän yhdessä ja minä olin aina se tärkein.	14
fin	1	Mutta rakkaus vie voiton	4
fin	1	Mukavaa puuhastelua touhukerhossa.	4
fin	1	Selkeää tekstiä on helppo lukea.	6
fin	1	joten olkaat hyvät te oiket tulkitsijat siirän tyhjän vastaussivun teille..:)	13
fin	1	Wau!	2
fin	1	Minäkin näin joutsenparven lentävän, niitä oli paljon.Kauniita olivat ja uskollisia ovat.	13
fin	1	Olisit vaan lähtenyt mun mukaan sunnaritreffeille;)	8
fin	1	Kiitos sinulle!	3
fin	1	Nukkuisin vihdoin yöni hyvin.koska isänmaa olisi pelastettu	7
fin	1	Kiitos vinkistä, kokeilen.	5
fin	1	Porukat salilla kehuu sitä hyväksi liikkeeksi ja suosittelevat kovin...Itellä olis halua nostaa penkkitulosta jouluun mennessä edes vähän.	20
fin	1	Kun näkee elämää muualta, usein kotiin palattua tuntuu, että ompa ihanaa olla omassa kodissa.	17
fin	1	huti Robbie Williams -Rudebox ^^	5
fin	1	hyvä hyvä ei kun hanaa vaan	6
fin	1	Ihania koiria :)	4
fin	1	Haluan oikeasti parantua ja oppia syömään juuri noin, vaikka tunnin välein jotain pientä.	15
fin	1	Thanks!	2
fin	1	HYVÄ PELICANS!!!!!!	8
fin	1	Ehkä tietämyksesi siivin jaksan nyt tämän yövuoron loppuun.	9
fin	1	päähän tai kai tarvit jonku muun suojuksen jos taas kirmaar stadionille :)	13
fin	1	Olo on aika ihana!	5
fin	1	Jos et ala nyt kemuihin niin varmasti vaikuttooo ♥	9
fin	1	Noihin yksinolemisen hyviä puoliin kuuluuvat mm:	7
fin	1	Mutta kannatan kyllä asiaa edelleen.	6
fin	1	Voimia omaisille!	3
fin	1	Ja korvalla.. ;)))	7
fin	1	Siihen saakka,Näkemiin.	5
fin	1	Tästä on hyvä jatkaa...	5
fin	1	Olivat kauniit ja sopivat auton muotoihin ERITTÄIN hyvin.	9
fin	1	Ihmiset mukavia ja auttavaisia.	5
fin	1	Toistaiseksi vain pelkkää hyvää sanottavaa!	6
fin	1	Vähän lisää tuntomerkkejä yms..niin ois varmaan pikkasen helpompi... :)	13
fin	1	Upeaa!!	3
fin	1	Hauska Onecoin myynnissä	3
fin	1	Näistä kokemuksista viisastuneina ja muutaman valtakirjan allekirjoittamisen myötä katsomme toiveikkain mielin jatkoa.	13
fin	1	Niinku nimikin jo sanoo, ammattikorkeakoulu on ammattikoulun ja korkeakoulun välimuoto! =)	14
fin	1	TSEMPPIÄ!	2
fin	1	millanen kaktus on appi-ukon pallit :)	7
fin	1	Itse olen etsinyt miestä kuvallisella profiililla ja ulkonäköä kehuttu paljon.	11
fin	1	Kyllä te tulette sinne omaankin yhdistykseenne saamaan ihmisiä riittävästi, ei sitä tarvitse tehdä toisten mollaamisen kustannuksella :D	19
fin	1	Varsinkaan kun muistaa, että suotuisten tuulien puhaltaessa onnistuneet treffit voivat muuttaa maailman!	14
fin	1	rohkeasti kirjastoon!	3
fin	1	moi :)	3
fin	1	Kokoomusta ja Kataista ♥ ♥ :)	7
fin	1	Tuota en kirjoittanut peloitellakseni sua, vaan niin kuin rakasta ystävääni opastaen.	13
fin	1	Heh, olipas kauniisti kirjoitettu... ;)))	10
fin	1	Ensi kesään on vielä matkaa hyvin ja kyllähän tämä paino kerkiää pudota hyvin, jos oikein tsemppaan itseäni.	19
fin	1	Olitpas aivan iloisen ihana tappaus.	6
fin	1	koska itse tiedän vaon love hinan, sailor moonin, taikasoturit, naruton :S lisää haluisin tietää =)	20
fin	1	Tosi ihania perheitä oon kyllä löytäny =) Briteistä ja Australiasta löytyy paljon perheitä, mutta Usasta ei juurikaan.	20
fin	1	Syö pikaravintolassa niin siellä on rasvaista ruokaa nii varmasti lihot!! :)	14
fin	1	Kiitos vastauksesta.	3
fin	1	Onnea kunnostukseen !	3
fin	1	Saat olla vielä todella ylpeä hänestä.	7
fin	1	Itse olen osittain tyytyväinen...	5
fin	1	Ajattelin, että ne ovat sopivia minulle.	8
fin	1	Pärjäät varmasti, tsempiä.	5
fin	1	tässä kauniita hyväpilluisia http://girls.twistys/REDACTED/hotos/11.jpg http://girls.twistys/REDACTED/hotos/14.jpg http://hosted.moreys/REDACTED/bill=2220863 http://hosted.joymii.com/fhg/ofg046_ild450 http://hosted.met-art.com/Full_met-art_NIC_107_218/?pa=1326985 http://hosted.femjoy.com/galleries/114464_vbj121_vxj731/pics/011.jpg http://hosted.femjoy.com/galleries/114881_qpw844_qmx554/pics/005.jpg http://galleries2.ftvcash.com/V20_gals/ftvgirlsphoto/353c/15.jpg http://galleries2.ftvcash.com/V20_gals/ftvgirlsphoto/7x/15.jpg http://hosted.met-art.com/Full_met-art_OFL_19_586/?pa=1326985	37
fin	1	Kiitos!	2
fin	1	Hauskaa päivänjatkoa hauskaan elämääsi :)	6
fin	1	Eli ihan lämpimästi voin suositella tripla seiskaa!	8
fin	1	Mukavaa sullekin, Seijasini :)	6
fin	1	Voi sua reppanaa &lt;3	7
fin	1	Toivottavasti löydät sanat kappaleeseen :)	6
fin	1	XD	1
fin	1	kerro itse ensin mitä ajattelet missä oltaisiin nähty... :)	11
fin	1	Kiitos Tirpunen - ihana ja lämpöinen hali lähtee nyt Sinulle!	11
fin	1	onneksi olette armeliaita tänä vuonna.	6
fin	1	Lisäyksenä vielä, että se kilikilikello on erittäin suositeltava.	10
fin	1	Kiitoksia hyvistä linkeistä!	4
fin	1	Kiitos!	2
fin	1	hyvä ettei vuodet ole mennyt hukkaan ja on hyvä tunne toisesta	11
fin	1	Se on jotain niin ihanaa, ettei sitä edes meinaa uskoa, Kunnes tuntee suudelman.	16
fin	1	Huomentapäivää hänelle, kahvi juotu	5
fin	1	Kukin tyylillään. :)	5
fin	1	Kiitos heille jotka vaivautuvat lukemaan ja antavat minulle hieman apua pulmaani. :)	14
fin	1	Hei!	2
fin	1	Kaks 2-kymppistä tyttöä jo venailee matkaa bikinit pakattuna... ;o)	12
fin	1	Kiitokset Tähtiryhmälle ajankohtaisista infoista, jatkakaa edelleen!	8
fin	1	Taisinpa jopa saada, vaikka tuumin ettei varmasti ole oikein...jospa toi sitten olisikin!	16
fin	1	&lt;3	4
fin	1	"SINÄ OLET SIINÄ NIIN HYVÄ"" Tämä asia on taivaan tosi , olen saanut luojalta kyvyn siihen juttuun."	19
fin	1	Sinä varmasti ansaitset parempaa ja saat sille nyt tilaakin, paremmalle elämälle ja ihmissuhteelle.	15
fin	1	Ilta teelle nyt ja kuullaan myöhemmin vieläkin Jos nukut ennen jo niin luet kun heräät joskus Hyvää viikonloppua ja hyvää yötä halitukset ja suukotkin jo kerran nyt ja sitten myöhemmin	30
fin	1	tosin myönnän kyllä että bemari ja jopa fiat on parempi ajaa kuin tojota mut jokainen tykkää mistä tykkää.	19
fin	1	Monesti on helppo tuoda kukkia tms. koriste-esineitä, mutta ainakin minua on nämä lahjat miellyttäneet eniten, sillä ne ovat tarpeellisia ja arvostettuja, ja tällätavoin lapsettomat kaverini ovat mieltäneet pääsevänsä maistamaan perheellisen elämää...	35
fin	1	Jyrsimet toki ovat hyvät upouutena ja kun niitä testataan paksulla &amp; kiillotetulla jäällä, siis käytännössä luistinradalla.	20
fin	1	sellaiseen nuoren miehen ylvääseen ryhtiin, suloisiin katseisiin ja hurmaavaan hymyyn.	12
fin	1	Kiitos vastauksista jo etukäteen :)	6
fin	1	Suosittelen, ruoka oli erittäin hyvää ja sitä oli suurinpiirtein aina jostain saatavilla.	14
fin	1	Toki erillaista mutta ainostaan positiivisessa mielessä.	7
fin	1	niinpä niin, jos olis ollu, mutta ei ollu ;)	12
fin	1	mmmm ilo kun tavara näkyy	5
fin	1	rv 14 ensimmäistä odottaessa, joten aivan hyvin se on mahdollista :)	13
fin	1	XD	1
fin	1	Hän oli huippuluokan ratsastaja ja metsästäjä, tapojen ja muotien luoja, kirjailija, valokuvaaja, yksi aikakautensa komeimmista, sivistyneimmistä ja kielitaitoisimmista miehistä, Aallon, Nurmen ja Sibeliuksen ohella maailmalla parhaiten tunnettu suomalainen.	36
fin	1	Itsehän olen hyvätuloinen työssä käyvä ja toivotan kaikille Pyhäsalmisille Hyvää joulua ja uutta vuotta.	15
fin	1	Suosittelen Artiklan kursseja lämpimästi! :)	7
fin	1	olet siinä mielessä henkisesti hyvin kypsä.	7
fin	1	Voin sanoa itse olevani tavallista ehkä älykkäämpi tai ainakin monipuolisempi, eli olen taiteellinen, sosiaalisesti erittäin tarkka ja empaattinen sekä päättelykykyni on erinomainen.	25
fin	1	Ensi kesänä sitten kokeilen työnhakua uudestaan, ehkä sitten onnistuu paremmin :)	13
fin	1	Hih, sinä lisäsit tuohon sanan eri :).	10
fin	1	Saadaan siiten vaihteeksi jotain kunnollista mangaa Suomeenkin!	8
fin	1	Moi!	2
fin	1	Jutut luistaa ihan hyvin, mutta muistan kyllä pari syvää haukotusta. :D	14
fin	1	Hieno homma ja kiitos.	5
fin	1	Tsemppiä!	2
fin	1	Tämä oli tosi hyvä tietää!	6
fin	1	Ruotsi kun on kuitenkin vain parisen kertaa Suomea suurempi ja siltä näyttää tuo kehittäminen luonnistuvan.	16
fin	1	puskista kirjoittelussa on etunsa ;)	6
fin	1	hyvä vasemmistoliitto	2
fin	1	"en tiiä tarkotitko mua XD mutta luulen et pidemmillä enemmän ""valinnanvaraa"", ite oon lyhyt nii mulle kelpais tavallist lyhyempiki poika :)"	25
fin	1	"Toivon ""hipidihip"":lle menestystä ja antoisaa tulevaisuutta."	11
fin	1	Aurinkoista kevättä!	3
fin	1	on hyvä varma aito varma japsi jolla myös arvo säilyy toisin kuin cittarissa	13
fin	1	Ei kun uutta vaan etsimään!!	7
fin	1	Mun lahjasaldo on kynttilät, kauniit kyntteliköt x 2, kristallia pöytään, keittokirja, kirjoja, viiniä, suklaata, vitamiineja ja kahvikupin lämmittimen USB-liittimellä :))	29
fin	1	Kiitos etukäteen...	3
fin	1	lukekaa kirja:miä oon kotkast.kertoo 1950-luvun kotkasta.tosi hyvä kirja ja siihen eläytyy!	14
fin	1	HYVÄ PIENITULOISILLE	2
fin	1	Olin sillon gänässä ja gänässä oon nyttekin ;)	9
fin	1	Tsemppiä muillekin allergikoille toivottaa,	5
fin	1	i love finland	3
fin	1	Kahvinjuonti on terveellistä puuhaa	4
fin	1	Kiitos vastauksestasi, minkälainen auto on kyseessä?	8
fin	1	Ei ´Reinon läheisyyttä mikään voita.	6
fin	1	Tauon aikana (asumuserossa,mutta tapailtiin) tosiaan huomasi kuinka toista voi rakastaa ja on se oikea, mekin ihan teinistä asti ollaan oltu kimpassa.	27
fin	1	Fiilikset on tietysti mahtavat, kuten aina lomaa odotellessa.	10
fin	1	Viiu on mukava ja halpa harraste,pikkuajoauto,mulla on uuno fire se vinkasee mukavasti ja ajolleen tosi hyvä,voi lähtee pitemmällekkin,ison auton tilat lähes ilmasex	30
fin	1	Kiire ei oo mihinkään, mutta kannattaa laskea verkot vesille! :)	13
fin	1	Näinhän se kannattaa ehdottomasti tehdä!	6
fin	1	ja seurustelen....äidin kanssa...:o)) Maistuis kahvi minullekkin...ja sauna...Kiitos Kippari toivotuksista:o))	24
fin	1	Kiitos.	2
fin	1	Ovat toimineet mainiosti.	4
fin	1	Olet sankarini.	3
fin	1	Kiitos paljon huojentavasta tiedosta!	5
fin	1	Tähän mennessä valintani ovat osuneet aika hyvin.	8
fin	1	Mutta onneksi se oli sentään maultaan varsin herkullista!	9
fin	1	tsemppiä sulle :)	4
fin	1	Siinäkin toivotettiin mulle aikoinaan tsemppiä huutomerkein!	7
fin	1	Toivon teille hyvää ja voin vetää ihaan huoletta vastavedon tuon edellisen kirjoittajan kanssa, kunhan kertoimesta sovitaan :)	19
fin	1	Eli on saatu jotain konkreettisesti hyvää aikaan.	8
fin	1	Ja on kai sekin tottumiskysymys, kun on tottunut siihen, että aina saa kun haluaa tai ainakin melkein, niin on kai siitä jotenkin tullut riippuvaiseksi, hyvällä tavalla.	31
fin	1	Espoonlahti - ok, lähinnä kerrostaloaluetta keskellä, muuten paljon rivitaloja yms. reunamilla.	15
fin	1	Toi tauko ei kuitenkaan niin kauaa kestä! :DD	10
fin	1	Kiitos hyvästä linkistä.	4
fin	1	"Melkos hyvä tuo ""Juupaksen"" kommentti, monipuoluemainen."	10
fin	1	T.ONNELLINEN NAINEN	2
fin	1	Kiitos kaikille! =)	5
fin	1	Seksi on annettu meille ihmiselle lahjaksi, aviopuolisoitten oikeus nauttia toisistaan!!!	14
fin	1	Näkevät paljon mukavia unia kuten elokuvia.	7
fin	1	Varsinkin Istanbul on mielenkiintoinen paikka minulle edellä esittämistäni perusteista johtuen.	11
fin	1	ja tietenkin * J U H L I A * sitä!	12
fin	1	Itse meinasin soittaa ja ilmoittautua omistajaehdokkaaksi, mutta jätinväliin, kun on jo ennestään yksi pienokainen kotona rellestämässä :)!!	22
fin	1	Upeaa, mahtavaa!	4
fin	1	Ite olen onnellinen jos näen jonku erikoiseman auton liikenteessä.	10
fin	1	Kiitos vastauksista :)	4
fin	1	' Hei !	3
fin	1	Sain juuri pullollisen tuota saksanpähkinä öljyä ja se toimii todella hienosti!	12
fin	1	Kiitos	1
fin	1	Lassen pohjoisen prätkälenkit oli/on lähellä mieltä, porukassa olisi mukavaa, mutta tarvittaessa yksinkin menee, pohjoista olen kolunut.	20
fin	1	Olen odotellut sinulta jotain viestiä, kuinka voit ja jos ei ole liikaa vaivaa, laita minulle tänne viestiä jaksamisestasijos sopii:))	24
fin	1	Toivon, että kaikki järjestyy vielä parhain päin.	9
fin	1	yksi ihan OK päivä takana :) jihuu.	9
fin	1	Tietääkseni on olemassa ainakin se yksi treenaaja,joka syö karppilinjalla :)	13
fin	1	sen, kurkkujuustovoikkarit ovat valmiita syötäväksi nam!	8
fin	1	Haluaisin nähdä hänet vierelläni suudeltuna, kun avaan aamulla silmäni.	11
fin	1	Uskon kyllä, että sinulla riittää naisia sillä olet niin huomaavainen ja suvaitsevainen etkä ole heti ensimmäisenä syyllistämässä tai solvaamassa.	21
fin	1	kyllä elämä on ainakin mielenkiintoista lasten ja koirien kanssa =)	11
fin	1	JES!	2
fin	1	Hän ON rakkaus.	4
fin	1	Onnea ja menestystä - toivon myös että tämä kestää ikuisuuden ** . :)	15
fin	1	Olemme erittäin onnellisia - jo vajaan 3 vuoden ajan.	10
fin	1	:D :D	4
fin	1	Nyt kysynkin arvon raadilta että mitä seuraavaksi kiitos jo etukäteen!	11
fin	1	Matkakuvia Retystä!!!	5
fin	1	Tsemppiä vaan, kyllä se sujuu...	7
fin	1	Onnea matkaan!	3
fin	1	Tsemppiä teillekin=)	3
fin	1	Kiitos jos joku viitsii vastata ja osaa auttaa tässä...	10
fin	1	Itse luen Susan Millerin kuukausihoroskooppia osoitteessa http://abc.go.com/astrologyzone/, koska pidän hänen tavastaan kirjoittaa.	16
fin	1	hieno juttu, tästä se lähtee.	7
fin	1	Käymme yhdessä reissuissa ja vanhempani hyväskyvät hänet ihan täysin.	10
fin	1	Siunausta kaikille, rukoilen puolestanne!	6
fin	1	NO hauskaa iltaa vaan ja hyvää yötä	7
fin	1	Hienosti on koulutettu, palkittu ja ympäristöäkin suojeltu, lisäki asiakastyytyväisyys sen kuin nousee:-)	17
fin	1	TÄYSIN SAMAAMIELTA olen!!	5
fin	1	Hei	1
fin	1	Joku saattaa silti lukea ;)	6
fin	1	Mun mielest tää kuulostaa hyvältä koululta	6
fin	1	Olkaaa hyvijä ja juokaa mun keitämääni munakahveeta, seh on hyvää .	12
fin	1	Olen kanssasi aivan samaa mieltä; kriittisyys on tärkeätä.	10
fin	1	(Hmm. ehkä mun pitäisi patentoida uusi laminaarinen tuulitunneli ;)	12
fin	1	Mutta kiitoksia vinkeistä.	4
fin	1	Mukavaa lomaa kaikille Marmarikseen matkaaville!! (vaikka mukavahan Turkin lomasta tulee varmasti ilman toivotuksiakin)	17
fin	1	hieno kaveri, lääkitys ei vain nyt ole kohdillaan, tukekaa miestä kun tapaatte..	15
fin	1	WAU!	2
fin	1	Linuxin mahtavaa voittokulkua ei voi estää enää mikään ja Microsoftin maan pinnalta poispyyhkäisyä ei mikään!	16
fin	1	Hihiii empä olis uskonu että se on noin vaikeeta ;)	11
fin	1	Tervetuola Hyvinkäälle :)	4
fin	1	kiiitooooooooS ! !	3
fin	1	Todella kiva!	3
fin	1	Kanarian saarille mennään seurustelemaan ja pitämään hauskaa muutenkin kuin seksin takia.	12
fin	1	Sauli on vahva ehdokas, monille ♥♫ ♥♫	8
fin	1	Mutta hyvää yötä sinullekin, tänäänkin, kaikesta huolimatta ja kaikesta huolen pitäen.	14
fin	1	-Kiitos! :)	4
fin	1	saat alihintaan hyvän auton,osta poies!	8
fin	1	Toivottavasti malttaa myös itse nauttia työnsä hedelmistä - siis hyvää joulu hänelle ja muullekin väelle!	16
fin	1	Kiitän myös lukuelämyksestä :)	5
fin	1	Mutta naisen hoiteleminen onkin sitte paljon mielekkäämpää puuhaa.	9
fin	1	:-D	2
fin	1	kauniita uneja ja helluseja kuveja	5
fin	1	Onnea vaan!	3
fin	1	Siksi lapset ovatkin niin ihania!	6
fin	1	Ehkä me tavataan :)	5
fin	1	Voi Seppo raukkaa, mahtaa hänellä olla rankkaa :( no mutta eiköhän katariina kohta pelasta hänetkin :) jos Lari otti Kallen huoneen käyttöönsä niin Sepollehan jää vielä Eliaksen huone	31
fin	1	Joka kerta kun yrität ymmärtää, koska todella välität, sydämeni saa siivet.	14
fin	1	Mukava kun olit tyytyväinen.	5
fin	1	Soittele kun Turkuun päin tulet ja kivaa keväthuuman odottelua Manseenkin.	11
fin	1	Olisin onnellinen jos rakastamani henkilö löytää rakkauden.	8
fin	1	mikä ettei.	3
fin	1	Kiitos taas jos joku jaksaa vastailla	6
fin	1	Ihanaa!	2
fin	1	Olisi ihanaa löytää pirteä ja spontaani kesäkissa loma kaveriksi.	10
fin	1	Suloinen lapsi ja kaunis ajatus säveltäjällä!	7
fin	1	"tuo oli ""kiitosPäivi"" :lle =)"	9
fin	1	toivotan kaikille ja etenkin monikultuurisille perheille aurinkoista kesän odotusta,ja pidetään lippu korkealla,mehän olemme ylpeitä miehistämme,ja emme anna muiden latistaa tunteitamme miehiämme kohtaan,ollaan onnellisia:) :) :)	37
fin	1	Se on naisellista, ja suurin osa miehistä myös pitää siitä, että naisella on jonkin verran leveyttä lantion alueella.	21
fin	1	Kiitoksia vinkeistä.	3
fin	1	Kiitän asiallisista vastauksistanne	3
fin	1	Hyvää Joulua tervehdykseen vastataan -&gt; niin sullekin!	11
fin	1	Jos haluat ajaa sitä satasta, niin olet mouhooja : )	11
est	-1	Kell 20.20 said korrakaitsjad teate, et Tartu maanteel asuvas söögikohas ähvardasid joobes kliendid  kaasavõetud süütevedeliku abil tulekahju tekitada. Kahtlustatavatena viidi politseijaoskonda 34- ja 35-aastane mees.	28
est	-1	Pärnu maakohtu Haapsalu kohtumaja mõistis detsembris tingimisi vangistuse alaealisele noorukile, kes sulges mullu juunis teise alaealise noore tuppa, sidus ta koormarihmadega tooli külge, kägistas ja lõi teda ning pihustas tuppa putukamürki, kirjutab Läänlane.	38
