lang	sentiment	text	num_tokens
fin	-1	Itseriittoinen pappi on vailla evankeliumia oleva pappi ja kadotukseen matkalla.	11
fin	-1	"Mutta tämä diapamikaan ei aina ahdistuneisuutta vie, voin kahdenkin 10mg diapamin oton jälkeen ""tulla hulluksi""."	19
fin	-1	Ilman ystäviä ja rakkautta elämä tuntuu niin käsittämättömän pahalta.	10
fin	-1	Silloin kun ahdistaa kaikki kaatuu päälle,työttömyys,pitkä suhde alkoholin takia särkyy.	15
fin	-1	Ehei.	2
fin	-1	Jumaliste,, niiden pitäisi olla alan amattilaisia.	9
fin	-1	On tehty hankalaksi.	4
fin	-1	Kohta kukaan ei enää jaksa kiinnostua.	7
fin	-1	Suomi siniristilippuineen on kova ja korruptoitunut rikollisten virkamiesten paratiisi.	10
fin	-1	Siinä taas saatana aivotonta mädätyspaskaa tuutin täydeltä.	8
fin	-1	En opi ikinä kun vasta kantapään kautta, jota haluaisin tämän keskivahvan päihteen kanssa vältellä, joten pyydän tosissani apua ongelmaan.	22
fin	-1	Talahan on persunatsien Göbbels!	5
fin	-1	Sellaisiakin ihmisiä on paljon,Jumalaparatkoon.	7
fin	-1	Kyllä tässä puolueessa onkin MATTOPIISKALLE töitä, niin on mennyt OPPOSITIOpolitiikka populismiksi!!	14
fin	-1	Oikeusministeriokin kellistelee takapaa pystyssa valmiina..	6
fin	-1	ÄLÄKÄ USKO KAIKKEA !	4
fin	-1	"Mummis, kun olet niin kova puolustelemaan näitä ns. ""kotoutettavia"", niin olisi hyvä, jos lukisit pienen kirjasen, jonka on eräs muslimi kirjoittanut, tässä:"	30
fin	-1	Piikistä se 24h alan tuntee selvästi oviksen,se on niin kivulias että joudun kävelemäänkin kyttyrässä,autoonkaan en meinannu päästä,kun istuukin niin tuntuu sellanen vihlasu,koko ajan on sellanen kuin joku vetäis munasarjoja eri suuntiin, mutta se on ohi n.36h.	46
fin	-1	ärinää..	2
fin	-1	Kai hänet pitäisi päästää jo vapauteen kun osaa katua toilailujaan.Siperian reissu olisi omiaan katuvalle panttivankimiehelle.	16
fin	-1	&lt; muija mullekin sano suoraan että on ollut miesten kaa jotka oli parempia sängyssä vain siksi että niillä oli isompi &gt;	25
fin	-1	Mitäh?	2
fin	-1	Hui kauheeta!	3
fin	-1	Pötyä.	2
fin	-1	Se on meinaan aika vaikeaa.	6
fin	-1	sinä et niitä pääse näkemään...	6
fin	-1	Kun ei millään viitsisi kirjoittaa vastauksia samoihin kysymyksiin viidettäkymmenettä kertaa...	11
fin	-1	VAROKAA!	2
fin	-1	"Ihan yhtä paljon järkeä kuin sinun kommentissasi ""naisellinen nainen"""	11
fin	-1	Nytkin olen enemmän suoraan sanottuna vähän peloissani kuin mustasukkainen.	10
fin	-1	Mutta ei ole vielä onnistunut perhe....	7
fin	-1	HÄIVY HIHHULI	2
fin	-1	"Vieroksun tuota hokemaa "" rakasta itseäsi, niin rakastat muitakin."""	12
fin	-1	Kun natokiimaIset ovat väkisin tekemässä siitä vihollista.	8
fin	-1	1234567--- no, kumarra sinä sitä epäjumalaasi, sapattia.	12
fin	-1	Kun ei vain loppuisi joukoiltaan panokset aseistaan kesken kaiken lahtausoperaatioissaan massojen edessä.	13
fin	-1	Vaikka tuo aluksi naurattaa, ei se ole edes mitään huumoria vaan pelottava totuus.	15
fin	-1	Suomen kaupunkien lähiöt täynnä ahlkoholisoituneita Sekakäyttäjä, kumiliimasat -- kokaiiniin siktä väliltä kaikki kelpaa, nää ns. isät-- äitit Vammauttaa joka suosi Myös lapsensa esm. tappamalla n. 11-15 lasta alle 2 vuoden ikäistä ja samat tyypit hakaa yli 300 lasta niin etteivät parannu koskaan.	48
fin	-1	Onko se nyt todella niin vaikea tajuta?	8
fin	-1	VITUN AIRFINLAND	2
fin	-1	Mieti tarkkaan rakennatko Evijärvelle, valtapuolueella tarkoituksena näivettää kaikki muu paitsi kirkonkylä.	13
fin	-1	Nyt tyhmille taviksille tyrkytetään agrisijoituksia.	6
fin	-1	Ei se vaihtanutkaan parempaan, luuli vaan...	8
fin	-1	tätä on jatkunut jo liian kauan, mutta mulla ei oo munaa sanoa porukoille että tarvin apua, ja kaikki ei oo kunnossa.	24
fin	-1	katkeruutesi on järkyttävää.	4
fin	-1	On totta, että on isiä, mutta kuule rakas JanHus, oletatko, että se isäkin on kotona 24/7?	21
fin	-1	Ja miksi olisin kateellinen pahasta ruuasta???	9
fin	-1	Kyllä kohta suut loksahtaa auki kun ME hoitajat häippäsemme työpaikoiltamme.	11
fin	-1	Sieltä Helvetistä on paha tulla ketään ampuilemaan!	8
fin	-1	Näitä tapauksia on liian monta!!	7
fin	-1	Kyllä minä niin mieleni pahoitin.	6
fin	-1	sori vain olen fiksumpi mitä luulet!	7
fin	-1	Lapsia ja nuorisoa PITÄÄ EHDOTTOMASTI KIELTÄÄ RAAMAMATTUA OMINPÄIN LUKEMISESTA, sillä muuten on vaara että he ALKAVAT KÄYTTÄMÄÄN OMIA AIVOJAAN.	21
fin	-1	Ei kun APINOIJAT käräjille Löysät pois23.1.2011 11:22	7
fin	-1	osaatkos edes tulla ja lähteä purjein satamasta, jos et, olet väärällä palstalla.	15
fin	-1	Tätä miestä kehuttiin mulle tosi mukavana ja reiluna ja joka sanoo asiat suoraan ennen kuin tapasin sen, niin mulle jäi kyllä ton vuoden aikana pikkuhiljaa ihan muunlaiset käsitykset siitä.	31
fin	-1	Mulla on välillä tää pitkä tukka vähän rasvasena mutta mitäs sitte?!	13
fin	-1	No hemmetti en ole niin lapsellinen!	7
fin	-1	Oi jos Havannassa olisi tiedetty, kuinka perkeleenmoista vasikankarkua Edu Alfoilla rommeissaan päästeli.	14
fin	-1	Annan peli ärsyttää!!!	6
fin	-1	Jos mun lapseni valittais opettajan tekevän sitä tai tätä, niin sillä olis jo seuraavana päivänä nauhuri taskussa ja se ope pistettäis seinää vasten alle aika yksikön.	28
fin	-1	Tuollaiset vanhakantaiset mielipiteet ovat kiellettyjä.	6
fin	-1	Anna kakara pois	3
fin	-1	Laittakaa sisäpiirijuonet pönttöön ja vetäkää samalla yhtiön eläkeäijät viemäristä alas.	11
fin	-1	Ihanko he sen kuvankin sitten mollaustarkoituksessa julkasivat?	8
fin	-1	Mistä ihmeestä se maailma lumoutuu päähän, että ainut hyväksyttävä/oikea seura on tuo (allekin jo) missi-mittojen ulottuva??	21
fin	-1	Ki**i*i!	7
fin	-1	Ei kukaan kannata.Mukava kun on sukulaisia, muuten kuin aloittaja surkea sukulaiseton vasuri räkyttäjä.	15
fin	-1	Isäpuoli oli muutenkin aikamoinen despootti, kaikki tehtiin hänen halujensa mukaan.	12
fin	-1	Haluaisin vaan sanoa, että itse vihaan oravia.	9
fin	-1	"Siitähän seuraisi se, että sinkkuus olisi oletusarvoisesti ""alempiarvoinen"" asia kuin parisuhde, jota ajatusta minä en ainakaan pysty hyväksymään."	23
fin	-1	Ihmisten punaniskainen suhtautuminen on ikävää :(	7
fin	-1	Mulla on atooppinen iho ja tää on menny nyt raskausaikana ihan kamalaksi, puolessa välissä raskautta mennään...	18
fin	-1	Voihan jukrahuiti,täytyykö olla elinkeinona koiria pitävä,ennen kuin mikään laki pääsee huolimattomuuteen koiriensa pidossa syyllistyneeseen käsiksi.	20
fin	-1	ja vittu opettele kirjottaa ctafani vittu se on GTA eikä cta http://www.google.fi/REDACTED/r:2,s:0,i:72	18
fin	-1	Ei hyvää päivää : (	5
fin	-1	Tekeekö mieli herjata USKOVIA, PILKATA JUMALAA JA MITÄTÖIDÄ USKOVIEN OHJEKIRJAA RAAMATTUA.	13
fin	-1	Muutenkin liikenteen ohjaaminen näytti siltä kuin oltais oltu vähintäänkin jossakin Intiassa.	12
fin	-1	ei sinulla ollut sen kummempia kykyjä.	7
fin	-1	"Tämä palsta on täynnä huuhaata.
0	0	0	0	3										1	-1	17	5	comments2005c.vrt 3087106	Yritystä on ollut...
0	0	0	0	3										0	-1	6	5	comments2005a.vrt 4034096	-Onko rca-&gt;monoplugi piuhasi varmasti oikein kolvattu, näet ei näitä kaupasta saa
0	0	0	0	3										0	1	8	5	comments2014b.vrt 669486	Joo, minäkin olin lukenut että tapahtuu räjähdys, ja ihmettelin tänään että mihin se jäi.
0	0	0	0	3										0	0	17	5	comments2009b.vrt 909077	Jokaiseen nopeutta osoittavaan liikennemerkkiin pieni lähetin joka kertoo nopeuden autolle.
0	-1	-1	-1	2										0	-1	3	5	comments2008c.vrt 1748411	kukaan mitään pöytäkirjaa kaipaa eikä tee.
-1	-1	0	-1	2										0	-1	11	5	comments2012a.vrt 1131572	Ja nykysin en enää viitsi ostaa edes pussia, kun siinä suurin osa alkaa olla orangea tai jotain muuta pahaa!
-1	-1	-1	-1	1										0	-1	15	5	comments2015c.vrt 2109317	Kyllä siinä hermot menee keltä hyvänsä.
1	-1	1	1	4				1	0	0				0	0	19	5	comments2006e.vrt 690867	Perikunta voi ostella omat kameransa ;-)
-1	1	0	0	3				0	0	0				0	1	13	5	comments2015b.vrt 1990288	Olin jo tullut lomaltani raatamaan töitä taas... baarista tuli soitto--että asikas kaipaa minu jutskaamaan Olikin se lääkärikaunotar!!!111!!! jotain Irishkaffet ryystämässä sexykkääxy tuunatuna---tiesi henkilötietö ja työpaikan---- Kauniita silmiänsä räpsytellen ja hymyillen tervehti ja riikinruattix kyseli vointiani+ jos ehtisin esitellemään laivaa......
1	1	1	1	5										0	0	20	5	comments2011a.vrt 169795	osaan mä jo joitaki perusjuttuja mitä tänää opettelin :D
1	0	0	0	4										0	1	16	5	threads2007c.vrt 491937	Ei haukuta kanssaihmisiä, vaan kirjoitellaan rakentavasti asioista ja kerrotaan mielipiteitä.
0	0	0	0	3										0	-1	14	5	comments2005a.vrt 4067577	&gt; Varmaan jopa hurttakin tietää, keitä vastaan tietty osa linux-yhteisöstä on aloittanut sotia?
-1	-1	0	-1	2	-1	-1	-1							-1	-1	1	5	comments2015c.vrt 1866147	Ihmetyttää miksi vielä olet tällaisen miehen kanssa.
0	0	0	0	3										-1	-1	9	5	comments2013c.vrt 880244	Itse ajatushautomon kantava voima ilmestyi keskuuteemme.
1	0	0	0	4										-1	0	19	5	comments2006d.vrt 34580	City-kissoille täytyisi järjestää mahdollisuus kiipeillä ja saalistaa vapaasti sekä vetäytyä omaan rauhaan.
0	0	0	0	3										0	0	15	5	threads2005a.vrt 1986929	vaiva noteerata jotenkin treenatessa?
-1	0	0	0	2										0	0	2	5	comments2010b.vrt 54535	Koet kovasti tarvetta todistella olevasi hyvä kristitty.
-1	-1	0	-1	2										0	-1	17	5	comments2010e.vrt 3854868	En itse tajua tätä nykyaikaa sen suhteen, että vastoinkäymisten takia suhteet päättyy.
0	0	0	0	3										0	-1	17	5	comments2008c.vrt 1550614	Älä tapa"" -käskyn alkukielinen verbi tarkoittaa ""tappaa kostoksi""..."	475
fin	-1	"Ja usein vielä jäävät lässyttämään koirilleen tuohon portille tyyliin ""katsos fiffe kun on iso hauva tuolla""... jne. samaa saissea kusettavat ja paskattavat koiransa MEIDÄN portin likelle olevalle nurmikolle joka on siis MEIDÄN tonttiamme."	37
fin	-1	eikä taas oo ihimekkään.	5
fin	-1	Yhdessä kammottavan huoltohinnoittelun kanssa tuo piittaamattomuus vei kyseisen liikkeen boikottilistalleni tod.näk.	12
fin	-1	Mutta näköjään et kestä.	5
fin	-1	Kai miehiin sit vetoo heikot naiset enempi:(!	10
fin	-1	Ei missään tahallaan lapsia huudateta.	6
fin	-1	Ei se voi olla väärin :(	7
fin	-1	Täällä saa ostaa kaupasta lisää wc paperia jos tarvitset,mutta älä suosi suomalaista Serlaa, se on täällä markkinoiden ala-arvoisin tuote.	23
fin	-1	NOKIA valehtelee	2
fin	-1	Näitä sontajuttuja voi keksiä vähän pienemmälläkin äö:llä.	10
fin	-1	Nyt lopetan kanssasi pelleilyn.	5
fin	-1	Miksi tuntuu siltä että saa pelkkiä valituksia eikä koskaan kiitosta?	11
fin	-1	Ei sillä mitään pelaa.	5
fin	-1	Mä en tajuu, miten elämä voi potkia näin helvetin rankasti päähän?	13
fin	-1	että sori vaa ja ANTEEKS KAUHEESTI jos OON OLEMASSA!!!	12
fin	-1	Se paneekin epäilemään juuri sitä, että valvojan motiivina on hyvin pitkälle se, että ottamalla valvontaansa useita palstoja hänen nimimerkkinsä on ohjaamassa lukijoita hänen galleriasivulleen, joissa ensimmäisenä suosikkisivuna Aaltosella on oman yrityksensä esittely.	36
fin	-1	"Liikaa ählämejä kyttäämässä että löytisikö ""sopivaa""."	9
fin	-1	Inhottava tyyppi kaikenkaikkiaan ja lapsena kauniimpi kuin nykyisin.	9
fin	-1	historia toristaa tätä kauheutta, oiken pahaa teköö ku lukoo niitä juttuja!	13
fin	-1	"nää on kaikki tätä sarjaa: ""tee taikatemppuja, jotta nainen vihtyy mahdollisimman hyvin ja naisen ei itse tarvitse tehdä yhtään mitään"""	24
fin	-1	Olen väsynyt.	3
fin	-1	Ansku ja Jamo voi sitten löhötä sohvalla ja vuorotellen sano öööööööö......	12
fin	-1	laittakaa isät jos teillä munaa poikanne ruotuun ja heti??ja ottakaa hame pois päältä.	17
fin	-1	Tälläiseksi maailma on mennyt,sunnuntai auki olo täysin turhaa..	11
fin	-1	"Isot kaupat ""juoksuttavat asiakasta jo ihan tarpeeksi, saat laahustaa kalsariosaston läpi hakemaan maitopurkin 300metrin päästä, minä siirrän samalla kalsareita puuterihyllyyn ;)))"	27
fin	-1	Älä varota sitä!	4
fin	-1	Kannattaisi kyllä varmaan tutustua asiaan jossain muuallakin kuin propagandasivustoilla...	10
fin	-1	HALUAN TUPAKKAA TRE	3
fin	-1	HEILLE ON LEVEÄ PORTTI HELEVETTIIN PÄÄSEMISEN HELPOTTAMISEKSI AVATTUNA.	9
fin	-1	Meillä tilanne nyt siis se,että mietin pitäisikö minun hajottaa perhe ja jättää mieheni..	16
fin	-1	On säälittävää että täällä pitäisi avautua siitä koska saa vai saako laisinkaan.	13
fin	-1	They are a menace to free thought and speech, and the worst tool imaginable for fighting real hatred.	20
fin	-1	Poliisille riittää töitä, kun he tästä eteenpäin joutuvat tarkastamaan kaikki burkaan tai muihin säkkeihin piiloutuneet muslimit.	18
fin	-1	Ja tohon ei kyllä usko Erkkikään!!!!!	11
fin	-1	Kukaan aito kokoomuslainen ei kirjoittele niin kuin sinä.	9
fin	-1	Äitini ei ole innostunut asiasta ja jopa hiukan uhkailee ja painostaa mua, jos lähden, hän uhkaa etten saa nähdä sisaruksiani enää koskaan, jos nyt jätän heidät pulaan, enkä ole koskaan enää tervetullut kotiin.	38
fin	-1	Vielä joitakin vuosia sitten jolloin koirien tuonti Suomeen noilta löytötaloilta alkoi ei kissoja päässyt edes katsomaan, koska olot olivat niin hirveät!	23
fin	-1	puhelimeen, en muista hymyilinkö, mut kyl näin ettet katsonut taaksesi. :(	15
fin	-1	Mie ikävä kyllä olen niitä joille jotain aina jää kaihertamaan :(	12
fin	-1	Osa painaa hommia kokoajan pelko perseessä, että itse on seuraava, jolle lyödään verokirja kouraan.Pitkässä juoksussa tämä ei voi olla näkymättä työn tehokkuudessa ja sairaslomissa.	27
fin	-1	Ensinnäkin paita rikki, ajattelin jo siinä vaiheessa äitini kanssa että jo on outo myyjä.	16
fin	-1	Pelkkänä sylinä minä haihdun huutaen pois.	7
fin	-1	Miks Kurttia aina mollataan vaikka oli hieno mies? :(	11
fin	-1	Halvalla voi saada muuutakin kuin sutta ja sekundaa, mutta nähty on, että moni kaunis, kallis keittiö on pilattu tumpuloimalla asennus...	24
fin	-1	Rehellisyys on lapsellista	3
fin	-1	ETSISI IKÄISTÄÄN SEURAA.	4
fin	-1	Mutta näinhän ihimisiä kusetettiin entisessä Neuvostoliitossakin.	7
fin	-1	"taaksepäin menee Kreikka jos luopuu eurosta ja siirtyy takasin drakmaan, luin tuommosen uutisen jostain no jos Suomi menisi takasin markkaan ja 50 vuotta taaksepäin niin suoraan sanon, että on ollut pa,kamaista seurata nämä viimoset 50- vuotta suomalaisen yhteiskunnan muutosta, ihmisten tekemisiä ja muutoksia esim. suomalinen työmies on palannut laiskuuden alkulähteelle, laki on asetettu kyseenaliseksi, perhe on romutettu ja varttihintit sivarit on tulleet suomalaiseen politiikkaan voimakkaasti mukaan, armahtakaa sen verran,että ette siirry 50-vuotta ajassa taaksepäin enekun olen siirtynyt ajsta iäisyyteen ei viittis kattoo tätä "" koheltamista "" toista kertaa"	98
fin	-1	Tavallinen tallaaja ei saa netistä kopioida musiikkia omaan käyttöön, mutta isot firmat saavat kopioida pienten ihmisten teoksia ilman pelkoa tekijänoikeusjärjestöjen ajojahdista.	23
fin	-1	Liipattu totuus paskaparissa	3
fin	-1	Osa ilostani jäi sinun verkkoosi, oletko nyt tyytyväinen?	10
fin	-1	Koiravero ei paskoja vähennä kulkureiteiltä, mutta pakolliseksi määrättävä pitkä juoksunaru sen sijaan auttaisi asiaa, sillä yhdelläkään koiranpaskattajalla ei ole ilmeisesti varaa ostaa yhtään metriä pidempää talutusnarua piskilleen ja silloinhan koira ei voi muuta tehdä kuin paskantaa lähes omistajansa jalkoihin ajoradalla.	43
fin	-1	Miksei mennyt kotiin kun oli niin lähellä,jossain mättää aika pahasti.Ymmärrys hoi.	14
fin	-1	Seat heikompi laadultaan kun skeida	5
fin	-1	Ja ihan AINA on mieheni valittanut huonosta palkastani.	9
fin	-1	Ei kumpikaan...sä olet feikki,sua vaan harmittaa kun et pääse kenenkään naisen pöksyihin...	17
fin	-1	"Profeetta eli aavikolla koko elämänsä Eikös tuo kaupungissa syntynyt ja kaupungissa hallinnut, mitä nyt kävi välillä ryöstelemässä karavaaneja ja viemällä uskontoaan väkivalloin pienten heimojen luonna ja nai siinä sivussa omaisiaan ja meni lapsenkanssa naimisiin, eli harrasti nykykäsityksen mukaan ""pedofiiliaa""."	44
fin	-1	Tuokin siteeraamasi oli olevinaan jokin kannanotto.	7
fin	-1	MUA ON VAIVANNUT TÄMÄ ASIA JO PITKÄÄN.HUOMASIN 13- VUOTIAANA ETTÄ JALKOJENI VÄLIIN RUPEAA KASVAMAAN JOKU OUTO PATTI.TAI,EI SE PATTI OLE VAAN JOKIN KUMMA JUTTU,VÄLILLÄ SE ON KUIN PRINSSINAKKI,VÄLILLÄ TAAS HK:N SININEN,VAIKKA ONKIN PUNAINEN.MISTÄKÖHÄN MAHTAA OLLA KYSE??!!	50
fin	-1	Pahinta tässä on, että en edes halua lopettaa käyttöä, koska rakastan sitä euforista olotilaa.	17
fin	-1	Älä sorru menemään huoriin.	5
fin	-1	"Nimimerkki ""Luontoihminen"" on kyllä hyvin näyttänyt itse tuon onnen kätkevän.."	13
fin	-1	Tyypillistä hörhöilyä.	3
fin	-1	Minulla ei ole varaa olla valvomatta, ja niitä hetkiä on elämässä joissa en aina ole onnistunut valitettavasti.	19
fin	-1	Ikävä on kirjoitustasi rakas..	5
fin	-1	Näkee miten sinua katkeroittaa vieläkin 74 v kuluttua kun neukku ei ajautunut yksin sotaan Saksaa vastaan jo -39 vuonna ja tuhoutunut.	22
fin	-1	Sikamaista rahastusta alle 10 min hommasta, jossa tarkistetaan vain näkö ja sekin vain 1.0 asti, jolloin ei saa itselleen edes todellisen näön tietoa.	26
fin	-1	Oletko sinä nyt vain niin helvetin tyhmä ettet edes raukka ymmärrä kun sinulle vittuillaan ja sinua pilkataan ihan jatkuvasti?	20
fin	-1	Mutta rikosilmoitus on tehty ja paskakommentteja tutkitaan.	8
fin	-1	Tolvanako Eduskuntaan?	3
fin	-1	Se antaa uskottavuutta, kun selittää, miksei ole lasten takia korppikotkastaan eronnut, vaikka seksinpuute vaivaakin ankarasti.	19
fin	-1	Tässä se nyt nähtiin, Täällä meidän lintukodossa piilotellaan asioita, Ai ai, ja Kokko haluaa lisää kavereita tänne, Mites se suu sitten pannaan kun rupeaa tapahtumaan, Ollaan kaikki kysymässä neuvoa Kokon oven takana??	39
fin	-1	On vaikea kuvitella, että Karsikkaan ilmapiiri olisi vielä ahdistavampi!	11
fin	-1	Kaikki saatanan punikkireuhakkeet sitä on joka päivä suuna päänä ja perseenä.	12
fin	-1	Miksi täälä ei saisi valittaa??	7
fin	-1	Ai niin osaathan sinä lukea, mutta ymmärryksesi kaipaa uutta informaatiota ja paljon pysyäkseen evoluution tasolla.	17
fin	-1	hölmö akka.	3
fin	-1	Kyllä minä sinulle osaan sanoa sanottavani tälläkin nikillä, että nyt sormi pois perséestä ja järki käteen.	18
fin	-1	Ihan ylhäisessä yksinäisyydessään hän jaksaa provosoida täällä!	8
fin	-1	Ahneella on paskanen loppu.	5
fin	-1	Se ns. triviaali kieliongelma poistuu kun saadaan Saimaan-alue, sekä pari tunturia saadaan aidattu pois Junttilandian natiiviväestön käytöstä.	19
fin	-1	Pelkureita olete mun mielestä kun tuntemattomina tässä haukute.	9
fin	-1	Miks sit kirjottelet tänne?	5
fin	-1	Vanhuksia ja mamuja vaan virroille lisää	6
fin	-1	Ei saatana	2
fin	-1	en ala	2
fin	-1	siis voi kamala, ettekö oo tienny aiemmin tästä!	10
fin	-1	"Hyi minua kamalaa petoa!"""	6
fin	-1	Hakukaan ei löydä mitään zonelabsiin viittaavaa.... :( nyyh nyyh...	12
fin	-1	Näitä en kaipaa elämääni enään.	6
fin	-1	Mamujengit ryöstää ihmisiä keskellä päivää.	6
fin	-1	Tämä urpo ei ole tainnut ikinä Alfa 156:ta ajaakaan.	12
fin	-1	ei vidu mitä paskaa	4
fin	-1	Oikein ärsyttää, kun olen suuren osan elämästäni nutannut ällöttävien siteiden, pikkuhousunsuojien ja tamponien kanssa.	17
fin	-1	Naisvihasi on tympeää.	4
fin	-1	Kaikki hyvätkin aloitukset pitää turmella typerääkin typerimmillä Viroa ja virossa matkailevia mollaavilla kirjoituksilla.	14
fin	-1	Inhoan öitä, kun haluaisi nukkua, mutta ei nukuta 😠😠😠	11
fin	-1	Vittu ku oisin ollu jonossa etummaisena, niin en olis väistäny niitä.	13
fin	-1	Ylellä pelätään, astuminen eteenpäin ja uuteen aikaan on kauhean vaikeaa.	12
fin	-1	Kummalta tuntuu, moni mies vakuuttelee että ei hänellä ole tauteja mutta eipä kysy mitä tauteja minulla on.	19
fin	-1	Britit oli ensimmäisen maailmansodan kaunalla aivopestyjä pikku paskiaisia kuten ranskalaisetkin.	11
fin	-1	Tämä lupaus kiihdyttää muslimit tänäkin päivänä sotimaan, tappamaan ja murhaamaan toiveenaan päästä Muhammadin lupaamaan paratiisiin.	17
fin	-1	Se mulkku uskoo tummaihoista Obamaa, joka on osoitus harvinaisen alhaisesta älykkyystasosta.	13
fin	-1	Mitäs merkitystä sillä on mun elämälle?	7
fin	-1	No kukas ne etelän tulokkaat sitetn elättää.	8
fin	-1	Meillä vain tällä hetkellä välimatkaa 200km ja ikävä on kova :(	12
